AdText,Category,Platform
Why don't more people know about this? Anyone turning 50 in the next 5 years is rushing to get this Health Insurance coverage: https://bit.ly/3fknqwP HEALTHEXCHANGEUSA.NET Born Before 1977? Men Should Look At This Before Paying for Health Insurance President Biden believes that every American should have access to affordable health insurance and has made a vow to protect it under his new leadership. This could mean offering a public health insurance option similar to Medicare increasing the value of tax credits to lower premiums and extendin...,political,Facebook
Well Faux President Biden promised to get every American out of Afghanistan before the troops were removed. I guess he forgot when all the troops left today. This was so messed up - Americans left behind but thousands of unvetted Afghanis were brought back.  Its sad the pictures from Afghanistan now of the barbaric treatment of Christians and especially the women living there.,political,Facebook
Why don't more people know about this? Anyone turning 55 in the next 5 years is rushing to get this Health Insurance coverage: https://bit.ly/3w5j6rQ HEALTHEXCHANGEUSA.NET Born Before 1972? Women Should Look At This Before Paying for Health Insurance President Biden believes that every American should have access to affordable health insurance and has made a vow to protect it under his new leadership. This could mean offering a public health insurance option similar to Medicare increasing the value of tax credits to lower premiums and extendin...,political,Facebook
"How can we help you? We have ""unexpected event"" accident policies that will pay you thousands of dollars cash if you were to get hurt in an unexpected event - money you can use any way you want to. We have the NEW Deductible Buster that will pay you $5000 cash if you get hospitalized for any reason - use it to pay the deductible of any policy you may have. We have a $69 ""Free Preventative Rider"" that gives you all the ACA Compliant ""Free Preventative Services"" - we have nationwide PPO Medigap plans that will give you the best MediGap coverage available. We have 2022 Obamacare with the new Biden lower subsidy income qualifications that we can quote for you today AND we have Non-Obamacare Private Carrier PPO coverage which is accepted Nationwide not connected to your income. We have dental vision and hearing coverage. We offer immediate coverage life insurance from $100k up with no paramed check - which is most important today!! Call us at 803-215-7678 or visit our website @ - we are here to help you and we are your personal Advocate when you work with us. AIKENHEALTHINSURANCE.COM Aiken Health Insurance Our licensed professionals provide health and life insurance rates and information to South Carolina Residents.",political,Facebook
Why don't more people know about this? Anyone turning 45 in the next 5 years is rushing to get this Health Insurance coverage: https://bit.ly/3y2I2lE HEALTHEXCHANGEUSA.NET Men Born Before 1982: Don't Pay for Health Insurance Until You See This President Biden believes that every American should have access to affordable health insurance and has made a vow to protect it under his new leadership. This could mean offering a public health insurance option similar to Medicare increasing the value of tax credits to lower premiums and extendin... Learn More,political,Facebook
Why don't more people know about this? Anyone turning 30 in the next 5 years is rushing to get this Health Insurance coverage: https://bit.ly/3fi6Ygl HEALTHEXCHANGEUSA.NET Women Born Before 1997: Don't Pay for Health Insurance Until You See This President Biden believes that every American should have access to affordable health insurance and has made a vow to protect it under his new leadership. This could mean offering a public health insurance option similar to Medicare increasing the value of tax credits to lower premiums and extendin... Learn More,political,Facebook
Why don't more people know about this? Anyone turning 50 in the next 5 years is rushing to get this Health Insurance coverage: https://bit.ly/3fvWv1h HEALTHEXCHANGEUSA.NET Men Born Before 1977: Look At This Before You Pay for Health Insurance President Biden believes that every American should have access to affordable health insurance and has made a vow to protect it under his new leadership. This could mean offering a public health insurance option similar to Medicare increasing the value of tax credits to lower premiums and extendin...,political,Facebook
Why don't more people know about this? Anyone turning 50 in the next 5 years is rushing to get this Health Insurance coverage: https://bit.ly/3ybKExC HEALTHEXCHANGEUSA.NET Men Born Before 1977: Don't Pay for Health Insurance Until You See This President Biden believes that every American should have access to affordable health insurance and has made a vow to protect it under his new leadership. This could mean offering a public health insurance option similar to Medicare increasing the value of tax credits to lower premiums and extendin... Learn More,political,Facebook
Instead of calling our foreign adversaries to produce more oil President Biden must unleash AMERICAN oil & gas producers in West Texas.  Midland > Moscow Odessa > OPEC Permian > Putin,political,Facebook
This ad was taken down because it goes against Facebook Advertising Policies.,political,Facebook
85000 More Haitians are marching to BIDEN'S OPEN BORDER. Democrats support an illegal foreign invasion! THIS IS A CRIME.,political,Facebook
"RESIDENTS CONFLICTED OVER WATER TREATMENT PLANT REPAIRS For years elected officials have talked about and agreed that our water plant is in serious need of some repairs and at risk of failing hundreds of thousands of people. Millions of dollars have been squandered by past elected officials some still sitting today on frivolous projects instead of performing the needed repairs on our main water plant. Now the decision has to be made to issue the nearly $100 million dollars worth of debt that tax payers will be on the hook for or vote it down. The pay back would be 30-40 years and a whopping $164 million dollars. Certificates of Obligation are paid back by property taxes or other local revenues. The issuance of this debt would almost certainly lead to many property tax increases over a 40 year period along with some water rate increases unless paid back quickly.  An alternative to issuing this debt is for City Council and City Management to be responsible stewards of the people's money and use the funds they have available to pay for the plant repairs without issuing this debt. The city recently received 21.8 million dollars from Biden's American Rescue Plan that could be applied to the plants repairs receives about $15 million dollars per year from the Pioneer Energy Contract for the purchase of the cities wastewater and Odessa Development Corporation could contribute $20 million dollars to the repairs it is your sales tax dollars anyway. This is half of what the project will cost and the rest can be made up from the general fund and future Pioneer revenue. The repairs can be done without issuing more debt or raising property taxes and water rates. The problem with this plan is that Tom Sprawls Detra White Steve Thompson and Mari Willis  current City Council members want to use the available monies on ""fun or frivolous projects"" rather than the water treatment plant.  There is little doubt that the water treatment plant must be repaired sooner than later. The question is how the repairs are paid for. Do we allow a 40 year payout or do we replace some of our current city council members and elect some help for our conservative members that are trying to do the right by their constituents? If debt has to be written to do these repairs then I say vote Sprawls Willis and White out of office Dave Ramsey up and pay this debt off in less than 5 years so that the repairs can be made without raising peoples taxes and water rates. These millions of dollars that are available should be allotted to the water project. There should be no more pet projects or frivolous spending until the basic needs of the people are met.  People have mixed feelings about this project and do not know who or what to believe only that they do not want to be without water. Odessa's City Council will vote on this issue July 27th 2021. If you are for this debt then make sure to hold your council members accountable in how they pay it back. If you are against the debt you may sign a petition at any one of the following locations prior to July 27th.  The locations are:  Paul Evans Flooring 301 N Grant  Jack Jordon's BBQ 1501 JBS Parkway  Mama's Kitchen 1534 E 8th St  Jack Bain CPA 5101 Wayland Drive  Custom Wholesale Supply 2324 Kermit Hwy  WOW! Fashion Warehouse 815 N Grandview  Crow Insurance 3908 Tanglewood  Walker Air Conditioning 5402 Andrews Hwy",political,Facebook
Why don't more people know about this? Anyone turning 35 in the next 5 years is rushing to get this Health Insurance coverage: https://bit.ly/3ybWwj6 HEALTHEXCHANGEUSA.NET Women Born Before 1992: Don't Pay for Health Insurance Until You See This President Biden believes that every American should have access to affordable health insurance and has made a vow to protect it under his new leadership. This could mean offering a public health insurance option similar to Medicare increasing the value of tax credits to lower premiums and extendin... Learn More,political,Facebook
Why don't more people know about this? Anyone turning 45 in the next 5 years is rushing to get this Health Insurance coverage: https://bit.ly/3w3tctl HEALTHEXCHANGEUSA.NET Women Born Before 1982: Look At This Before You Pay for Health Insurance President Biden believes that every American should have access to affordable health insurance and has made a vow to protect it under his new leadership. This could mean offering a public health insurance option similar to Medicare increasing the value of tax credits to lower premiums and extendin...,political,Facebook
"Because Joe Biden insists on attacking the unvaccinated we now find ourselves at a place in history where Americans are cheering on the fact that their fellow Americans are being ostracized from everyday life. Even here in a red state like Texas where life liberty and property are supposed to be hallmarks of society every day we are seeing more and more Texans being removed from their jobs schools and other stations in life for simply making a health decision best fits their life situation.  And that divide only deepens when we see Biden and the democrats saying things like the unvaccinated people were ""not nearly as smart as I thought you were."" We see the media pushing narratives like blaming the unvaccinated for the continuation of the pandemic Biden's poor approval numbers hindering economic growth costing jobs and putting unnecessary strain on the healthcare system.  We now live in a country where our borders are being overwhelmed; consumer prices are nearing record highs inflation is quickly pushing us towards a recession employers cannot find help and spending is out of control. And the most common narrative being pushed out of the Whitehouse and in the media is that the unvaccinated are being labeled unemployable and are being ostracized from society so that we can protect the vaccinated from the unvaccinated because the unvaccinated refuse to get the vaccine that didn't protect the vaccinated in the first place.  Personal agency over our own lives is one of the most fundamental tenents of a free society. If you have chosen to be vaccinated because you believe it protects you and it is what's best for you then it shouldn't matter if others are vaccinated because you are protected. And if you are unvaccinated because you believe that it is your right to make healthcare decisions for yourself and your family then what someone else's healthcare choices are should be none of your concern. We have somehow found ourselves in this quasi-socialist communist place where too many Americans now believe the interests of society somehow trump those of the individual. Our nation was founded on the rights of the individual not those of the community. And if we desire to continue to remain a free society and have personal agency over our lives we must move away from this collectivist ideology and return to the ideology of individual rights spelled out by our founders which has served us well for nearly 250 years.  And it starts by electing people who are willing to stand up for you and fight for your individual rights. I will go to Austin to represent you! Not the special interest groups and lobbyists. Not some board I was appointed. And not some group I am a member of. We have enough of those in Austin.  Visit my website and join my campaign by supporting us either through volunteering or financially as we take on the people working against you!",political,Facebook
It's crazy how some Americans are well aware of what's happening in #Australia but yet here they remain silent as the Joe Biden administration continues its war on our freedoms.  It could happen here too.,political,Facebook
"Kamala Harris was interviewed this week on her trip to Guatemala. During the interview she blatantly lied when asked if she'd been to the border saying ""we've been to the border"". When pressed with the fact she had not been down to the border she said ""I haven't been to Europe either"".  We can understand why you haven't been to Europe Kamala you weren't tapped by the President to lead the response to the European border crisis. What we can't understand is how you were tapped to address the crisis at our southern border more than 75 days ago and you STILL haven't visited it. So far you have absolutely FAILED in your responsibility to address the Biden border crisis.  Rather than recognizing the Biden administration's failures and taking responsibility you're traveling to Guatemala and Mexico to meet with leaders who are telling you what we already know: it's the BIDEN administration's policies that are the problem.  Your trips to those countries are nothing more than an attempt to distract Americans from the real root cause of this migration: the Biden administration's REFUSAL to enforce President Trump's border policies such as eliminating catch and release finishing the wall and enforcing the Remain in Mexico.  Stop deflecting. Stop laughing. Do your job. Visit the border and end this Biden border crisis.",political,Facebook
President Biden believes dogs are better than unmarked TSA agents. #FreedomFirst #CancelTheTyrants #GA2022 #FackrellforSenate #FackrellvsWarnock,political,Facebook
Because we're unable to determine your age we cannot show you this ad.,political,Facebook
Mandating over 100 million Americans to receive the COVID-19 vaccination is both unprecedented and a complete overreach of the federal government. Its clear that the COVID-19 vaccine saves lives and I have and will continue to encourage Kansans to get it. With that being said I firmly believe that every American has the constitutional right to consult with their healthcare provider and decide what's best for them and their families.  Additionally these mandates are a crushing blow to Kansas small businesses as they try to get back on their feet and navigate the growing labor shortage. Our hospitals are already stretched thin with medical professionals in rural Kansas and cannot afford to lose workers who do not wish to be vaccinated.  President Biden using the power of the White House to mandate and force private businesses to comply with federal mandates is dictatorial behavior and completely unacceptable. I will continue to do everything I can in Congress to fight against these federal mandates to help ensure personal liberty and freedom for all Kansans.,political,Facebook
Sometimes the damage one fool can cause cannot be undone by a thousand wise men  That fool is the inept unaware unintelligent leader of the free world and unfortunately the leader of The United States Joe Biden. What a disgrace what an embarrassment what a tragedy ! He lies every time he speaks & misleads the people. He said that he had studied every possibility & contingency before leaving Afghanistan yet thousands of innocent people cannot be evacuated. America has never been so humiliated and it will be extremely difficult for other allies to trust America. The Chinese the Russians the Iranians & more are ecstatic to have such a fool running this country. You would think that after 20 years if you decide to leave you will do so in an organized and efficient and safe manner but no not Joe Biden. You would think that after 50 years as a senator and Vice President you would know better ! But not Joe not Joe Biden. The death of thousands of people and further instability in the middle east is his doing. If anyone should ever be forced out of office its this fool ! His whole administration and his election has been full of fraud and deceit ! He is back in hiding again and the country is left without any leadership. They say a people deserve the leadership they get. The millions that say they voted for Biden got their leader unfortunately those who knew better will suffer for the mistakes of those Biden voters too !,political,Facebook
Who's The True Puppet of Choice Joe Biden or Kamala Harris?  The leftist powers-that-be are turning on Biden (over the Afghanistan fiasco.) All else Biden has messed up but Afghanistan is his undoing? Why? Is Afghanistan the sacrifice to get him out of office to impeach him over incompetence to get Harris the puppet of all puppets in?,political,Facebook
Bidens vaccine mandate is UNCONSTITUTIONAL!!  I have a message for the corporations and institutions who are threatening to enforce Joe Bidens vaccine mandates: they are UNCONSTITUTIONAL!!  Employers: Stand up for your employees LIBERTY AND FREEDOM! We the People are watching!,political,Facebook
Joe Biden must have loved the 1970s so much that hes trying to bring it back for us. High crime urban flight inflation gas shortages high taxes and chaos in the Middle East. What next Jimmy Carter.at least we could look forward to the Charles Bronson type movies coming back perhaps Death Wish 2022?,political,Facebook
Why don't more people know about this? Anyone turning 40 in the next 5 years is rushing to get this Health Insurance coverage: https://bit.ly/3hpc8Kj HEALTHEXCHANGEUSA.NET Men Born Before 1987: Don't Pay for Health Insurance Until You See This President Biden believes that every American should have access to affordable health insurance and has made a vow to protect it under his new leadership. This could mean offering a public health insurance option similar to Medicare increasing the value of tax credits to lower premiums and extendin... Learn More,political,Facebook
Why don't more people know about this? Anyone turning 55 in the next 5 years is rushing to get this Health Insurance coverage: https://bit.ly/3bnhRfG HEALTHEXCHANGEUSA.NET Women Born Before 1972: Look At This Before You Pay for Health Insurance President Biden believes that every American should have access to affordable health insurance and has made a vow to protect it under his new leadership. This could mean offering a public health insurance option similar to Medicare increasing the value of tax credits to lower premiums and extendin...,political,Facebook
"I know many of you are very nervous about what the President said today. This is an attack on your personal liberties and for the past 18 months you have seen them under attack by the Gov punishing those that disagree with her radical agenda. Now we hear what the party in power tells us ""Our patience are wearing thin"" with those that want to make their own decisions. That is downright scary. The Gov and Biden are doing everything they can to divide us against each other shame us and punish us. This is not what America is about and it is certainly not what compassionate leadership is about. I will not stand by while they continue to take more and more of our freedoms from us while exercising more control. I will be a Governor that will fight against Washington DC to protect your freedoms. We will win this fight together.",political,Facebook
Why don't more people know about this? Anyone turning 60 in the next 5 years is rushing to get this Health Insurance coverage: https://bit.ly/3blv9cI HEALTHEXCHANGEUSA.NET Men Born Before 1967: Look At This Before You Pay for Health Insurance President Biden believes that every American should have access to affordable health insurance and has made a vow to protect it under his new leadership. This could mean offering a public health insurance option similar to Medicare increasing the value of tax credits to lower premiums and extendin...,political,Facebook
President Bidens unconstitutional vaccine mandate will only worsen the growing labor shortages across our state.  A recent ABC/Washington Post poll showed that 72% of Americans who do not wish to be vaccinated would rather quit their job than follow the mandate.  This is disastrous for small businesses in Eastern Kansas.,political,Facebook
The United States of America helped win World War 1 and won and beat Hitler and Nazism and the Japanese imperialists in World War 2. The U.S. helped millions of Eastern Europeans gain freedom from the tyrannical Soviet Union and the brutal Communist regimes. It prevented South Korea from having to share the terrible fate that rules North Korea. Without the U.S. the world would be a different place. It would be a terrible world with dictatorships and global tyranny in most countries. Yet this superpower just left a country Afghanistan in the most unprofessional incompetent manner possible. This happened after 20 years of blood sweat and tears and trillions of American taxpayer money. Why did this happen ? It happened because of a mentally deranged and disturbed incompetent leader who is stricken by dementia and mental disabilities with an inflated ego. He left his people as hostages. The U.S. Had military personnel and bases and airport control and 300000 Afghani military men and women with billions of modern weapons. It voluntarily gave up this position of control to the Taliban a terrorist organization. VOLUNTARILY ! It did this before evacuating American citizens and Afghani allies and taking all the lates weaponry. ! Biden took the worst option possible. The complete truth about what happened and why is not clear yet but Biden truly screwed up and made another secret deal with the Taliban and the Chinese. This man is truly callous and a murderous traitor. He has abandoned Americans and Afghani aliies for political reasons. He does not care about human life even his own people. He lies with every opportunity and has his people lie too. Biden took a position of complete power and control and exchanged it with a position of weakness and lack of control and chaos and is dependent on a terrorist regime for the fate of Americans abandoned there. Only a madman could be capable of such stupidity and madness.,political,Facebook
Why don't more people know about this? Anyone turning 65 in the next 5 years is rushing to get this Health Insurance coverage: https://bit.ly/3ya7wxx HEALTHEXCHANGEUSA.NET Women Born Before 1962: Don't Pay for Health Insurance Until You See This President Biden believes that every American should have access to affordable health insurance and has made a vow to protect it under his new leadership. This could mean offering a public health insurance option similar to Medicare increasing the value of tax credits to lower premiums and extendin... Learn More,political,Facebook
Joe Biden has violated his duty as president! 1) The courts ruled the rent moratorium is unconstitutional he tried to over ride the court and issue one anyway and then said by the time it gets challenged we will get a little more time instead of upholding the Constitution he his deliberately going against it 2) he swore to protect and serve the American people He has done nothing to close our border! If he is still in office when I get elected my first order of business willl be to impeach him and everyone else that subverts the Constitution. America First!,political,Facebook
Recent Monmouth poll finds 32% think Biden won only because of fraud. My question is why do people care so much about this 32% and not more about the other 68%?! Can we stop pretending that the 32% who think this are anything but absolute idiots?! All opinions are not EQUAL,political,Facebook
Are you braver than Senate Republicans? If so please sign and share this petition! Are we still America the brave or have we become fear-filled conformists willing to ignore this monumental moment to restore our democracy? ACT.TAMMYDUCKWORTH.COM Demand a Commission to Investigate January 6th Insurrection Sign the petition calling on Senate Republicans to vote in favor of creating a bipartisan commission to investigate the January 6th insurrection at the Capitol and events leading up to it. We need to get to the bottom of what happened that day.,political,Facebook
Why don't more people know about this? Anyone turning 60 in the next 5 years is rushing to get this Health Insurance coverage: https://bit.ly/3y8vtFn,political,Facebook
