AdText,Category,Platform
Why don't more people know about this? Anyone turning 50 in the next 5 years is rushing to get this Health Insurance coverage: https://bit.ly/3fiCVFy HEALTHEXCHANGEUSA.NET Born Before 1977? Women Should Look At This Before Paying for Health Insurance President Biden believes that every American should have access to affordable health insurance and has made a vow to protect it under his new leadership. This could mean offering a public health insurance option similar to Medicare increasing the value of tax credits to lower premiums and extendin...,political,Facebook
Joe Biden's failed policies are affecting North Carolinians.   Rental cars are up 43%  Gas is up 42%  Hotels are up 18%  Groceries are up 10%  Rent prices are up almost 3%  We can't continue living like this. No family should have to choose between getting gas or putting food on the table. As your Senator I will fight for EVERY American's pocketbook.,political,Facebook
If Joe Biden cannot answer questions from the press then he should not be leading America.  End of story.,political,Facebook
President Biden kept his promise to the Taliban but *not* to hundreds of Americans.  If President Trump had done this Nancy Pelosi and the Dem-led House would have already started impeachment proceedings.  Truly a sad day for America!,political,Facebook
The Biden administration war on women continues. Pregnant women in the United States are now referred as a Birthing Person. How much longer until we are saying under his eye?,political,Facebook
AG Merrick Garland has threatened Governor Abbott for doing his job in using DPS to turn back illegal migrants at our border.  Joe Biden has turned our border into a disaster zone completely undoing the work of President Trump. We need a Texas Border Wall and mandatory E-Verify to stop this crisis.,political,Facebook
Russian SVR Espionage / Nasdaq Stock - Net Element NETE Securities & Exchange Commission Chair Gary Gensler Chairman 100 F Street NE Washington DC 20549  Federal Bureau of Investigation Christopher Wray 935 Pennsylvania Ave NW Washington DC 20535  There is a current ongoing Russian threat to American national security that has burrowed into the very heart of our economic system. Americans need to know that the Russian foreign intelligence service SVR (the spy agency and successor to the KBG) is penetrating and jeopardizing our economic system through a Nasdaq shell company called Net Element.  Tactical Rabbit a Pennsylvania-based private intelligence agency uncovered this through our network of former CIA FBI Secret Service and military intelligence specialists who operate worldwide. Tactical Rabbit has launched HUMINT (interpersonal human intelligence) operations against specific SVR-related targets. Our findings revealed that Vladimir Putin is directly involved in Net Element. CEO Oleg Firer an ambassador to Grenada was directly given his diplomatic cover by Putin himself. Net Element was launched with the mission to spy on Americans and to penetrate the U.S. economic system.  Putin believed it was critical for a diplomat to head Net Element to provide a high level of cover and immunity from U.S. Law Enforcement agencies. Firer also has direct connections to at least three groups of Russian organized crime as well as the Russian SVR. Russian intelligence controls him and he is their asset.  I Everett Stern founder of Tactical Rabbit filed a SEC whistleblower claim against Net Element and the SEC has responded in kind. I am drafting this public letter to ensure the SEC follows through on eliminating a deadly threat from our economic system.  It is our hope that the FBI raids the Miami headquarters of Net Element and takes any Russian operatives into custody. I provided a full intelligence report conducted by Tactical Rabbit to the FBI CIA SEC and the Treasury Department.  Both the Russian GRU and SVR intelligence services plan to use Firer and Net Element as agents of influence within the U.S. -- covertly influencing U.S. public opinion and U.S. policymakers -- and to acquire restricted U.S. technology. They can also provide legitimate commercial cover to Russian intelligence officers operating inside the U.S. to help spot and assess potential U.S. citizens of operational interest and to covertly move and transfer large amounts of money in and out of the U.S. to fund Russian intelligence operations.  Through their association with a high-profile and wealthy Russian businessman Firer and Net Element have developed business ties and associations which have possibly allowed them to clandestinely acquire restricted dual-use (civilian and military) U.S. technology in the battery and electric vehicle sectors for passage to Russia.  All the money Net Element makes keeps going back to Moscow. But whats important is the technology. Its also taking American citizens information and sending it back to Moscow.  Everett A. Stern M.B.A Intelligence Director Tactical Rabbit United States of America  #NationalSecurity #russia #Putin #stockmarket #stocks #nasdaq #lawenforcement #wallstreet #Biden,political,Facebook
Why don't more people know about this? Anyone turning 65 in the next 5 years is rushing to get this Health Insurance coverage: https://bit.ly/3tGp5BM,political,Facebook
Why don't more people know about this? Anyone turning 30 in the next 5 years is rushing to get this Health Insurance coverage: https://bit.ly/3w53Jja HEALTHEXCHANGEUSA.NET Born Before 1997? Men Should Look At This Before Paying for Health Insurance President Biden believes that every American should have access to affordable health insurance and has made a vow to protect it under his new leadership. This could mean offering a public health insurance option similar to Medicare increasing the value of tax credits to lower premiums and extendin...,political,Facebook
Why don't more people know about this? Anyone turning 65 in the next 5 years is rushing to get this Health Insurance coverage: https://bit.ly/3yc5ZH8 HEALTHEXCHANGEUSA.NET Men Born Before 1962: Don't Pay for Health Insurance Until You See This President Biden believes that every American should have access to affordable health insurance and has made a vow to protect it under his new leadership. This could mean offering a public health insurance option similar to Medicare increasing the value of tax credits to lower premiums and extendin... Learn More,political,Facebook
PRO-LIFE ALERT--The Hyde Amendment protects life by ensuring that no federal taxpayer dollars are used to fund abortions. Joe Biden has removed the Hyde Amendment from his budget and House Democrats in Washington just advanced a spending bill without Hyde Amendment protections.  Before the Hyde Amendment Medicaid paid for almost 300000 taxpayer funded abortions every year.  Without the Hyde Amendment today South Dakota would likely be forced to provide taxpayer funded abortions under Medicaid or be kicked off the federal Medicaid program entirely.  Pro-life South Dakotans: (1) demand that the Hyde Amendment remain the law and (2) think twice about expanding Medicaid. Without the Hyde Amendment more Medicaid = more taxpayer funded abortions.,political,Facebook
On Monday night I'll be proposing a resolution to block the INSANE idea of using YOUR tax dollars to pay people for Covid vaccine incentives. If people want it they get it if they don't your money won't be used to entice them. Full Resolution below:  Title: A Resolution to prevent Chemung County from offering item of value incentives for the COVID-19 vaccine.  MOTION: Brennan SECOND:  WHEREAS the Chemung County Health Department regularly holds COVID-19 vaccination clinics;  WHEREAS the Chemung County COVID vaccination percentage has plateaued at roughly 44%;  WHEREAS the New York City Health Department has offered vaccine incentives including a $100 gift card Brooklyn Cyclones tickets NYC Ferry 10-Ride Pass Statue of Liberty pass and ferry ticket and Family Fun wristband at Luna Park/Coney Island and others;  WHEREAS the City of Memphis TN held a sweepstakes for a free car for any resident who was vaccinated;  WHEREAS the State of California selected 10 winners of $1.5 million each in their Vax for the Win program;  WHEREAS the State of New Jersey offered a free alcoholic drink in May as a part of their Shot and a Beer program;  WHEREAS the State of New York offered free tickets to New York Mets and Yankees games in May and June to as a vaccine incentive;  WHEREAS the Chemung County Health Department held a COVID-19 vaccine clinic on July 23rd at Eldridge Park and offered four free ride tickets as an incentive;  WHEREAS in a WETM interview on July 30 2021 Chemung County Health Director Pete Buzzetti stated that both he and Chemung County Executive Christopher Moss support using cash payments as a COVID-19 vaccine incentive;  WHEREAS Chemung County Executive Christopher Moss held a Facebook Live COVID Update on August 17 2021 in which $100 gift card incentives had been discussed with Chemung County Health Director Buzzetti stating anything we can do to get people to come to us I would support;  WHEREAS offering an item of value as an incentive for COVID-19 vaccination has been met with skepticism by some Chemung County residents;  WHEREAS the Biden Administration has announced plans for COVID-19 booster shots will become available on September 20th; Now therefore be it  RESOLVED that Chemung County will neither: 1.) offer an item of value as an incentive for a prior or new COVID-19 vaccine nor 2.) partner with any governmental non-profit private or other entity as part of a giveaway program which provide item of value incentives for COVID-19 vaccinations.,political,Facebook
Today we witnessed tragedy in Afghanistan as multiple U.S. servicemembers and civilians were killed or injured at the hands of terrorists. Our nation mourns these losses and we are in prayer for their loved ones.  President Bidens foreign policy is disastrous. His involvement with the 2011 withdraw from Iraq created a power vacuum resulting in the growth of ISIS. Ten years later President Bidens foreign policy has once again made the world a more dangerous place by allowing terrorists in Afghanistan to target servicemembers and innocent civilians.  This failure was preventable and nobody is to blame except for President Biden.  President Biden must take decisive action now.,political,Facebook
All eyes are on Biden to do the right thing and #StopLine3  https://www.newsweek.com/line-3-pipeline-would-permanent-stain-bidens-presidency-opinion-1618046?amp=1,political,Facebook
We took down this ad after it started running because the disclaimer doesn't follow our Advertising Policies.,political,Facebook
"Who's Behind The Afghanistan Crises? Biden?  They would not let him out of his basement to campaign much at all. They do not allow him to go off script when he speaks and they go as far as cutting his mic off if he dares to try. He has not hidden the fact that whoever ""they"" are he is in obedience too. --So who are ""they""? And why did ""they"" want the Afghanistan Crises? This is no accident. Biden is just someone ""they"" used to get it done.",political,Facebook
A BLOW FOR IMMIGRATION AND GOVERNMENTAL REFORM  A federal District Court in Houston has struck down the Obama Administrations Deferred Action for Childhood Arrivals (DACA) program and its companion for parents of those children. Specifically it held that the program was an administrative rule making required to follow the notice and comment process of the federal Administrative Procedure Act (APA). The failure of the Obama Administration to follow this process rendered the program illegal. CNN helpfully included a copy of the Order and Opinion of the court here. The decision is not only a step towards effective immigration reform but also strikes a blow against the power of the administrative state.  The court essentially took up the issues ignored in the US Supreme Courts Regents of the University of California opinion previously discussed here. This decision struck down the attempted rescission of the DACA program by the Trump Administration as itself violating the APA while glossing over the illegalities in the original rulemaking. This new federal court opinion turns the tables and focuses on those infirmities noting that the Supreme Court itself held that DACA was not simply a passive non- enforcement policy. Instead it conferred affirmative immigration relief such as the right to receive a work permit and the right to travel abroad without permission. It did so despite admitting in the original memorandum that only the Congress could confer affirmative immigration relief. The district courts opinion built on Justice Clarence Thomass dissent in the Regents opinion by highlighting the real reason for the program  the inability of successive Presidents to unite the Congress and country around an immigration bill that included effective limits and enforcement as well as the necessary relief for longtime residents.  The district court was mindful of the hardships an immediate cessation of the program would cause to current participants and simply prohibited further expansion of the program for the time being. The Biden Administration has announced that it will appeal the order and urged Congress to pass a bill fixing the problem. The administrations latter position is correct. Both political parties need to look beyond the twin corruptions of identity politics and corporate contributions to pass a comprehensive immigration reform legalizing the status of the Dreamers and creating real enforceable limits on future immigration as I advocated in this post. A truly comprehensive answer to the immigration crisis would be a new beginning for insuring the American Dream for both lifetime citizens and immigrants alike.    NEWNATIONALISM.COM www.newnationalism.com,political,Facebook
PROTECTING AMERICA AND ITS WORKERS  [With] the recent discoveries of physicians and neurologists engineers and economists the public can formulate minimum occupational standards below which demonstrably work can be prosecuted only at a human deficit. [We] hold that all industrial conditions which fall below such standards should come within the scope of governmental action and controlled in the same way that subnormal sanitary conditions are subject to public regulation and for the same reason - because they threaten the general welfare.  Theodore Roosevelt Presidential Nomination Acceptance Speech at Progressive Party Convention August 6 1912  Hospitals at crisis care levels. Children increasingly infected and hospitalized by the new Delta COVID-19 variant. States forcing businesses to assume the risk of employee and customer infections due to masking prohibitions.  President Bidens vaccination plan attempts to address these new threats from the coronavirus pandemic. Americans are understandably weary of all of the restrictions and frustrated by the failure of our federal and state governments to develop a clear path out of them. The way to examine the necessity of the plan is to ask three questions:  1. Is it a good idea? 2. Is it legal? 3. Is there a better way to do it?  Is it a good idea?  As I said in my post Wasting Americas Moment the vaccination program is an effective and uniquely American response to the pandemic. Vaccinations significantly reduce the likelihood of hospitalization and eliminate the risk of death not only for recipients but also potentially for the unvaccinated. They are also our best way to achieve a return to normality in life by allowing business and government to reopen by lessening their liability for workers compensation and customer liability. The toll on our children should also concern us and supports a masking mandate in at least elementary schools.  Is it legal?  The Occupational Safety and Health Act of 1974 grants the Federal government the power to regulate workplace safety to reduce workplace hazards including illnesses. This law has existed for over three decades and its legality has repeatedly been upheld. In particular section 6 (c)(1) gives the President through the Department of Labor Occupational Safety the right to issue Emergency Temporary Standards (ETS) when employees are exposed to grave danger from exposure to substances or agents determined to be toxic or physically harmful or from new hazards and (B) that such emergency standard is necessary to protect employees from such danger. 29 U.S.C.  655(c)(1). This cannot be done by mere executive order. The proposed ETS must be reviewed by an advisory committee drafted and then published in the Federal Register. While it becomes immediately effective at upon publication it expires after six months if not renewed through the usual notice and comment procedure under the federal Administrative Procedure Act. See this description of the process on OSHAs website  Thus it will be at least a week before any rule or mandate is adopted. Based on the statement from the White House the rule will allow employees to escape the vaccination requirements through weekly negative COVID-19 testing. Many other issues will need to be addressed and the President has met with business and labor leaders to begin to resolve them. They will also be hashed out by the advisory committee.  Is there a better way do it?  The new emergency standard is unique since it will apply not just to certain industries but to to almost every type of workplace in the nation. Imposing a mandate of this breadth should be the province of the Congress not an administrative agency. Acting through legislation instead of an OSHA rulemakings would have allowed the administration to include measures that are outside of the agencys power such as providing federal financial support for the small number of employees who may suffer adverse reactions to the vaccine. Even more importantly it would have forced Republicans and Democrats in Congress to confront the issues both specious and valid about our pandemic response. Such a debate would have exposed the weaknesses in both the anti-vaxxer and permanent lockdown camps which may be why both sides want to avoid it. However The eventual result would not fully satisfy the Dr. Anthony Faucis or Rep. Marjorie Greens of the world but it might satisfy the average American trying to run his or her life in a responsible and caring manner.  Nevertheless we appear to be stuck with the OSHA emergency standard as the only likely method of spurring vaccinations and stopping the surge in the current Delta variant of COVID-19. If opponents want to be helpful they will start demanding that the Biden Administration set a clear metric for when vaccination and masking mandates will end. What number they pick - whether it is cases hospitalization rates or death rates - matters less than the simple courageous act of making a decision and setting a goal for the American people to rally around. Only then will we move beyond irresponsible political rhetoric and see the light at the end of this dark tunnel.  Please visit the website version of this post to see the referenced links. NEWNATIONALISM.COM 508 Resource Limit Is Reached,political,Facebook
"""With President Trump we had Peace through Strength and with Joe Biden we have Violence through Weakness @kayleighmcenany on @FoxNews",political,Facebook
I served as an infantry soldier in Iraq not Afghanistan but the events of the past 2 weeks have brought to mind a great many thoughts. So to share just a few:  1. Like a great many other veterans Ive generally supported drawing down our presence in Afghanistan. But that was predicated on the assumption that (a) we would certainly give the Afghani army and government every opportunity to defend themselves (b) that we would offer sanctuary to every Afghani who has worked with us and obviously that (c) we would bring every American home safely before withdrawing the military. It is a shameful embarrassment that President Biden failed to do any of the 3.  2. Most of the toughest memories I have from Iraq involve kids. The footage of kids being lifted over the wall as parents willingly give them up to protect them is gut-wrenching.  3. The military is incredibly effective at large-scale offensive operations. For example the entirety of Iraq was taken under our control in 19 days. We could certainly take back control of enough of Kabul and/or Bagram Air Base to enable us to rescue the *thousands* of Americans now behind enemy lines. Its just a matter of will - unfortunately I dont believe President Biden has any.  4. When I came home and the Iraq War was going poorly afterwards some people asked me Was it worth it? Veterans have a wide range of opinion on this but I can only speak for myself. I personally believed in the mission I was on but deep down I stepped forward to serve because its what my country asked of me at the time. Every single war America has ever fought has at one time or another been controversial. We will always question Was it worth it? and people will always come to different conclusions. And so I encourage veterans not to view your service through the lens of politics and what one president or general later does or does not do. What matters is that you stepped up to serve when called and the manner in which you served once you arrived. Thats all you can control - and that is enough.,political,Facebook
Womens liberation organizations & warriors of womens rights & equality where are you ? What are you going to do for the helpless women of Afghanistan who are going to go under severe Sharia law & abuse ? What are you going to do for them when they will lose many of their rights & freedoms under the Taliban rule ? What are you going to say to Biden who you supported who abandoned & betrayed the Afghanis & the women there ? Are you going to remain silent like the hypocrites youve always been unless it is politically expedient to your fake ideology. Do you raise your voices only during elections to bash conservatives & do your dirty work as an arm of the democrat party ? You always call them misogynistic! You always bash conservative women or remain silent when they are wronged ! You also keep silent when democrats abuse or harass women ! You champions of  my body my choice When it comes to abortion do you accept the same slogan & belief for vaccinations & the right of women to choose whether they should be mandated to get the vaccination shot into their  bodies ? Also what are your thoughts on males who feel like women competing in womens competitions & athletics ? Are you happy about that ? I wonder if real men or the male gender should even exist ! You really need to talk to Joe & his administration about all this because any more loss of credibility on your part is going to really eliminate the little relevance & trust you have left !,political,Facebook
