AdText,Category,Platform
For Immediate Release: Our Response To President Bidens Visit to Idaho.  Mr. President We hope you enjoyed your time in Idaho this week. It must be a good feeling to get out of Washington DC. Unfortunately we were not able to connect while you were here. If we had been able to meet there are a few topics we would have discussed:  As with all things in life there are areas you can directly control those you influence and others you have no control over. As President there are clear boundaries about what you can control. As the 10th amendment says you can only do what is explicitly called out in the Constitution. Everything else must be done by influence. The Legislative branch has the ability to create laws but you do not. EVERYTHING else is owned by the states or individuals.  Over the past nine months of your presidency you have consistently overstepped your authority with states rights. Here in Idaho we believe in self-reliance and independence. Idahoans know what is best for Idaho - not you.  In addition the policies you have enacted are negatively impacting the next generation of Americans that we represent:  - Most small businesses are owned by the under 40 group. Increased regulation tax increases and mandates are suffocating small businesses. Thousands have closed their doors.  - Inconsistencies in your COVID communication is causing confusion and mistrust. Decisions on schools impact our children. Parents are trying to juggle careers with potentially having to stay home due to closures. Vaccine mandates risk the jobs for many young professionals. The federal government has no place in requiring private citizens or businesses to be vaccinated. You have violated your promise to never mandate vaccines when you campaigned. It also sets precedent for a scary future. You are not exhibiting leadership. It is coercion.  - The rising inflation is hitting Americans at a time without much discretionary spending available. Inflation is the highest since the 1970s. Home prices are the highest in history. Gas prices are averaging $2 per gallon HIGHER than just 10 months ago. While it may appear great to have a wage increase in jobs it doesnt matter if the cost increase is higher to do business. Those costs are passed down to consumers or businesses stop hiring as many people.  - Your unwillingness to address crime and homelessness in the country is impacting Idaho. Look at Seattle Chicago New York Portland. Do you really believe things are going well there? We have thousands of people from these states fleeing into Idaho because of the failed policies there. This is placing tremendous pressure on Idaho infrastructure land and energy use and more.  - A really in-depth conversation is needed about your foreign and military policy. We are very disappointed in your handling of Afghanistan to put it politely. The mismanagement cost the lives of young Americans.  - You came to discuss wildfires in Idaho but it turned into statements about global warming. While we all agree in being good stewards of the environment you neglected to the discuss the mismanagement of federal lands that make up about 70% of Idaho. This increases the likelihood of devastating forest fires.  Overall if you look at many of the nations key performance indicators almost all of them are trending worse than just one year ago. You must recognize this. Your poll numbers are lower and decreasing faster than any President during their first year in office.  Please recognize that we arent seeking to condemn. We genuinely want to help. You are the President currently. If you fail America fails. Please let us know if you have time to discuss further. Wed be happy to meet with you.  Oh one last thing It seems like every time you try to take questions your microphone stops working. Wed be happy to buy you a megaphone so you dont run into these technical issues anymore.  Sincerely Idaho Young Republicans    #idpol #idleg,political,Facebook
Read full article: Congresswoman Hinson blasts Democrat spending plan  Iowa First District Congresswoman Ashley Hinson a Republican from Marion voted against raising the debt limit in the House Tuesday. We are hearing the Democrats in Washington D-C talking about cutting a trillion or two from a multitrillion-dollar social spending spree like they should get a pat on the back for that for being fiscally responsible Hinson says.  And I think it is very clear to Iowans that these are not nickles and dimes  we are dealing in trillions of dollars here. And the Democrats have forgotten how many zeros are in trillions.  Hinson says her vote sends a message on Democrat spending. It is critical of course that we do not default on our debt. But it is equally important that we dont let democrats spend as much as they want on whatever they want to. Or to signal to them that we will give them a pathway to do that in the future she says.  A proposal to have banks track accounts with 600 dollars or more in them is part of the Democrats spending proposal. Hinson is not in favor of the idea. Its a completely invasive policy we heard Speaker Pelosi acknowledge that for the first time Hinson says.  The Biden Administration says the proposal is designed to find people who are NOT paying taxes they owe. I can tell you loud and clear Iowans do not want the I-R-S to monitor when they are paying their bills or making a big grocery store run. I think about families making a big trip to Costco or HyVee and stocking up. Why does the government need to know that? Thats exactly why I have been leading the charge against this in Washington D-C with my legislation the Protecting Financial Privacy Act according to Hinson.  Hinson says the proposal is a way to expand the size of the I-R-S. We need more border patrol agents  not more I-R-S agents right now Hinson says.  Her comments came during her weekly conference call with reporters.,political,Facebook
"When a Democratic President is on the receiving end of this type of commentary from CNN it can safely be called a catastrophe:  ""Biden also ran for office in 2020 on a platform of competence and he styled himself as a foreign policy expert. It is hard to look at the debacle of recent days and see those qualities at work. Most of Biden's televised predictions -- that the Taliban wouldn't suddenly overtake Kabul and there would not be a Saigon-style exit for the US -- were wrong.""  40 years of time in office and no leadership to speak of. And for those seeking impeachment remember Biden's number two is VP Harris an absolute disaster.  The US needs authentic strong and unapologetic leadership now more than ever.",political,Facebook
Why don't more people know about this? Anyone turning 45 in the next 5 years is rushing to get this Health Insurance coverage: https://bit.ly/3bniS7A HEALTHEXCHANGEUSA.NET Men Born Before 1982: Don't Pay for Health Insurance Until You See This President Biden believes that every American should have access to affordable health insurance and has made a vow to protect it under his new leadership. This could mean offering a public health insurance option similar to Medicare increasing the value of tax credits to lower premiums and extendin... Learn More,political,Facebook
Yesterday officially marked the 1st day three of my bills went into effect in the State of Arizona!  1. HB2111- Arizona is now officially a 2nd Amendment Sanctuary State! Biden can try all he wants to take away our gun rights but Arizona will not comply.  2. HB2889- All child sex crimes in Arizona are now officially straight time without the chance of parole or early release and includes life in prison!  3. HB2110- All Arizona courts must now allow you the option to perform community service to pay off speeding tickets if you can't afford to pay it. This is 100% optional.,political,Facebook
Biden said white supremacists are the most lethal threat to America!  Have we all missed something here do we not see it ? I have not seen or heard of a white supremscist for a while now ! Are they just hiding to come out later ? Ive seen a lot of anarchists marxists Antifa & BLM & communists riot burn & loot & destroy ! Are those all white supremacists pretending to be something else ?,political,Facebook
Why don't more people know about this? Anyone turning 40 in the next 5 years is rushing to get this Health Insurance coverage: https://bit.ly/3bpsKhd HEALTHEXCHANGEUSA.NET Born Before 1987? Men Should Look At This Before Paying for Health Insurance President Biden believes that every American should have access to affordable health insurance and has made a vow to protect it under his new leadership. This could mean offering a public health insurance option similar to Medicare increasing the value of tax credits to lower premiums and extendin...,political,Facebook
Why don't more people know about this? Anyone turning 55 in the next 5 years is rushing to get this Health Insurance coverage: https://bit.ly/2SPMpk0 HEALTHEXCHANGEUSA.NET Women Born Before 1972: Don't Pay for Health Insurance Until You See This President Biden believes that every American should have access to affordable health insurance and has made a vow to protect it under his new leadership. This could mean offering a public health insurance option similar to Medicare increasing the value of tax credits to lower premiums and extendin... Learn More,political,Facebook
Why don't more people know about this? Anyone turning 60 in the next 5 years is rushing to get this Health Insurance coverage: https://bit.ly/3vYSjNO HEALTHEXCHANGEUSA.NET Men Born Before 1967: Don't Pay for Health Insurance Until You See This President Biden believes that every American should have access to affordable health insurance and has made a vow to protect it under his new leadership. This could mean offering a public health insurance option similar to Medicare increasing the value of tax credits to lower premiums and extendin... Learn More,political,Facebook
Some advice for Joe Biden & The White House  Trust in JESUS like you trust in the vaccine.  Promote JESUS like you promote being vaccinated.  Our country would be a lot better off if the values our Nation was founded on were talked about and implemented In DC.  Kentucky is coming for you DC swamp!,political,Facebook
As the debate about Mask Mandates continue there are many schools in Minnesota that have made it clear they will be recommending masks be worn BUT the decision about masking in school will be ultimately up to the individuals and families of their districts at this time. It is important to understand that due to an executive order signed by President Biden masks still must be worn when riding public transportation/bus.  The state is also recommending that schools maintain 3 feet of distance between students (when possible) improve ventilation and require people who test positive for COVID-19 to quarantine for 10 days. Unvaccinated people who have close contact with someone who tested positive should also stay home they said but vaccinated people don't need to stay out of school unless they show symptoms of illness.  Currently school districts can make the decision themselves regarding mask mandates and other such policies. I am personally excited to see that as of 7/22/2021  Superintendent Truebenbach is leaving the decision of masking in schools to the individuals and families of the Big Lake School district. {7/22/2021  letter to families from Superintendent Truebenbach} -concerning face coverings- *Face coverings will not be required for students or staff but are recommended for those not vaccinated. This applies only to inside school facilities and for outdoor settings. *Face coverings are required on student transportation regardless if individuals have been vaccinated. This is a federal requirement signed by President Biden and is not optional for school districts to change.  This decision joins the Big Lake District with the Elk River Anoka/Hennepin Buffalo Monticello and other school districts throughout the State of Minnesota that have chosen to keep the choice of mask use in the hands of the individual and families instead of imposing a restrictive mandate.  As we come into this new school year and the discussions about restrictive policies concerning COVID-19 continue it is important to also look at the factual statistics regarding the negative impact the pandemic restrictions had on the mental health of youth and adults alike. Some helpful resources for this information can be found here:  ---  ---   I support keeping masks and other restrictive policies of this type in the capable hands of the individuals and families throughout our District and State. Though there is an increase in cases because of the Delta Variant the science and data available currently reflect that we are nowhere near the risks we once faced.  We now have more information than we had at the beginning of the pandemic. We have vaccines and we have been able to learn about the impacts restrictive policies had on the wellbeing of our children and families. As a society we cannot afford the overall mental health academic success and interpersonal development of our youth to be compromised by emotionally charged theatrics.  Our most precious asset our youth cannot withstand having their education experiences and wellbeing be destroyed by a game of politics and fear. The solution can never be worse than the problem.,political,Facebook
Class is in session. Stand. Pledge. Sit.  Attention Trump Save America Pac donors/would be donors: Trump has not spent even a dime on ANY ballot reviews Donald Trump has been promoting.  FACT Out of the $75 Million in donations the former President has ranked in in 2021 alone donations have thus far gone to Trumps travel Trumps legal fees and Trump's staff. Much of the donations are being held in cash. Currently the Arizona recount via Cyber Ninjas is being paid for via private donations which are not being disclosed.  So when you see a post from Trump or Trumps Save America Pac that say We need you to join the fight to SECURE OUR ELECTIONS! you are just donating to one of the former Presidents most lucrative funds. NONE of this money is actually going to ANY elections previous or moving forward.  Lets look at some other elections facts because the big lie is kinda getting old now and any 12 year old that can do research for a book report could find this information if they chose to.  FACT Republicans OUTPERFORMED Democrats up and down ballot in the 2020 election.  Republicans gained 13 seats in Congress with zero losses by GOP incumbents. Every House Republican in a tossup race won. A record 35 Republican women won election to Congress. Republicans won 59 of 98 state legislative chambersa net gain of two state houses and 141 seats across the country.  FACT There are even Republicans that won in their own election in 2020 that say the election was rigged. For example in Arizona Paul Gosar and Andy Biggs both objected to the certification of the election for Joe Biden based on fraud DESPITE the fact that they won in their own elections. So if the election was rigged against Donald Trump how would Republicans then win their own seats? Paul Gosar and Andy Biggs are not the only ones. Republicans Lauren Boebert Marjorie Taylor Greene and Andrew Clyde all won in Georgia. I could go on. In other words how could Democrats able to rig the election for Joe Biden to win yet they seemingly were unable to rig down ballot elections? Shouldnt these Republicans ask for a recount of their own wins if voting in these states are in question?  And what about Dominion voting machines?  FACT Dominion software was not used in ONLY states that Trump lost and/or states that Trump has filed lawsuits in. The fact of the matter is that this software was used in TWENTY-FOUR STATES.  FACT Dominion software was used in. ONLY SIX STATES that went BLUE for Biden. These include Nevada Arizona Wisconsin Michigan Pennsylvania and Georgia. The remaining EIGHTEEN was won by Donald Trump.  FACT Donald Trump filed lawsuits in the above six states but DID NOT in the ladder eighteen.  So WHY would Dominion software be hacked in some way in just six states when these machines could have all been hacked to vote for Biden? Why JUST these six? And WHY isnt Trump filing lawsuits in ALL 24 STATES? In theory wouldnt you want to file lawsuits in every state that used Dominion as to find out what it was about just these six states machines?  And for that matter how do we know that if fraud occurred some of the dominion software in states that went red could have in the same way have been hacked to go red when they REALLY went blue?  Just totally stupid right?  So lets discuss whats really going on here with this election and just MOVE ON because this debate got stale months ago. Donald Trump lost this election for TWO main reasons.  1. Trump lost voters. These voters either switched to Biden or they did not vote for President and voted for Republicans down ballot. Here is the specific breakdown of 2020 voters per Pew:  *Biden made gains with suburban voters. In 2020 Biden improved upon Clintons vote share with suburban voters: 45% supported Clinton in 2016 vs. 54% for Biden in 2020. This shift was also seen among White voters: Trump narrowly won White suburban voters by 4 points in 2020 (51%-47%); he carried this group by 16 points in 2016 (54%-38%). At the same time Trump grew his vote share among rural voters. In 2016 Trump won 59% of rural voters a number that rose to 65% in 2020.  *Trump made gains among Hispanic voters. Even as Biden held on to a majority of Hispanic voters in 2020 Trump made gains among this group overall. There was a wide educational divide among Hispanic voters: Trump did substantially better with those without a college degree than college-educated Hispanic voters (41% vs. 30%).  *Apart from the small shift among Hispanic voters Joe Bidens electoral coalition looked much like Hillary Clintons with Black Hispanic and Asian voters and those of other races casting about four-in-ten of his votes. Black voters remained overwhelmingly loyal to the Democratic Party voting 92%-8% for Biden. Biden made gains with men while Trump improved among women narrowing the gender gap. The gender gap in the 2020 election was narrower than it had been in 2016 both because of gains that Biden made among men and because of gains Trump made among women. In 2020 men were almost evenly divided between Trump and Biden unlike in 2016 when Trump won men by 11 points. Trump won a slightly larger share of womens votes in 2020 than in 2016 (44% vs. 39%) while Bidens share among women was nearly identical to Clintons (55% vs. 54%).  *Biden improved over Clinton among White non-college voters. White voters without a college degree were critical to Trumps victory in 2016 when he won the group by 64% to 28%. In 2018 Democrats were able to gain some ground with these voters earning 36% of the White non-college vote to Republicans 61%. In 2020 Biden roughly maintained Democrats 2018 share among the group improving upon Clintons 2016 performance by receiving the votes of 33%. But Trumps share of the vote among this group  who represented 42% of the total electorate this year  was nearly identical to his vote share in 2016 (65%). Biden grew his support with some religious groups while Trump held his ground. Both Trump and Biden held onto or gained with large groups within their respective religious coalitions. Trumps strong support among White evangelical Protestants ticked up (77% in 2016 84% in 2020) while Biden got more support among atheists and agnostics than did Clinton in 2016.  *After decades of constituting the majority of voters Baby Boomers and members of the Silent Generation made up less than half of the electorate in 2020 (44%) falling below the 52% they constituted in both 2016 and 2018. Gen Z and Millennial voters favored Biden over Trump by margins of about 20 points while Gen Xers and Boomers were more evenly split in their preferences. Gen Z voters those ages 23 and younger constituted 8% of the electorate while Millennials and Gen Xers made up 47% of 2020 voters.  *A record number of voters reported casting ballots by mail in 2020  including many voters who said it was their first time doing so. Nearly half of 2020 voters (46%) said they had voted by mail or absentee and among that group about four-in-ten said it was their first time casting a ballot this way. Hispanic and White voters were more likely than Black voters to have cast absentee or mail ballots while Black voters were more likely than White or Hispanic voters to have voted early in person. Urban and suburban voters were also more likely than rural voters to have voted absentee or by mail ballot.  2. Republicans opted to not vote because they were told that the election was rigged and that their vote would not count. Donald Trump told his Republican voters for months and months prior to the election that the election would be rigged if he did not win. This is because he had internal polling that showed he was losing the election due to his handling of COVID19. As such Republicans simply did NOT make use of early voting they instead voted on election day. Conversely Democrats overwhelmingly opted to vote by mail.  And here is one last piece of data that might clear up any remaining doubt. Donald Trump did not win in 2016 by the millions and millions of voters that he says he did folks.  FACT Trumps victory was so small in fact that he actually won in 2016 because of 77000 votes in three states Michigan Pennsylvania and Wisconsin. Almost three million MORE voters voted for Hillary Clinton. To put this into perspective you could fit all of the people that Trump won the election with into ONE SINGLE SMALL FOOTBALL STADIUM.  Trump isnt spending his money on election fraud claims because he knows there was no election fraud folks.  Extra Credit  Trump has been known to trick people into donating more then they had intended. Although its difficult to pinpoint an exact number of how many people were duped there is a figure that suggests lots of people ended up donating more money than they intended. Trumps campaign refunded 10.7 percent of the money raised on the Republican Partys fundraising platform WinRed. That amounted to around $122 million in online donations in 2020 ALONE.  Trump's own disclaimer notes that Trump may shift campaign-donor money into his private buisnesses.  Thats all.,political,Facebook
Dear Georgians  President Biden is implementing a spending plan designed to inflate the cost of goods and services by at least 70% over the next 2 years. Xi Jinping is assisting him with this operation/attack.  They are manipulating our supply chain while they prepare to flood the system with cash.  It's why you see hundreds of ships in the ocean full of products that can't be unloaded.  They are preparing to overwhelm the system with cash at which point they will unleash the massive buildup of products into the market place all at once.  Prices will spike dramatically in a matter of weeks.  Life is about to be very expensive for all of us.  #FreedomFirst #CancelTheTyrants #GA2022 #FackrellforSenate #FackrellvsWarnock,political,Facebook
Since February border agents have made more than one million arrests of illegal migrants attempting to cross into our country. Thats more people than I represent in Congress  by a long shot. Its more people than the population of President Bidens entire home state of Delaware. More people are illegally crossing than weve seen in decades yet Biden continues to ignore the problem.  Our border cities are at a breaking point. Local law enforcement cannot keep up with the cartels and gangs resulting in drastic increases in crime along our border. This isnt seasonal migration its a monumental crisis. Even the far-left editorial board of the Washington Post agrees.  To make matters worse DHS reported that 1 in 5 migrant families they release into our country have tested positive for COVID putting the health of our border agents and communities along the border at high risk. The Biden Administration is doing nothing to prevent COVID-positive migrants from entering our country  in fact theyre bussing them to cities across the nation.  Biden is too busy using the power of the White House to attack political opponents that hes allowed the border crisis to spiral out of control. The failed policies of the Biden Administration are directly to blame.  Enough is enough we need real leadership to restore security to our Southern border.,political,Facebook
Hey United States Intelligence Agencies  Your motivation for protecting Fauci Biden and Xi Jinping are understandable. We're (the United States) liable for many trillions of dollars for releasing the virus intentionally. It's our bad.  However.  This Lie is out of your control. You don't get to decide this one. Not this time.  Here's how this works: you pull your heads out of your asses and start protecting our country from danger greater than money or Truth begins Raining Everywhere in Uncontrollable Waves.  No one cares about your pride. No one but you.  We're done with your Lies.  Truth is coming.  God is Watching.  #FreedomFirst #CancelTheTyrants #NewVaccineTechnology #VaccineWhip #FauciLiedPeopleDied #FauciTheMonster #XiJinpingLiedPeopleDied #GA2022 #FackrellforSenate #FackrellvsWarnock,political,Facebook
