AdText,Category,Platform
"The state of this world is getting scary. It's unfortunate that many do not see it.  Millions are marching around the world in protest every weekend against COVID-19 lockdowns vaccine mandates and the removal of civil rights liberties and freedoms. With at least a hundred thousand protesting in cities and towns around Australia.  ""If you forget the past you are doomed to repeat it."" ""I don't agree with what you say but I'll give my life defending your right to say it.""  Two very important statements the kids of today are not being taught. Free speech is something the whole world needs. Even racist hatred and down right evil things need to be allowed to be said. Gives us the opportunity to hit back through words NOT violence.  Let's start with Covid-19:  The fear being pushed by politicians and the media about COVID-19 is out of control. No I am not one of those that think COVID-19 is a hoax. COVID-19 is real. As I read once: Do I believe that people are getting sick? Yes. Do I believe that people are dying? Yes. Do I believe some hospitals are overrun? Yes. Do I believe nurses and healthcare workers are terrified? Yes. Do I believe China is lying about it's numbers? Yes. Do I believe COVID-19 was made in a lab? Yes. Do I believe China is responsible? Yes. Do I believe COVID-19 is being politicized? Yes. Do I believe COVID-19 is being used to strip Americans and Australians of their rights? Yes. Do I believe there's a bigger picture than what politicians and the media are telling us? Yes. Do I believe this is more about power and control than anything else? Yes. Do I believe we as Australians just set a dangerous precedent for our freedoms? Yes... and I am much more terrified of that than any virus.  Am I an anti-vaxxer? No I am 100% for vaccines. Myself and my family are all vaccinated for everything except for the COVID-19 vaccine. No I do not plan to get the COVID-19 Vaccine. I will not inject a vaccine into my body that is being forced upon me. Especially a vaccine that was ready in less than a year. It takes at least 5 years to fully test a vaccine. We do NOT know the long term side effects yet. I am Anti-MANDATORY vaccine I am not Anti-Vaccine. Take the vaccine if you want I support you decision to take it. But don't force it on me.  I do not believe in lockdowns or mask mandates. We lived with Influenza (a virus that had a confirmed 0.13% death rate for the years 2016-2017) for generations without mask mandates or lockdowns. I used 2016-2017 because they are the latest years where the numbers are confirmed: COVID-19 is far more deadly for over 60's than Influenza particularly those with underlying conditions with a death rate of about 0.66%. However When you account for elderly patients dying to COVID-19 without an underlying condition that death rate drops to 0.2%. Compared to the 0.08% Death rate for under 60's with COVID-19 dropping further the younger the bracket. The Delta variant is less deadly but more contagious. Please note I am talking about the death rate (Your chance to die if you get infected) not number of deaths. These numbers are based from the CDC's own words that 90% of COVID-19 cases will go completely undetected as most of the population is asymptomatic to the COVID-19 Virus. All this information can be found on the CDC website.  Now while the death rate is higher than influenza in the older generation. This is no reason to completely shut down a country even at the high end of 0.66%. No one wants to even talk about the rising rate of ""Self harm"" especially in teenagers due to lockdowns. These lockdowns are causing far more damage than they are preventing Not just in ""self harm"" rates. Source:  Next Abortion:  Abortion is getting out of control. The latest data from Planned Parenthood states that over 98%... YES OVER 98% of the reasons given for Abortion is ""Unwanted Baby"". Less than 2% is due to Rape / Incest. 2 reasons that are the only time I ever agree with Abortion and ONLY before a heartbeat. Source:  Both men and women need to take some responsibility for your own actions. If you cannot afford / want to bring a baby into the world then Wrap it Swallow it Flush it Throw it or just say no. But please STOP using Abortion as a contraceptive. Stop killing babies because you couldn't keep your pants zipped up. I accept that accidents happen but that's the risk you take when you say yes. Deal with the consequences of your actions.  And now for the US itself:  The US is being run by a senile dementia ridden old fart controlled by special interest groups in the hopes of turning America into a communist dictatorship. The Left leaning Mainstream Media is complicit in this they regularly distort the truth to push their own agenda. Notice they are not reporting on the Phone call between President Biden and the Afghan President Ashraf Ghani. A phone call that if it happened under President Trump He would be rightfully impeached before the media could even report on it.  In this phone call President Biden's own words pressured President Ghani to distort the truth: President Biden to President Ghani: ""And theres a need whether it is true or not there is a need to project a different picture."" Source:  This is not the first time President Biden has pressured another country to help him politically: Then Vice-President Biden with President Obama's backing threatened to withhold aid money if a prosecutor that was investigating the company Hunter Biden was working at was not fired. Source from then Vice-President Biden's own lips:   There are multiple other examples of corruption lies and propaganda by the Biden administration and it's buddies in the media. However this post will become a novel if I continue. Follow me for more examples in future posts.  And finally Australia:  Australia itself is sliding down a dark path. Our country is done as we know it if the population doesn't wake up and soon.  Queensland is opening a concentration camp in the center of the state. Source:  Victoria is the next communist China puppet state. Led by a known Communist supporter. Source: Multiple other articles showing the corruption of Daniel Andrews.  The Federal Government just passed a spy bill. Allowing them to access our phones and upload or delete data at will. Source:  The media around the world doesn't even care that Australia has begun a process to strip its citizens of what little rights we had. I fear that most Australians have forgotten what happened 80 years ago. We don't even have the means to defend ourselves any more they are scared another Eureka Stockade will happen.  It is time for Australians to take a stand. It is time for us to take our country back but we need help. We need the world to care about what is currently taking place in Australia.  Australia must ditch the crown. We must become a Constitutional Federal Republic. We do not have a Bill of Rights that needs to change. We deserve our freedom. But we must earn it first.  I ask that you like Follow and share this page if you wish to support this cause.",political,Facebook
Why don't more people know about this? Anyone turning 55 in the next 5 years is rushing to get this Health Insurance coverage: https://bit.ly/3bsdnEC HEALTHEXCHANGEUSA.NET Men Born Before 1972: Look At This Before You Pay for Health Insurance President Biden believes that every American should have access to affordable health insurance and has made a vow to protect it under his new leadership. This could mean offering a public health insurance option similar to Medicare increasing the value of tax credits to lower premiums and extendin...,political,Facebook
Why don't more people know about this? Anyone turning 45 in the next 5 years is rushing to get this Health Insurance coverage: https://bit.ly/2SQFHdx HEALTHEXCHANGEUSA.NET Women Born Before 1982: Don't Pay for Health Insurance Until You See This President Biden believes that every American should have access to affordable health insurance and has made a vow to protect it under his new leadership. This could mean offering a public health insurance option similar to Medicare increasing the value of tax credits to lower premiums and extendin... Learn More,political,Facebook
I just voted NO on the Democrats Infrastructure legislation.  Our nation is in desperate need of infrastructure reform and investment but this bill is not the way to do it. Democrats have made it abundantly clear that this legislation is simply a trojan horse for President Bidens radical Build Back Better agenda and paves the way for a laundry list of socialist policies.  Out of the total $1.2 trillion of spending in this package only $110 billion is directed towards roads bridges and other real infrastructure projects that our communities need.  Most importantly the pay-fors in this bill come up short. Over $400 billion of the $1.2 trillion price tag is unpaid for adding to our skyrocketing national debt and once again forcing hardworking Kansans to pick up the tab.,political,Facebook
Why don't more people know about this? Anyone turning 65 in the next 5 years is rushing to get this Health Insurance coverage: https://bit.ly/3ya7wxx,political,Facebook
Why don't more people know about this? Anyone turning 45 in the next 5 years is rushing to get this Health Insurance coverage: https://bit.ly/2R7N8g1 HEALTHEXCHANGEUSA.NET Born Before 1982? Men Should Look At This Before Paying for Health Insurance President Biden believes that every American should have access to affordable health insurance and has made a vow to protect it under his new leadership. This could mean offering a public health insurance option similar to Medicare increasing the value of tax credits to lower premiums and extendin...,political,Facebook
Biden implies Americans are too simple to understand supply chain issues or inflation. Do you know what Americans understand? They know that this president is failing and they can't afford to go food shopping.,political,Facebook
As Americans we seem to be drifting further apart every second of every day. The level of hatred can be felt almost anywhere you go in this country and its even worse online. People just dont seem to like each other anymore right? But why? Wars? Riots? Masks? Covid? Vaccines? Minimum wage? Abortion? Taxation? Trump? Biden? The Pope? Conservatives? Liberals? We could go on and on and   If you had a megaphone (or the virtual equivalent of one) and could speak to every single person in America at the exact same time what would your message be?  P.S. look no further than the comments on this post to get a flavor for whats happening in America.,political,Facebook
"Biden said ""The bottom line: we're going to protect vaccinated workers from unvaccinated co-workers"". The ""unifier in chief"" is resorting to the age-old practice of divide and conquer and pitting citizen against citizen. This is not going to work! Each week the rallies in Middletown and surrounding communities are just getting larger. They are ready to stand up for their freedom and be heard. Instagram video created by James at @renegaid_art Every Monday @4pm in the #Walmart parking lot on Rt211 in #MiddletownNY let your voice be heard! If you oppose the #vaccine #mandates come make a stand against #tyranny! #Vaccinated and #unvaccinated all are welcome! Details at the end of the video! #antifa #antivax #nojab #OCNY",political,Facebook
If the $3.5 TRILLION bill costs $0 like Biden says why do we need to raise the debt ceiling ,political,Facebook
CIC: Which of these best apply to Joe Biden ? Commander in Chief Corrupt in Chief Criminal in Chief Cheat in Chief Charlatan in Chief Clown in Chief,political,Facebook
Bidens abuse of power is just getting started. Taking action towards getting the right people in office has never been more important. Share the message ask how you can join the campaign or donate to the cause. If there has ever been a time for you to take part and take action it is now.,political,Facebook
As Oregons current governor has neglected to issue this statement as Oregons next please allow me.  First: Thank you to our military men and women who were boots-on-the-ground in Afghanistan for your service and everything you sacrificed these past two decades. Im sorry your Commander in Chief let you down. Your efforts deserved a more dignified end.  Second: Whether or not we belonged in Afghanistan is a different discussion but the fact is - we were there. As such there was a right way and a wrong way to exit and President Biden you chose the wrong way. You placed our military and civilians in great danger. You left our Afghan allies to be slaughtered. You ensured their women would lose what few rights they had. You left our own weaponry behind to be used against us. You allowed thousands of imprisoned terrorists back out onto the streets.  My formal education is in the international relations arena so my mind automatically goes to the domino effect you have created. You have weakened the worlds perception of America which emboldens our enemies. If I had to bet right now China is looking toward Taiwan as a means of verifying your weakness.  But go ahead. Put the teleprompter away and go back on vacay. Its probably for the best.,political,Facebook
The only person who should be deciding whether you get a COVID-19 vaccine is YOU!  Not Joe Biden. Not Kamala Harris. Not Anthony Fauci. Not anyone else. #stopthemandates,political,Facebook
"BIDEN: ""You guys are bad. I'm not supposed to be answering all these questions. I'm supposed to leave but I can't resist your questions.""  Puppet. Im not supposed to. What? Are we 5?",political,Facebook
Why don't more people know about this? Anyone turning 40 in the next 5 years is rushing to get this Health Insurance coverage: https://bit.ly/3bsdrUS HEALTHEXCHANGEUSA.NET Born Before 1987? Men Should Look At This Before Paying for Health Insurance President Biden believes that every American should have access to affordable health insurance and has made a vow to protect it under his new leadership. This could mean offering a public health insurance option similar to Medicare increasing the value of tax credits to lower premiums and extendin...,political,Facebook
As Texas Attorney General I will fight with every legal avenue available to stop the Biden administration from rolling back laws and policies that were working and effectively stemming illegal immigration.  Part of the solution to the border crisis is for Texas and other freedom-loving red states to bring the battles to the courtroom - and win. Every time the Biden Administration does something unconstitutional a multi-state coalition of myself and other hard-charging State Attorneys General will be there to push back against Bidens devastating border policies. Illegal immigration undermines the rule of law creates chaos at the border wreaks havoc with the lives of those migrating to our border under false hopes and is an insult to the immigrants who comply with our laws to gain entry and achieve citizenship. Learn more at,political,Facebook
Never in American history has a a person acting as President an imposter a fraud a liar a cheat  an incompetent fool a corrupt charlatan clown & failure & mentally disabled like Joe Biden so blatantly lied to the people on every subject ! The lying & misinformation runs through his entire administration due to his terrible leadership or lack of it.  Bidenesque the art of saying the exact opposite of what you are doing & doing the exact opposite of what you say !,political,Facebook
President Joe Biden and the Democrats are committed to pushing their multi-trillion dollar boondoggle upon the American people. But this plan doesnt just come with an expensive price tag  it is filled with radical ideas that will weaken our economy and reorder America as we know it.  To be clear this package:  Forces $2.1 trillion in tax increases on American families and job creators  Imposes Green New Deal polices and destroys American Energy Independence  Allows over $10 billion in federal funding to go toward abortions  Weaponizes the IRS by allowing for monitoring and tracking of almost every single bank transaction made  Provides amnesty to millions and millions of illegal immigrants  Leaves rural America behind by failing to allocate any funds for critical programs like broadband the commodity safety net crop insurance and disaster assistance  This radical spending package is nothing more than a Trojan Horse for the Democrats to force their extreme socialist agenda on the American people.  And the American people are already seeing and experiencing the negative consequences of their failed policies  rising prices Open Borders labor shortages.  It is time to bring back the smart commonsense Republican policies that created a prosperous America with economic growth record unemployment and border security.  Americas future is at risk and we must do everything we can to flight these Far-Left Socialist policies that will only set our country back.  I will do everything in my power to stand against these radical ideas and fight for conservative values and principles like limited government free enterprise and Peace Through Strength that have made our country great.,political,Facebook
"Have you noticed the absence of the obnoxious journalists & reporters since Biden got elected ? I am talking of the bought and paid for democrat operatives acting as news people like Jim Acosta & Jake Tapper & Brian Stelter & the Cuomo boy..........Chris Cuomo  just to name a few. They are absent because they know that everyone knows they are fake journalists. Questioning Biden like they questioned President Trump or rather harassed him with lies and misrepresentations would be too revealing of Biden and his spokespersons & their incompetence and lies & ineptness.They would make Jen Psaki look like the nut she is & the whole Biden administration would be exposed. They would lose favor & perhaps their jobs if they crossed who holds their leash. The democrats have such plants as fake journalists in all of the MSM including the NY Times and WAPO. They also control and dictate to their giant social media servants.These organizations are an arm of the corrupt democrat party. With Trump they were eager to create false scandals and crises but with Biden they cover up his major blunders and incompetence.Just take a look at the Afghanistan debacle and mess. look at the border crisis the inflation and the Covid mess. Look at the prices of food and gas. Look at the constant lies & all the other disasters in about 7 months ! If any of this was under Trump I think he would have been crucified and I mean literally crucified. They have no shame or honor to do a job well done with honesty and integrity. They have become perverted by the democrats & are a major part of the corruption. Once the media was the watchdogs over the politicians but now they are the lapdogs of the democrat party. The few mentioned above are just a few of many more fake journalist in MSNBC ABC NBC CBS  CNN LA Times NY times & WAPO and much more including FOX. I cannot forget to mention the stellar Rachel Maddow and Don Lemon & cute blinking eyes Anderson Cooper. There are too many more to mention but they are obvious to anyone who watches the media ! One of the greatest competent men to become president Donald Trump was trashed and demonized endlessly and a real corrupt demon Joe Biden has been lionized & made into a hero despite almost 50 years of constant failures & lies and deception. With the help of the fake & dishonest journalists and fake media & the corrupt democrat machinery & soulless activists Joe Biden was supposedly the winner of the Presidential elections. If you believe that Joe Biden got 80 million votes sitting in the basement you got to also believe that the famous ""Brooklyn Bridge"" was sold to 80 million people 80 million times. If you believe that I still have a bridge in Brooklyn to sell to you.",political,Facebook
