AdText,Category,Platform
WI: Get The Facts About Voting | This Is A Democracy | Voters Will Decide Who WinsAd aclu.org In a democracy the will of the people will prevail. If we all vote everyone wins. Voters will decide this election. Make a plan to vote today.,political,Google
Health Care Costs Are Rising | Contact The White HouseAd ourhealthcarecosts.com Trump's policies have caused premiums and out-of-pocket costs to rise. Learn how you might be affected if you have a pre-existing condition.,political,Google
Have a Pre-Existing Condition? | Trump's Changes Affect You | Contact The White HouseAd ourhealthcarecosts.com The Trump administration is trying to eliminate protections for pre-existing conditions. Find out how his changes are affecting Americans.,political,Google
Are You Paying More in Taxes? | Trump's Tax Law is a Bad Deal | Taxes are Rising for FamiliesAd letsbehonestusa.com The vast majority of the benefits of Trumps tax law go to corporations and the wealthy. At the same time taxes are going up for many working families. We are footing the bill.,political,Google
Ests inscrito en Medicaid? | Trump quiere cortar cobertura | Trump recortara los fondosAd hablemosclarousa.com La ley de impuestos de Trump dispar el dficit y quiere cortar Medicaid para pagarlo No debe quitarse el cuidado mdico de ciudadanos para pagar recortes de multimillonarios,political,Google
Contact The White House | Have a Pre-Existing Condition? | Trump's Changes Affect YouAd ourhealthcarecosts.com Find out how his changes are affecting Americans. The Trump administration is trying to eliminate protections for pre-existing conditions.,political,Google
Contact The White House | Have a Pre-Existing Condition?Ad ourhealthcarecosts.com Find out how his changes are affecting Americans. The Trump administration is trying to eliminate protections for pre-existing conditions.,political,Google
Contact The White House | Have a Pre-Existing Condition? | Trump's Changes Affect YouAd ourhealthcarecosts.com The Trump administration is trying to eliminate protections for pre-existing conditions.,political,Google
Tell Senator Mark Kelly | Speak Up for AZ Families | Stop the Reconciliation BillAd onenationamerica.org Liberals want to force through a massive tax-and-spend bill but it will cost you. Tell Sen. Kelly to speak up for AZ families and oppose the current reconciliation bill!,political,Google
Arizona Demands Bipartisanship | Help Senator Kyrsten Sinema | Protect the Sen. 60-Vote RuleAd onenationamerica.org The radical left wants to change the rules to ram through their partisan agenda. Tell Senator Mark Kelly to protect the Senate 60-vote rule like Senator Sinema.,political,Google
Tell Senator Mark Kelly | Protect Access to Medicine | Keep Government Out of ItAd onenationamerica.org Liberals want to let the government limit which drugs patients have access to. Tell Sen. Kelly to oppose limiting access to prescription drugs.,political,Google
Tell Senator Maggie Hassan | Protect Access to Medicine | Keep Government Out of ItAd onenationamerica.org Liberals want to let the government limit which drugs patients have access to. Tell Sen. Hassan to oppose limiting access to prescription drugs.,political,Google
Tell Senator Cortez Masto | Protect Access to Medicine | Keep Government Out of ItAd onenationamerica.org Liberals want to let the government limit which drugs patients have access to. Tell Sen. Cortez Masto to oppose limiting access to prescription drugs.,political,Google
Protect Access to Medicine | Keep Gov't Out of Healthcare | Call Senator Mark Kelly NowAd onenationamerica.org Liberals want to let the government limit which drugs patients have access to. Tell Sen. Mark Kelly to oppose limiting access to prescription drugs.,political,Google
Tell Senator Mark Kelly | Stop Liberal Partisanship | Protect the Senate RulesAd onenationamerica.org Both Pres. Biden and Sen. Sinema say no to changing the Senate 60-vote rule. Tell Sen. Kelly to say no to the radical left and protect the Senate rules. Call now!,political,Google
Pres. Biden Wants to Give Away | American Vaccine Technology | Stop the Foreign GiveawayAd onenationamerica.org We lead in the Covid-19 recovery but Biden wants to give away our vaccine technology. Call Pres. Biden and tell him to stop the foreign giveaway of American vaccine technology!,political,Google
Stop Vaccine Foreign Giveaways | Did China Lie About COVID-19? | Tell Biden to Not Reward ChinaAd onenationamerica.org Biden wants to give American vaccine technology to China. Call Joe Biden and tell him to stop rewarding China with American vaccine technology!,political,Google
Sen. Kelly Listens to Schumer | Not ArizonaAd onenationamerica.org Voting with Sen. Schumer 98% of the time refusing to stop his liberal power grab. Tell Sen. Mark Kelly to listen to Arizona and protect the Senate 60-vote rule. Call now!,political,Google
Protect Vaccine Patents | Stop the Foreign Giveaway | Tell President Biden NowAd onenationamerica.org American scientists & researchers delivered safe & effective vaccines in record time. Tell Pres. Biden to oppose vaccine patent waivers by calling now!,political,Google
Tell President Biden | Protect Healthcare Innovation | Oppose Vaccine Patent WaiversAd onenationamerica.org American scientists & researchers delivered safe & effective vaccines in record time. Tell Pres. Biden to stop the foreign giveaway of our technology by calling now!,political,Google
Stop Liberal Partisans | Stand with Sen. Sinema | Protect The 60-Vote RuleAd onenationamerica.org Help Sen. Sinema stop radical liberal politicians from changing the U.S. Senate rules. Call Sen. Mark Kelly and tell him to protect the 60-vote rule!,political,Google
Tell Senator Mark Kelly | Fight Voter Fraud | Oppose S. 1Ad onenationamerica.org S. 1 would gut AZ laws requiring any form of ID before voting. Dont let Liberals hijack our election security. Tell Sen. Kelly to oppose S. 1.,political,Google
Tell Senator Kyrsten Sinema | Fight Voter Fraud | Oppose S. 1Ad onenationamerica.org S. 1 would gut AZ laws requiring any form of ID before voting increasing voter fraud. Dont let Liberals hijack our election security. Tell Sen. Sinema to oppose S. 1.,political,Google
Tell Senator Joe Manchin | Fight Voter Fraud | Oppose S. 1Ad onenationamerica.org S. 1 would gut WV laws requiring any form of ID before voting. Dont let Liberals hijack our election security. Tell Sen. Manchin to oppose S. 1.,political,Google
Tell Senator Maggie Hassan | Fight Voter Fraud | Oppose S. 1Ad onenationamerica.org S. 1 would gut NH laws requiring any form of ID before voting. Dont let Liberals hijack our election security. Tell Sen. Hassan to oppose S. 1.,political,Google
Keep Our Elections Secure | Tell Senator Mark Kelly | Oppose S. 1Ad onenationamerica.org S. 1 implements standards that would make our elections less secure. Call Sen. Kelly and urge him to keep our elections secure and vote No on S. 1.,political,Google
Tell Senator Jon Tester | Fight Voter Fraud | Oppose S. 1Ad onenationamerica.org S. 1 would gut MT laws requiring any form of ID before voting. Dont let Liberals hijack our election security. Tell Sen. Tester to oppose S. 1.,political,Google
Keep Our Elections Secure | Tell Senator Jon Tester | Oppose S. 1Ad onenationamerica.org S. 1 implements standards that would make our elections less secure. Call Sen. Tester and urge him to keep our elections secure and vote No on S. 1.,political,Google
Protect West Virginias Rights | Tell Senator Manchin | Vote No on S. 1Ad onenationamerica.org Urge Sen. Manchin to keep his promise to support the Senate rules. Tell Sen. Manchin to listen to West Virginians over Chuck Schumer and oppose S. 1.,political,Google
Stop the Campaign Handouts | Tell Senator Mark Kelly | Vote No on S. 1Ad onenationamerica.org S. 1 creates a $3.2 billion program to finance campaigns with government-funded subsidies. Call Sen. Kelly to stop the government-funded campaign handouts and vote No on S. 1.,political,Google
Tell Senator Jon Tester | Protect the Filibuster | Stop the Power GrabAd onenationamerica.org Liberals want to change the Senate rules to aid their (liberal) power grab. Tell Senator Tester not to change the Senate rules and vote No on S. 1!,political,Google
Keep Our Elections Secure | Tell Senator Joe Manchin | Oppose S. 1Ad onenationamerica.org S. 1 implements standards that would make our elections less secure. Call Sen. Manchin and urge him to keep our elections secure and vote No on S. 1.,political,Google
Stop the Campaign Handouts | Tell Senator Maggie Hassan | Vote No on S. 1Ad onenationamerica.org S. 1 creates a $3.2 billion program to finance campaigns with government-funded subsidies. Call Sen. Hassan to stop the government-funded campaign handouts and vote No on S. 1.,political,Google
Tell Senator Hassan | Fight for States Rights | Vote No on S. 1Ad onenationamerica.org S. 1 could let DC set the Presidential Primary Calendar. Keep NH First-in-the-Nation. Call Sen. Hassan and urge her to fight for New Hampshire.,political,Google
Tell Senator Maggie Hassan | Protect the Filibuster | Stop the Power GrabAd onenationamerica.org Liberals want to change the Senate rules to aid their (liberal) power grab. Tell Senator Hassan not to change Senate rules and vote No on S. 1!,political,Google
Stop the Campaign Handouts | Tell Senator Jon Tester | Vote No on S. 1Ad onenationamerica.org S. 1 creates a $3.2 billion program to finance campaigns with government-funded subsidies. Call Sen. Tester to stop the government-funded campaign handouts and vote No on S. 1.,political,Google
Stop the Campaign Handouts | Tell Senator Joe Manchin | Vote No on S. 1Ad onenationamerica.org S. 1 creates a $3.2 billion program to finance campaigns with government-funded subsidies. Call Sen. Manchin to stop the government-funded campaign handouts and vote No on S. 1.,political,Google
Keep Our Elections Secure | Tell Senator Maggie Hassan | Oppose S. 1Ad onenationamerica.org S. 1 implements standards that could make our elections less secure. Call Sen. Hassan and urge her to keep our elections secure and vote No on S. 1.,political,Google
We Need New Leadership | A Message from Mike BloombergAd youtube.com Republicans are failing to lead find solutions and bring us together. We wont stand for it. Click to watch my video message.,political,Google
A Higher Purpose | A Message from Mike BloombergAd youtube.com Today calls for Washington to lead to offer solutions to bring us together. Click to watch my video message.,political,Google
Republicans Failed to Lead | A Message from Mike BloombergAd youtube.com Our greatest threats today come from within our borders. From a government failing to act. We wont stand for it.,political,Google
US Congress Passes New Bill | New Solar Bill For Homeowners. | New US Solar Program Passed.Ad primesolarquotes.com State Governments Sign New Bills Passed By Congress For Homeowners. If Your Zip qualifies the Federal Residential Renewable Energy Tax Credit May Pay You.,political,Google
US Congress Signs New Bill | New Solar Bill For Homeowners. | New US Solar Program Passed.Ad primesolarquotes.com State Governments Sign New Bills Passed By Congress For Homeowners. If Your Zip qualifies the Federal Residential Renewable Energy Tax Credit May Pay You.,political,Google
US Congress Grants Solar Bill | New Solar Grant For Homeowners | New US Solar Grant ProgramsAd primesolarquotes.com State Governments Grant New Bill Passed By Congress For Homeowners. If Your Zip qualifies the Residential Renewable Energy Tax Credit May Help You Go Solar.,political,Google
New Solar Programs Available | Start Saving Money Immediately | US Government Solar ProgramsAd primesolarquotes.com New US Government Solar Panel Programs Available To Homeowners Who Qualify. US Government Offering New Solar Panel Programs To Homeowners Who Qualify.,political,Google
US Congress Passes New Bill | New Solar Bill For Homeowners. | New US Solar Program Passed.Ad primesolarquotes.com Charlie Baker & Other State Governments Sign New Bills Passed By Congress For Homeowners. If Your Zip qualifies the Federal Residential Renewable Energy Tax Credit May Help You.,political,Google
$0 Upfront Cost Solar Programs | Best Home Solar Panels | Best Residential Solar OptionsAd primesolarquotes.com Residential solar energy has never been easier to get. Get energy savings quote today! Find best residential solar providers and installers with Prime Solar Quotes.,political,Google
US Congress Passes New Bill | New Solar Bill For Homeowners. | Generate Your Own Solar EnergyAd primesolarquotes.com New US Solar Program Available For Certain Zip Codes. US Government Offering New Solar Panel Programs To Homeowners Who Qualify.,political,Google
Stop Trump's Republicans Now | Donate to save our Majority | Deadline: 11:59 p.m. Sept 30thAd secure.actblue.com Trump's GOP will do whatever it takes to win back the Majorityhelp protect our Democrats. We must protect our House Majority. Donate now! Our critical deadline is just days away.,political,Google
The GOP is attacking democracy | Protect our House Democrats | Donate to stop the House GOPAd secure.actblue.com We can't let Trump's anti-democracy GOP retake the House Majority. Donate now. If the GOP wins democracy is on the chopping block. Chip in before our critical deadline.,political,Google
Speaker of the House Trump? | Stop the GOP takeover | Chip in now save our MajorityAd secure.actblue.com Speaker Trump? If the GOP retakes the House it could happen! Pitch in to stop them. Donate to our End of Quarter goal to protect our Democrats and stop Trump's GOP.,political,Google
GOP Breaks Fundraising Record | Donate to Defend House Dems | Our Majority Hangs By a ThreadAd secure.actblue.com Trump's GOP announced a massive $45 million fundraising haul to defeat our House Dems. If we lose just 5 seats Trump's Republicans will take power! Rush a donation to stop them.,political,Google
We Must Protect Our Majority | House GOP Just Outraised Us | Pitch In Now to Fight BackAd secure.actblue.com We can't let Republicans defeat our House Majority just as we start to Build Back Better. Will you pitch in and help us close our fundraising gap and protect our critical Majority?,political,Google
Republicans Just Outraised Us | Our House Majority is at Stake | Donate to Defend House DemsAd secure.actblue.com Trump's Republicans are smashing fundraising records to seize the House Majority. Our Democratic Majority is razor-thin. We have no room for error. Rush a donation now!,political,Google
Donate Now to House Democrats | Our Majority is in Danger | Deadline ImminentAd secure.actblue.com Our Democratic Majority is razor-thin. We have no room for error. Rush a donation to stop Trump's Republicans from seizing Nancy Pelosi's Majority!,political,Google
Defend Nancy Pelosi's Majority | Donate Now to House Democrats | Deadline ImminentAd secure.actblue.com Trump's Republicans just need to flip 5 seats to erase Nancy Pelosi's House Majority. Before our critical End of Month Deadline: Rush a donation to elect House Democrats!,political,Google
Defeat Trump's Republicans | Donate Now to House Democrats | Deadline ImminentAd secure.actblue.com Trump and his Republicans have raised over $100 MILLION to defeat our House Majority. If we fall short of our End of Month goal our Majority could be in peril. Donate now!,political,Google
Defend Nancy Pelosi's Majority | Donate Now to House Democrats | Our Mid Year Deadline: June 30Ad secure.actblue.com Speaker Pelosi is counting on you to help protect our razor-thin Democratic Majority! Before midnight: Rush a donation to elect House Democrats!,political,Google
Donate Now to House Democrats | Protect our Majority | Our Mid Year Deadline: June 30Ad secure.actblue.com Our Democratic Majority is razor-thin. We have no room for error. Rush a donation to stop Trump's Republicans from seizing Nancy Pelosi's Majority!,political,Google
GOP Aims To Take House | We Must Protect Our Majority | Pitch In Now To Fight BackAd secure.actblue.com We can't let Republicans defeat our House Majority just as we start to Build Back Better. Pitch in what you can to help Democrats protect our critical Majority in 2O22!,political,Google
Dark money attacking Democrats | Help protect our majority now | Pitch in now to fight backAd secure.actblue.com GOP dark money groups pledged tens of millions of dollars to take back the House. Will you pitch in any amount today to help Democrats protect our Majority in 2O22?,political,Google
Dark money flooding to GOP | Help Democrats fight back | Donate to protect our majorityAd secure.actblue.com GOP dark money groups are pledging millions to take back the House majority. Grassroots Democrats are needed to fight back. Pitch in to protect our majority:,political,Google
Nicole Malliotakis | Tax Cuts for The Wealthy | Social Security and MedicareAd nicolemalliotakisthefraud.com Nicole Malliotakis supported giving corporations and the wealthy a permanent tax cut. Paid for by cuts to our Social Security and Medicare. She's a Bad Albany Apple.,political,Google
Nicole Malliotakis | Puts Big Corporations First. | New Yorkers Last.Ad nicolemalliotakisthefraud.com Nicole Malliotakis supported cutting our Social Security and Medicare. And giving corporations a tax cut. Malliotakis is everything that's wrong with politics.,political,Google
Nicole Malliotakis | Tax Cuts For Big Business. | Hurting New Yorkers.Ad nicolemalliotakisthefraud.com Nicole Malliotakis supported giving big corporations and the wealthy tax cuts. With cuts to our Social Security and Medicare. She's everything wrong with politics.,political,Google
Dan Rodimer: Dangerous History | Run-ins with the police | An Alarming & Violent PastAd dangerousrodimer.com Dan Rodimer was arrested and accused three times of assault in Florida. Rodimer's violent history shows he is unfit to represent Nevada in Congress.,political,Google
Can't Count On Jeff Van Drew | He Won't Work For South JerseyAd vandrewputshimselffirst.com Since switching parties Van Drew's raked in special interest and Republican donor money. He voted against oversight of taxpayer-funded corporate bailouts. We can't trust him.,political,Google
Van Drew Is Out For Himself | Leaving South Jersey BehindAd vandrewputshimselffirst.com Jeff Van Drew switched parties to save his own skin. Now his campaign has taken over $500K from corporate special interests and GOP donors.,political,Google
Chip Roy Puts Texas At Risk | Wrong About Covid | Wrong for TexasAd corruptchiproy.com Chip Roy questions the medical experts' advice on the coronavirus and implies the virus is a hoax. Roy is wrong about the virus and wrong for Texas.,political,Google
Van Drew Won't Work For Us | With Him South Jersey LosesAd vandrewputshimselffirst.com Jeff Van Drew switched parties to avoid losing reelection. His campaign's taken over $500000 from corporate special interests and Republican donors.,political,Google
Dangerous Dan Rodimer | Dangerous History | Unfit for CongressAd dangerousrodimer.com Dan Rodimer has a serious history of run-ins with the law: bar fights an arrest for battery and disturbing domestic incidents. He is unfit to represent us.,political,Google
We Can't Trust Jeff Van Drew | Works For Himself Not UsAd vandrewputshimselffirst.com Van Drew's campaign has taken over $500K from corporate interests and GOP donors. He switched parties to save his job then voted against oversight of corporate bailouts.,political,Google
Rep. Chip Roy Is Wrong | Makes False Claims About Covid | Puts Texas Families at RiskAd corruptchiproy.com Chip Roy says that the virus doesn't put kids in danger implied the virus was a hoax and questions medical experts. Roy can't be trusted to protect Texas families.,political,Google
Don Bacon | Raising Retirement Age | Cutting BenefitsAd hellnodonbacon.com Don Bacon supports raising the Social Security retirement age and cutting benefits. Bacon puts special interests first and Nebraskans last.,political,Google
"""Maryland"" Matt Rosendale | Sides With Health Insurance | Not Montana ValuesAd 2020priorities.com Maryland Matt Rosendale is a typical politician who doesnt understand our values. He has taken campaign cash from the health insurance industry.",political,Google
Jaime Herrera Beutler | Sides with Special Interests | Not WashingtonAd herrerabeutlerforspecialinterests.com Herrera Beutler took $1.6 million in campaign cash from corporate special interests. She voted for Trump's tax giveaway which gives drug companies $80 million in tax breaks.,political,Google
Jaime Herrera Beutler | Sides with Special Interests | Not WashingtonAd herrerabeutlerforspecialinterests.com Herrera Beutler took $1.6 million in campaign cash from corporate special interests. She voted for Trump's tax giveaway which could put Social Security and Medicare at risk.,political,Google
Yvette Herrell | Puts Herself First | Puts New Mexico LastAd corruptyvetteherrell.com Yvette Herrell looks out for herself and her own interests. With Yvette Herrell in Congress New Mexico will come last.,political,Google
Yvette Herrell | Out for Herself | Will Say AnythingAd corruptyvetteherrell.com Yvette Herrell is a corrupt politician who looks out for herself. Shell say anything to get elected.,political,Google
Democrat Theresa Greenfield | Iowa's Senate race is tied | McConnell spending $82MAd secure.actblue.com Iowa will decide Senate control but right now we're falling behind. Don't wish you had done more on November 4. Chip in $5.,political,Google
Republican Joni Ernst | Wrong Answers Wrong for IA | Donate $10.05 to defeat herAd secure.actblue.com Joni Ernst didn't know the price of soybeans and doesn't have answers for IA. Flip this seat and the Senate by chipping in $10.05 now.,political,Google
Theresa Greenfield for Iowa | Iowa is a toss up | Elect Theresa GreenfieldAd secure.actblue.com Our race is one of the closest in the country and we need your help today. Pitch in right away to help us flip this seat and take back the Senate.,political,Google
"538: GOP is a slight favorite | Help Dem Theresa Greenfield | Donate todayAd secure.actblue.com FiveThirtyEight says our opponent is ""slightly favored to win."" Donate to fight back and flip the Senate.",political,Google
Elect Theresa Greenfield | A new poll has us ahead | Donate to flip the SenateAd secure.actblue.com The Des Moines Register's Iowa poll shows Theresa with a slight lead! Our race is within the margin of error so we need your help to win. Chip in now.,political,Google
Our race is a toss up | Flip the Senate | Give to Theresa GreenfieldAd secure.actblue.com Iowa is one of two true toss up races in the country. Chip in to help Democrats like Theresa Greenfield win.,political,Google
Iowa is a toss up | Help flip the Senate | Donate to Theresa GreenfieldAd secure.actblue.com Control of the Senate hinges on Iowa. Chip in to help Theresa flip this seat and take back the Senate majority.,political,Google
New Iowa Senate Poll | This race is neck-and-neckAd secure.actblue.com Theresa Greenfield is leading her opponent by just two points Pitch in to help us flip this seat and the Senate,political,Google
Flip the Senate | Theresa Greenfield for Iowa | Donate todayAd secure.actblue.com Iowa is one of the most important Senate races in the country. Chip in to help Democrats like Theresa Greenfield win.,political,Google
Help flip this seat for Dems | Theresa Greenfield for IowaAd secure.actblue.com Theresa just won her primary but now she needs our help. Pitch in to help her stand up to extreme Republican Senator Joni Ernst.,political,Google
New Poll: Up Two Points | Give to Theresa GreenfieldAd secure.actblue.com A new poll shows Theresa leading her opponent by two points Chip in to her grassroots campaign now,political,Google
Help Flip the Senate | Theresa Greenfield for IowaAd secure.actblue.com A new poll shows us up two points to our opponent Donate now to help us flip this seat and the Senate,political,Google
Help Flip the Senate | Iowa is neck-and-neckAd secure.actblue.com A new poll shows Theresa leading her incumbent opponent by two points Pitch in now to help us flip this seat and take back the Senate,political,Google
Theresa won the IA primary | Now help her flip this seatAd secure.actblue.com Polling shows Theresa can flip this seat and the Senate but she needs our help. Pitch in to help her take on her Republican opponent.,political,Google
It's official | Greenfield is the Dem nominee | Support Theresa GreenfieldAd secure.actblue.com Democrat Theresa Greenfield will take on Republican Senator Ernst. Chip in to help Theresa flip this seat and the Senate.,political,Google
Theresa Greenfield | Democrat for U.S. Senate | The Social Security CandidateAd greenfieldforiowa.com Theresa Greenfield is the candidate who will protect Social Security. She knows what it's like to need a hand up and she'll always offer it to others.,political,Google
Democrat Theresa Greenfield | The Proven Choice | Senate Poll Shows her TiedAd greenfieldforiowa.com Meet the candidate who has proven she can beat Republican Joni Ernst. Theresa Greenfield is ready to win and bring Iowa values to Washington.,political,Google
Democrat Theresa Greenfield | Fighting for Working Families | Refuses Corporate PAC SupportAd greenfieldforiowa.com Theresa is running for Senate to stop the corruption in Washington. It's time to replace Joni Ernst with a leader who will fight for you.,political,Google
Help Flip the Senate | Theresa Greenfield for IowaAd secure.actblue.com A new poll shows us one point down to our opponent Donate now to help us flip this seat and the Senate,political,Google
Help Flip the Senate | Iowa's race is neck-and-neckAd secure.actblue.com A new poll shows Theresa just one point down to her Republican opponent Pitch in now to help us flip this seat and take back the Senate,political,Google
