AdText,Category,Platform
Help Us Win Here in Georgia | Donate to Warnock for Senate | Deadline: 11:59 p.m.Ad secure.actblue.com/donate-now We can't win in Georgia without your support. Chip in now to help Rev. Warnock win in GA! 11:59 p.m. deadline: Give now to power this campaign forward!,political,Google
Raphael Warnock for Georgia | Chip in before 11:59 p.m. | Defeat the GOP. Give Now.Ad secure.actblue.com/donate-now 11:59 p.m. deadline: Our moment is right now. Give now to help elect Raphael Warnock. Chip in now to support Rev. Raphael Warnock and flip the Senate blue.,political,Google
Stacey Abrams Endorsement | Give to Warnock for Senate | Deadline: 11:59 p.m.Ad secure.actblue.com/donate-now Stacey Abrams endorses Rev. Warnock's vision for GA. Give now to power this campaign. 11:59 p.m. deadline: Your gift makes the difference. Give now to help Rev. Warnock win.,political,Google
Restore Voting Rights in GA | Donate to Warnock for Senate | Deadline: 11:59 p.m.Ad secure.actblue.com/donate-now 11:59 p.m. deadline: Chip in now to elect Rev. Warnock for Senate in Georgia! We've got to protect our democracy. Give now to make sure we can do it!,political,Google
Help Rev. Warnock Turn GA Blue | We Can't Win Without You | Hours Left: Midnight DeadlineAd secure.actblue.com/donate-now 11:59 p.m. deadline: Your donation is crucial! Chip in and help Warnock flip Georgia blue. Democrats can win in Georgia but only with your help. Chip in now.,political,Google
Georgia Needs Rev. Warnock (D) | Donate Now to Win the Runoff | Live Match: Double Your ImpactAd secure.actblue.com/georgia-runoff/donate-now 11:59 p.m. deadline: Your donation is critical to flipping the Senate & defeating the GOP! This is critical  give before midnight to get your gift matched and help win in GA.,political,Google
Donate Now: Turn Georgia Blue | Rev. Warnock for Senate | 11:59 p.m. DeadlineAd secure.actblue.com/donate-now 11:59 p.m. deadline: Your donation is crucial. Help Raphael Warnock defeat the GOP! Rev. Raphael Warnock will protect voting rights. Chip in to help flip the Senate blue.,political,Google
All Gifts 2X Matched Today | Donate to Warnock for Senate | Deadline: 11:59 p.m.Ad secure.actblue.com/donate-now 11:59 p.m. deadline: Chip in now to have your gift 2X matched to flip the Senate! We can take Georgia back in 2020  with your help. Give to Warnock for Senate now.,political,Google
Take Back Georgia in 2020 | Donate to Warnock for Senate | Midnight Deadline. Give now.Ad secure.actblue.com/donate-now Give now to support Rev. Warnock for Senate in GA! Midnight deadline to give. We can take Georgia back in 2020  with your help. Give to Warnock for Georgia now.,political,Google
Flip Georgia Blue in 2020 | Give to Rev. Raphael Warnock | Deadline: 11:59 p.m.Ad secure.actblue.com/donate-now Chip in to help Rev. Warnock win in GA! 11:59 p.m. deadline. We're fighting for moral leadership in 2020. Give now to help us get there.,political,Google
The GOP is Outraising Us | Donate to Warnock for Senate | Deadline: 11:59 p.m.Ad secure.actblue.com/donate-now We can take Georgia back in 2020  with your help. Give to Warnock for Senate now. 11:59 p.m. deadline: Your gift makes the difference. Give now to help Rev. Warnock win!,political,Google
Standing Up for Arizona | Sen. Kelly Fight for AZ ReliefAd majorityforward.com Tell Senator Kelly to keep putting Arizona first.,political,Google
Keep Putting Arizona First | Sen. Kelly is Fighting for AZAd majorityforward.com Tell Senator Kelly to keep fighting for relief for ALL Arizonans.,political,Google
Veteran. Michigander. Senator. | Gary Peters is for MichiganAd servingmichigan.org Gary Peters is boosting Michigan's defense industry and protecting our country. Click here to learn more.,political,Google
Michigan Deserves Health Care | Gary Peters is Defending itAd servingmichigan.org Gary Peters is fighting drug companies and working to expand your health care. He's working for Michigan. Learn more.,political,Google
Gary Peters works for Michigan | Bipartisan LegislatorAd servingmichigan.org Senator Gary Peters was named one of the most bipartisan senators. Learn how he's working for you and for Michigan,political,Google
Protecting our Country | Senator Gary PetersAd servingmichigan.org While others are focused on partisan politics Senator Peters is keeping Michigan safe Learn how Senator Peters passed key bills to protect our border.,political,Google
Defeat Marsha Blackburn | She Just Can't Be TrustedAd tennessee-true.org She was called one of the most corrupt members of Congress. Learn more.,political,Google
Defeat Marsha Blackburn | She Just Can't Be TrustedAd tennessee-true.org She cares more about drug special interests than Tennesseans torn by opioids.,political,Google
Defeat Marsha Blackburn | She Just Can't Be TrustedAd tennessee-true.org She voted to raise her own tax-payer funded salary 7 times. Learn more.,political,Google
Defeat Marsha Blackburn | She Just Can't Be TrustedAd tennessee-true.org She has used her office to benefit herself not Tennesseans. Learn more.,political,Google
Phil Bredesen for Senate | He Gets Things DoneAd tennessee-true.org Under Bredesens watch Tennessee businesses thrived. Learn more here.,political,Google
Phil Bredesen for Senate | He Gets Things DoneAd tennessee-true.org As Governor Bredesen saved Tennessee from a financial tailspin. Learn more here.,political,Google
Phil Bredesen for Senate | He Gets Things DoneAd tennessee-true.org Phil Bredesen is honest and independent. Hes Tennessee True. Learn more.,political,Google
Phil Bredesen for Senate | He Gets Things DoneAd tennessee-true.org As Governor he worked across the aisle to balance eight budgets. Learn more.,political,Google
Beaches Poisoned By Red Tide | This Is On Rick ScottAd cleanupyourmessrickscott.com Red tide is killing wildlife and poisoning Floridians. Tell Scott to act now.,political,Google
Algae Blooms Poisoning Florida | Tell Rick Scott To ActAd cleanupyourmessrickscott.com Rick Scott gutted water protections putting animals and people in harm's way,political,Google
Scott Wouldnt Protect Florida | Now He Needs To Clean It UpAd cleanupyourmessrickscott.com Dead wildlife and polluted beaches are Rick Scott's environmental legacy.,political,Google
Rick Scott Allowed Red Tide | He Gave Polluters A PassAd cleanupyourmessrickscott.com Rick Scotts trying to blame others for red tide. Tell him to clean up his mess.,political,Google
<dynamically generated based on landing page content>Ad http://yes15.org/ Prop 15 is a balanced reform that closes property tax loopholes for wealthy corporations It will reclaim billions every year to invest in our schools and local communities.,political,Google
Vote Yes on 15 | $12B for Schools & Communities | Close Corporate Tax LoopholesAd yes15.org Prop 15 is a balanced reform that closes property tax loopholes for wealthy corporations It will reclaim billions every year to invest in our schools and local communities.,political,Google
Do You Support | Biden's Immigration Agenda | Take the SurveyAd fairus.org/Immigration President Biden continues to weaken the integrity of America's immigration system. The Biden administration has pledged to radically dismantle Americas immigration system.,political,Google
"FAIR Immigration Reform | Join FAIRs Activist Network | Biden's Immigration AgendaAd fairus.org/Immigration/Illegal Learn more about Biden's key immigration related actions during his ""First 100 Days"". Stay up to date with our latest immigration news.",political,Google
Contribute To American Society | Stop Illegal Immigration | Support FAIR For Law ReformsAd fairus.org/Immigration/Illegal FAIR Puts the Interests Of American Citizens and Future Generations First. FAIR Seeks To Reduce Overall Immigration To a More Normal Level.,political,Google
Get More Information Online | Reinforce Public Charge Laws | Join the Fight With FAIRAd fairus.org/Public_Charge Providing Benefits To People Who Never Paid Into Our System Is a Financial Disaster. Immigrants Should Pay Into the System Before Accessing the Social Welfare Programs.,political,Google
Join the Fight With FAIR | Reinforce Public Charge Laws | Get More Information OnlineAd fairus.org/Public_Charge Trump Administration Is Working On Keeping Immigrants Off Public Assistance. Immigrants Should Pay Into the System Before Accessing the Social Welfare Programs.,political,Google
Save Our Social Safety Net | Support FAIR For Law Reforms | Know About Public Charge LawsAd fairus.org/Public_Charge Trump Administration Is Working Towards Reinforcing Public Charge Rules. Providing Benefits To People Who Never Paid Into Our System Is a Financial Disaster.,political,Google
It's Time to Build The Wall | The Fight is Not Over | Support President Trump NowAd fairus.org America needs a wall on the Mexican border to keep our border safe. Learn more now.,political,Google
Republicans Against Trump | Republican VotersAd rvat.org Republican Voters Against Trump Republicans and former Trump voters who cant support Trump for president this fall.,political,Google
Rosenstein Impeachment | Protect Mueller InvestigationAd ruleoflawrepublicans.com/rosenstein/impeachment Republicans for the Rule of Law Are Sending A Message To The President. Join Us.,political,Google
Deputy AG Rosenstein | Should Not Be TerminatedAd ruleoflawrepublicans.com/protect/rosenstein Republicans for the Rule of Law Are Sending A Letter To The President. Join Us.,political,Google
Republicans Fighting Tariffs | Stop Trump's Terrible TariffsAd terribletariffs.com Tariffs Will Hurt American Businesses Consumers Workers And The Economy.,political,Google
Republicans Fighting Tariffs | No Trade War Has Ever WorkedAd terribletariffs.com Tariffs Will Hurt American Businesses Consumers Workers And The Economy.,political,Google
Republicans Fighting Tariffs | We Are The Party Of Free TradeAd terribletariffs.com Tariffs Will Hurt American Businesses Consumers Workers And The Economy.,political,Google
Republicans For Rule Of Law | Learn MoreAd ruleoflawrepublicans.com Do You Believe Special Counsel Mueller's Investigation Should Be Completed?,political,Google
Joni Ernst for US Senate 2020 | Mother. Soldier. Leader. | Donate to Joni Ernst todayAd secure.winred.com Donate $10 today to support Joni Ernst. Joni is fighting to protect Iowa's Senate seat. Help Joni save the Republican Senate majority. Contribute to join Team Joni today.,political,Google
Joni Ernst for US Senate 2020 | Chip in $10 to join the fight | Iowa's OwnAd secure.anedot.com Joni Ernst is fighting to protect the unborn and Make Washington Squeal. Chip in $10 to join our fight to protect Joni's seat and keep Iowa RED!,political,Google
Joni Ernst for US Senate 2020 | Iowa's Own | Chip in $10 to join the fightAd secure.anedot.com/joniforiowa/ernstdonate Joni Ernst is fighting to protect the unborn and Make Washington Squeal. Chip in $10 to join our fight to protect Joni Ernst's Senate seat and keep Iowa RED!,political,Google
Joni Ernst | Lifelong Iowa ConservativeAd secure.anedot.com/joniforiowa/donate Chip in $10 to support Joni in her fight to lower taxes and protect our country!,political,Google
Justin Will Fight for Us | In the Minnesota State Senate | Learn About Justin StofferahnAd abetterlegislature.org Justin Stofferahn will fight to protect Minnesotans with pre-existing conditions. In the Senate Justin will work to make your health care more affordable. Learn more.,political,Google
Iowa's Caucus is on Feb 3rd | Learn How to CaucusAd yang2020.com/iowa/caucus Everything you need to know about the Iowa Caucus. Learn everything you need to know about the Iowa Caucus in just 5 minutes!,political,Google
Are You Ready to Caucus? | The Iowa Caucus is on Monday.Ad yang2020.com/iowa/caucus Learn how to be a part of Iowa's historic Caucus on Feb 3rd. Find out where to caucus and how to make your voice heard.,political,Google
Are You Ready for the Caucus? | Get Prepared for the CaucusAd yang2020.com/iowa/caucus Answers to questions about the Iowa Caucus you were too afraid to ask. Learn everything you need to know before Caucus day!,political,Google
Andrew Yang 2020 | Presidential Candidate | Join the Yang GangAd act.yang2020.com Let's make the economy work for Americans not the other way around. Join our campaign for the Democratic nomination for President.,political,Google
Andrew Yang for America | Democrat for President | A New Way ForwardAd act.yang2020.com Learn how Andrew Yang plans to Make America Think Harder. The only candidate willing to rewrite the rules of the economy to work for us.,political,Google
Andrew Yang for President | Presidential Candidate | Universal Basic IncomeAd act.yang2020.com Andrew Yang's historic campaign for president is putting humanity first Sign up to join the #YangGang and help elect Andrew Yang in 2020.,political,Google
Andrew Yang 2020 | Democrat for President | Join the FightAd act.yang2020.com Sign up now if you're ready to change the economy to work for you. Let's help Andrew Yang become the next Democratic candidate for US President.,political,Google
Andrew Yang 2020 | Universal Basic Income | $1000 Each MonthAd yang2020.com Looking for more information on Andrew Yang's Freedom Dividend? Click to find out more about his idea of universal basic income.,political,Google
Andrew Yang 2020 | Universal Basic Income | $1000 Each MonthAd yang2020.com The Freedom Dividend is a form of universal basic income that will help all Americans. Click to learn more about UBI and Andrew Yang's policies.,political,Google
Andrew for POTUS | The Candidate Who Has the Data | Support Andrew Yang TodayAd act.yang2020.com Andrew is fighting for UBI Medicare for All and action on climate change. He has the solutions to today's problems. Sign up to support Andrew Yang now.,political,Google
Andrew Yang 2020 | Democrat for President | Donate $10 or $20 NowAd secure.actblue.com Now is the time to join this fight. Your donations power our campaign not PACs or corporations. Click to donate now.,political,Google
Get to Know Andrew Yang | Democrat for President | Andrew has the SolutionsAd yang2020.com Read more about Andrew's plan for a trickle-up economy. Sign up to show your support for Andrew Yang now.,political,Google
Who is Andrew Yang? | Presidential Candidate | Andrew Yang 2020Ad yang2020.com/nevada/meet-andrew Read more about Andrew's plan for a trickle-up economy. Sign up to show your support for Andrew now.,political,Google
Andrew Yang 2020 | Democrat for President | Combat Climate ChangeAd yang2020.com Choose the presidential candidate who understands the importance of the changing climate. Read more about how Andrew Yang will achieve net-zero emissions by 2050.,political,Google
Andrew Yang for President | Donate Now | Every Dollar CountsAd secure.actblue.com Chip in to help us fight the real problems facing America. Contribute $10 to help our movement continue to grow!,political,Google
Andrew Yang | Democrat for President | Humanity FirstAd yang2020.com/south-carolina/meet-andrew We can rewrite the rules of the economy to work for us. It's time corporations pay their fair share.,political,Google
Andrew Yang | Democrat for President | Humanity FirstAd yang2020.com/nevada/meet-andrew We can rewrite the rules of the economy to work for us. It's time corporations pay their fair share.,political,Google
Learn More about Andrew Yang | Presidential Candidate | Powered by the PeopleAd yang2020.com/new-hampshire/meet-andrew Parent. Patriot. Not a Politician. It's time for a new way forward.,political,Google
Learn More about Andrew Yang | Presidential Candidate | Powered by the PeopleAd yang2020.com/iowa/meet-andrew Parent. Patriot. Not a Politician. It's time for a new way forward.,political,Google
Take on Big Money in Politics | Andrew Yang 2020 | Democrat for PresidentAd yang2020.com Our elections should be decided by the people. Not bought and paid for by wealthy donors and big corporations.,political,Google
Who is Andrew Yang? | Presidential Candidate | Humanity FirstAd yang2020.com/south-carolina/meet-andrew Automation is eliminating jobs at a record pace and only Andrew has a solution. Read more about Andrew Yang and why he is running for president.,political,Google
Andrew Yang | Democrat for President | Humanity FirstAd yang2020.com/iowa/meet-andrew We can rewrite the rules of the economy to work for us. It's time corporations pay their fair share.,political,Google
Medicare for All | Andrew Yang 2020 | Democrat for PresidentAd yang2020.com We can't let healthcare bills bankrupt any more Americans! We need a Medicare for All system now.,political,Google
Andrew Yang | Democrat for President | Humanity FirstAd yang2020.com/new-hampshire/meet-andrew We can rewrite the rules of the economy to work for us. It's time corporations pay their fair share.,political,Google
Learn More about Andrew Yang | Presidential Candidate | Powered by the PeopleAd yang2020.com/south-carolina/meet-andrew Parent. Patriot. Not a Politician. It's time for a new way forward.,political,Google
Learn More about Andrew Yang | Presidential Candidate | Powered by the PeopleAd yang2020.com/nevada/meet-andrew Parent. Patriot. Not a Politician. It's time for a new way forward.,political,Google
Andrew Yang 2020 | Democrat for President | Let's Take Back Our DemocracyAd yang2020.com It's time to reduce the influence of mega-donors in our elections. Support Democracy Dollars today. Sign the Petition.,political,Google
Andrew Yang for President | Official Yang 2020 MerchandiseAd shop.yang2020.com Get your official Yang 2020 merch and join the #YangGang. Hats shirts stickers we have it all! Get your Yang 2020 merch today.,political,Google
Collins Voted To Gut Benefits | Social Security Under Attack | Collins Puts Us At RiskAd astrongermaine.com Senator Susan Collins isn't fighting for social security for Mainers Mainers need retirement security. Tell Susan Collins to fight for our security.,political,Google
Collins Supported Tax Cuts | To Benefit Big Businesses | Rather Than MainersAd astrongermaine.com Senator Susan Collins supported $2 trillion in corporate tax cuts Tell Susan Collins to support Mainers instead of tax cuts for corporations.,political,Google
Collins Bails Out Corporations | While Small Businesses SufferAd astrongermaine.com Mainers Are Struggling To Pay Bills While Collins Writes Bills That Benefit Corporations Tell Susan Collins To Put Maine Small Businesses First.,political,Google
Collins Put Wall Street First | Over Struggling ME BusinessesAd astrongermaine.com Collins Bill Gave Billions To Wall Street And Nothing To 80% Of Maine's Small Businesses. Tell Susan Collins To Put Maine Small Businesses First.,political,Google
Collins Favors Corporations | Put Big Business Over MainersAd astrongermaine.com Senator Susan Collins Took Over A Million Dollars From Drug And Insurance Companies. Then She Voted 7 Times To Remove Protections From Mainers With Pre-Existing Conditions.,political,Google
Collins Favors Corporations | Put Big Business Over MainersAd astrongermaine.com Senator Susan Collins took over a million dollars from drug and iInsurance companies. Then she voted 7 times to remove protections from Mainers with pre-existing conditions.,political,Google
Collins Wrote The PPP Bill | Maine Businesses Lost Out | Collins Put Big Biz Over MaineAd astrongermaine.com Despite Writing The PPP Bill Collins Gave Big Businesses A Payout Leaving Mainers Behind Small Businesses Need Help Especially During Covid. Collins Put Corporations Over Mainers,political,Google
Collins Wrote The PPP Bill | Maine Businesses Lost Out | Collins Put Big Biz Over MaineAd astrongermaine.com Despite writing the PPP bill Collins gave big businesses a payout leaving Mainers behind Small businesses need help especially during Covid. Collins put corporations over Mainers,political,Google
Our Medicare Is Under Attack | Collins Isn't Taking A Stand | Mainers Need MedicareAd astrongermaine.com Senator Susan Collins Puts Medicare At Risk By Playing Politics Instead Of Fighting For Us She Votes For Corporate Tax Giveaways At The Expense Of Programs That Mainers Rely On.,political,Google
Our Medicare Is Under Attack | Collins Isn't Taking A Stand | Mainers Need MedicareAd astrongermaine.com Senator Susan Collins puts Medicare at risk by playing politics instead of fighting for us She votes for corporate tax giveaways at the expense of programs that Mainers rely on.,political,Google
Mainers Rely On Medicare | But Susan Collins Doesn't CareAd astrongermaine.com Senator Susan Collins Has Voted Many Times To Gut Funding For Retirement Programs Mainers Deserve Security In Retirement. Tell Susan Collins To Stop Putting Us At Risk.,political,Google
Mainers Rely On Medicare | But Susan Collins Doesn't CareAd astrongermaine.com Senator Susan Collins has voted many times to gut funding for retirement programs Mainers deserve security in retirement. Tell Susan Collins to stop putting us at risk.,political,Google
McSally ignora trabajadores | El virus contina propagndose | Necesitamos ms apoyoAd abetterarizona.com McSally vot en contra de proporcionar a los trabajadores tiempo de enfermedad remunerado Dile a McSally que necesita apoyar a los trabajadores especialmente durante una pandemia,political,Google
Empresas pequeas en peligro | McSally no actu cuando pudo | La economa est en crisisAd abetterarizona.com Las empresas pequeas de Arizona no sobrevivirn la pandemia sin ayuda Muchas pequeas empresas en Arizona no recibieron la ayuda econmica que solicitaron,political,Google
McSally necesita saber | Tu cobertura esta en riesgo | Necessitamos cuidado de saludAd abetterarizona.com Martha McSally pone en riesgo a millones de estadounidenses con condiciones preexistentes. Dile a McSally que no nos puede quitar nuestro cuidado de salud durante una pandemia,political,Google
AZ necesita ayuda econmica | McSally dijo no | Ella no actu cuando pudoAd abetterarizona.com Martha McSally vot en contra de proporcionar ayuda econmica durante la pandemia Dile a McSally que necesitamos un lder que luchar por nosotros durante el coronavirus,political,Google
McSally reducir tu cobertura | Tu cobertura est en peligro | No nos quites coberturaAd abetterarizona.com Las acciones de Martha McSally amenazan la cobertura de millones durante una pandemia. Nuestros familiares con condiciones preexistentes como diabetes o asma estn en riesgo,political,Google
McSally nos pone en peligro | Condiciones preexistentes | Tu cobertura est bajo amenazaAd abetterarizona.com Martha McSally vot para reducir protecciones para personas con condicines preexistentes. Durante una pandemia ms que nunca necesitamos nuestro cuidado de salud.,political,Google
McSally Against Workers | Voted No On Paid Family Leave | Even While Covid-19 SpreadsAd abetterarizona.com McSally Voted Against Providing Workers With Sick Pay And Paid Leave During Covid-19 She Left Many American Workers With No Way To Care For Their Families Or Themselves,political,Google
Where Are AZ Small Biz Loans? | Not Enough From McSally | AZ Small Businesses Need HelpAd abetterarizona.com Large Companies Are Getting Loans Meant For Arizona Small Businesses Meanwhile Arizona Small Businesses Aren't Being Approved For Loans,political,Google
AZ Small Businesses Struggling | Where Is McSally? | Businesses Need COVID SupportAd abetterarizona.com Many AZ Small Businesses Aren't Getting The Paycheck Protections Loans They've Applied For Arizona Ranks Last In Small Business Paycheck Protections Loans Distributed Per Capita,political,Google
Not Enough From McSally | AZ Small Businesses Struggling | Even As COVID-19 spreadsAd abetterarizona.com Arizona Ranks Last In Small Business Paycheck Protections Loans Distributed Per Capita Arizona Small Businesses Won't Survive COVID-19 Without Small Business Loans,political,Google
McSally Voted No On Sick Pay | Opposes Protecting Workers | Even While Covid-19 SpreadsAd abetterarizona.com McSally Voted Against Providing Workers With Sick Pay And Paid Leave During Covid-19 She Left Many American Workers With No Way To Care For Their Families Or Themselves,political,Google
Tillis Voted Against Medicaid | Denying Coverage To 500k in NC | Tillis Threatens Your CoverageAd northcarolinabeforeparty.com Thom Tillis voted against Medicaid expansion denying coverage to thousands Healthcare is more important than ever. Tell Thom Tillis to stop voting to take it away.,political,Google
Tillis Against Medicaid | Against Expanding Coverage | Time To Take Back Your CareAd northcarolinabeforeparty.com Thom Tillis's actions deny coverage to nearly 500000 North Carolinians. Tell him to stop. Thousands of North Carolinians rely on Medicaid but Thom Tillis voted to cut it 6 times.,political,Google
Medicaid Expansion Saves Lives | Tillis Voted Against Expansion | North Carolina Needs MedicaidAd northcarolinabeforeparty.com Healthcare is more important than ever. Tell Thom Tillis to stop voting to take it away. Thousands of North Carolinians rely on Medicaid but Thom Tillis voted to cut it 6 times.,political,Google
Vote for change Tuesday | Jack Ciattarelli for Governor | Let's Fix New JerseyAd jack4nj.com Send a message to Biden and Murphy Its time to build the New Jersey we deserve.,political,Google
Disapprove of Joe Biden? | Send a message this Tuesday. | Help Jack Fix NJAd jack4nj.com Vote Jack Ciattarelli for Governor Its time to build the New Jersey we deserve.,political,Google
Jack Ciattarelli | Let's Fix New Jersey | Make a plan to voteAd vote.gop Its time to build the New Jersey we deserve Let's make Phil Murphy One and Done in 21,political,Google
Tax bill too high? | Phil Murphy is to blame | Vote Jack Ciattarelli TuesdayAd jack4nj.com Its time for common sense. Its time to build the New Jersey we deserve.,political,Google
