AdText,Category,Platform
Republicans: Are You Ready? | It's Time To Vote Trump | Find Your Polling Place NowAd vote.donaldjtrump.com Republicans: Visit Site To Find Your Election Day Polling Place. Be Ready For Nov 3rd. Make Sure You Are Ready To Vote. Don't Wait. President Trump Is Counting On Your Vote.,political,Google
Republicans: Are You Ready? | It's Time To Vote Trump | Find Your Polling Place NowAd vote.donaldjtrump.com Republicans: Visit Site To Find Your Election Day Polling Place. Be Ready For Nov 3rd. Make Sure You Are Ready To Vote On Election Day. President Trump Is Counting On Your Vote.,political,Google
Donald J. Trump For President | Find Your Polling Place Here | Get Ready For Election DayAd vote.donaldjtrump.com Election Day Is Only {PH_0} Away. Make Sure You're Ready. President Trump Is Counting On Your Vote. No Time To Waste. Get Ready To Vote Now.,political,Google
Trump 2020 | Vote On Election Day | Find Your Polling Place NowAd vote.donaldjtrump.com Election Day Is Only {PH_0} Away. Make Sure You're Ready To Vote For President Trump. America Needs 4 More Years. Everything Is At Stake. Make Sure You're Ready To Vote.,political,Google
Republicans: Only {PH_0} | Make Sure You're Ready To Vote | America Is Counting On YouAd vote.donaldjtrump.com Visit Site To Find Your Polling Place. Every Vote Counts. Everything Is At Stake On Nov 3. Be Ready To Vote Republican On Nov 3rd. Help Make History. America Needs Your Vote.,political,Google
33.1% GDP Growth | The Choice Is Simple | It's Time To Vote TrumpAd vote.donaldjtrump.com Visit Site To Find Your Polling Place. Every Vote Counts. America Needs 4 More Years. You Can't Ignore This Record Breaking Growth. Be Ready To Vote Republican On Nov 3.,political,Google
Fastest Economic Recovery Ever | America Needs President Trump | Go Vote For TrumpAd vote.donaldjtrump.com Find Your Polling Place. Go Vote For President Trump. Record Breaking 33.1% GDP Growth. America Is Counting On Your Vote For President Trump. Go Vote In Person On Election Day.,political,Google
Final Chance | Donate To Trump 2020 | Everything Is On The LineAd secure.winred.com President Trump Needs You To Donate. Now Is Your Last Chance To Donate. Help Trump Win Big Everything Is On The Line. All Patriots Must Step Up and Donate Now. America Needs Trump.,political,Google
ATTN: Final Chance | Donate To Donald Trump 2020 | Don't Remain SilentAd secure.winred.com President Trump Needs You To Donate Right Now. Everything Is On The Line. Don't Miss Out. All Patriots Need To Step Up And Donate Immediately. Help Trump Win Big In November.,political,Google
{PH_0} Until Election Day | Help Trump Win | Donate NowAd secure.winred.com/donate Official Donald J. Trump For President. Donate Now To Help Trump Defeat Biden in 2020. Every Dollar Counts. No Time To Waste. Donate Now.,political,Google
Trump 2020 | Su Libertad Esta En Peligro | Hay Que Salvar El PaisAd es.vote.gop Los Democratas Ee Han Convertidos A Socialistas. Hay Que Votar Por El Presidente Trump. El Presidenete Trump Ha Peliado Por Usted Y Su Libertad. Hay Que Apoyarle. Vota Por Trump.,political,Google
El Pais Esta En Peligro | No Pierda Su Libertad | Trump Contra El SocialismoAd es.vote.gop Presidente Trump Es El Unico Candidato Contra El Socialismo. Tiene Que Votar Por Trump. Vote Tmprano Por Presidente Trump. No Permita Que Esto Se Convierta A Un Pais Socialista.,political,Google
Record GDP Growth | America Needs President Trump | Find Your Polling Place NowAd vote.donaldjtrump.com The Economy Is Growing Faster Than Ever. You Can't Ignore These Numbers. Get Ready To Vote The Choice Between Economic Boom Or Economic Doom Is In Your Hands. America Needs Trump.,political,Google
Attn: Help Save America | Fight For Fair Elections | Donate NowAd secure.winred.com/tmagac Defend Your Favorite President. Ensure Your Voice Is Heard. Donate Now.,political,Google
Defend Georgia | Hold The Line | Donate NowAd secure.winred.com/tmagac We Need Your Help To Fight Back. Donate Now to the Georgia Recount Fund.,political,Google
Urgent: Donate Now | Official Donald J. Trump | Election Defense FundAd secure.winred.com/tmagac Critical Election Defense Fund. Donate Now To Help Us Save America. Stop The Radical Left. President Trump Needs Your Help. Chip In To Help President Trump Defend Our Elections.,political,Google
Protect Our Elections | Fight For Freedom | Contribute NowAd secure.winred.com/tmagac Trump Has Spent Every Single Day Fighting For You. President Trump Needs You To Donate Right Now.,political,Google
Help Save America | Donald J. Trump | Donate NowAd secure.winred.com/tmagac President Trump Needs You To Donate Now. Help Stop The Radical Left. We Will Not Give Up. Help Us Stop The Democrats. They Will Ruin America. Every Dollar Counts. Donate Now.,political,Google
Donald J. Trump Official Site | Save America | Donate NowAd secure.winred.com/tmagac Patriots: Donate Now. President Trump Needs Your Help. Stop The Radical Left From Ruining Our Democracy. Every Dollar Counts. Defend America.,political,Google
Donald J. Trump Official Site | Save America | Donate NowAd secure.winred.com Patriots: Donate Now. President Trump Needs Your Help. Stop The Radical Left From Ruining Our Democracy. Each Dollar Counts. Help Defend America.,political,Google
Urgent Message | Fight For Fair Elections | Give NowAd secure.winred.com President Trump Fights You. Now It's Your Turn. Every Dollar Counts. No Time To Waste.,political,Google
Urgent Message | Fight For Fair Elections | Give NowAd secure.winred.com/tmagac President Trump Fights You. Now It's Your Turn. Every Dollar Counts. No Time To Waste.,political,Google
Fight For Trump | Defend Our Elections | Contribute NowAd secure.winred.com/tmagac Trump Will Never Give Up Fighting For Our Nation. Donate Now To Defend America.,political,Google
Patriots: We Need You | Fight For Trump | Donald J. TrumpAd secure.winred.com/tmagac Donate Now. President Trump Needs Your Help To Stop The Radical Left. Chip In To Help President Trump. We Can't Let The Democrats Ruin Our Country.,political,Google
Patriots: We Need You | Fight For Trump | Donald J. TrumpAd secure.winred.com Donate Now. President Trump Needs Your Help To Stop The Radical Left. Chip In To Help President Trump. We Can't Let The Democrats Ruin Our Country.,political,Google
Defeat Rubio Defend Senate | 11:59 Deadline Donate Now | Unseat Rubio & Stop the GOPAd secure.actblue.com/donate/defeat-rubio Quick! We can finally end Marco Rubio's career & expand our Dem majority! Donate now! Our democracy is on the line! Give now to defeat Marco Rubio and keep the Senate blue,political,Google
Donate to root out Trumpism | Donate to Dems by 11:59 P.M. | Defend Senate battlegroundsAd secure.actblue.com/donate/protect-dems If we lose even one seat we lose our majority. Donate now to keep the Senate blue. Your donation could be the only thing that keeps McConnell Cruz and Hawley out of power.,political,Google
Leader McConnell? Never Again | Give to Defend Our Majority | Donate to Keep Dems in PowerAd secure.actblue.com/donate/protect-dems Donate right now! We can't allow the GOP & McConnell to hold the majority ever again. Donate ASAP to Dems! McConnell will control the Senate if Republicans flip even one seat!,political,Google
Defend Democracy from the GOP | Donate Now Flip the Senate | Midnight deadline. Give now.Ad secure.actblue.com/donate/protect-scotus Donate now flip the Senate: The GOP must pay for what they've done to our Supreme Court. Democrats only need to flip FOUR seats to win the Senate! Give now & flip the Senate blue.,political,Google
Condemn Mitch McConnell | Donate To Flip the Senate | Midnight deadline. Give now.Ad secure.actblue.com/donate/protect-scotus Donate now flip the Senate: The GOP must pay for what they've done to our Supreme Court. Democrats only need to flip FOUR seats to win the Senate! Give now & flip the Senate blue.,political,Google
Condemn the GOP's Hypocrisy | Take a Stand Donate Now | Midnight deadline. Give now.Ad secure.actblue.com/donate/protect-scotus Donate now flip the Senate: The GOP must pay for what they've done to our Supreme Court. Democrats only need to flip FOUR seats to win the Senate! Give now & flip the Senate blue.,political,Google
GOP Hypocrisy Must Be Stopped | Donate to End the GOP Majority | Midnight deadline. Give now.Ad secure.actblue.com/donate/protect-scotus Donate now flip the Senate: The GOP must pay for what they've done to our Supreme Court. Democrats only need to flip FOUR seats to win the Senate! Give now & flip the Senate blue.,political,Google
Iowans Can't Count On Ernst | Special Interests Come FirstAd ernstforgotiowa.com Joni Ernst voted to protect tax breaks for companies that send our jobs overseas. Her campaign took millions from corporate special interests and she left Iowans behind.,political,Google
Ernst Won't Fight For Iowans | Risking Our Retirement FundsAd ernstforgotiowa.com Joni Ernst wants to let her Wall Street donors gamble with our Social Security. Ernst would put our retirement savings on the line. She's not fighting for Iowans anymore.,political,Google
Ernst Leaves Iowans Behind | Gambling With Social SecurityAd ernstforgotiowa.com Joni Ernst doesn't work for Iowans anymoreshe wants to privatize Social Security. Ernst would let Wall Street donors gamble with our retirement savings.,political,Google
Ernst Won't Protect Iowan Jobs | She's Not On Our SideAd ernstforgotiowa.com Joni Ernsts campaign took millions from corporate special interests. Ernst voted to protect tax breaks for companies that outsource our jobs.,political,Google
"Montanans Can't Trust Daines | He Won't Fight For UsAd dainesfollowsthemoney.com Steve Daines spent years helping open factories in China while his company cut jobs here. The Chinese government called Daines their ""ambassador in Congress."" He won't work for us.",political,Google
"Daines Doesn't Work For Us | Montana Comes LastAd dainesfollowsthemoney.com Steve Daines spent years in China helping open factories while his company cut jobs here. The Chinese Communist Party called Daines their ""ambassador in Congress.""",political,Google
"Who Does Daines Work For? | He's 'China's Ambassador'Ad dainesfollowsthemoney.com Steve Daines helped open factories in China while his company slashed jobs in America. The Chinese government called Daines their ""ambassador in Congress.""",political,Google
Iowans Can't Trust Joni Ernst | She Doesnt Stand Up For UsAd ernstforgotiowa.com Ernst's campaign took over $600000 from the drug and insurance industries. She voted to raise the cost of prescription drugs. Ernst isn't working for us.,political,Google
Joni Ernst Won't Fight For Us | Leaving Iowans BehindAd ernstforgotiowa.com Joni Ernst supports ending protections for Iowans with pre-existing conditions. She also voted to raise prescription drug costs. Ernst won't stand up for Iowans.,political,Google
Who Does Joni Ernst Work For? | She's Not Fighting For IowaAd ernstforgotiowa.com Ernst's campaign got over half a million dollars from the drug and insurance industries. She supports gutting protections for pre-existing conditions. Iowans can't trust Ernst.,political,Google
Can't Count On Joni Ernst | She's Not Listening To IowansAd ernstforgotiowa.com Joni Ernst has voted repeatedly to cut Medicare by hundreds of billions of dollars. Iowa seniors need her but Ernst isn't listening.,political,Google
Ernst Doesn't Listen To Iowans | Can't Trust Her To Work For UsAd ernstforgotiowa.com Joni Ernst has voted repeatedly to slash Medicare by hundreds of billions of dollars. Iowans need a leader we can count on to fight for us in Washington. We can't trust Ernst.,political,Google
Donate Now to Flip the Senate | Democrats Can Win Back Control | Midnight deadline. Give now.Ad secure.actblue.com/donate/protect-scotus Donate now! The future of the Supreme Court is on the line -- give now to flip the Senate! Democrats only need to flip two seats to win the Senate! Give now & flip the Senate blue.,political,Google
Donate to End the GOP Majority | Give Now Defeat the GOP | Midnight deadline. Give now.Ad secure.actblue.com/donate/protect-scotus Donate now! The future of the Supreme Court is on the line -- give now to flip the Senate! Democrats only need to flip two seats to win the Senate! Give now & flip the Senate blue.,political,Google
Only {PH_0} to Election Day | Donate to Elect Joe & Kamala | We're in the Final StretchAd secure.actblue.com We can beat Trump and the Republicans with your help. Donate to the Biden Victory Fund. Your donation is crucial to helping us elect Democrats up and down the ballot. Thank you.,political,Google
Only {PH_0} to Election Day | Official Biden Victory Fund | Donate to Elect Joe & KamalaAd secure.actblue.com We can beat Trump and the Republicans with your help. Donate to the Biden Victory Fund. Your donation is crucial to helping us elect Democrats up and down the ballot. Thank you.,political,Google
Only {PH_0} to Election Day | Donate to Biden/Harris 2020 | Official Democratic TicketAd secure.actblue.com Donate to push Joe Kamala and Democrats across the country to victory in these final days The stakes have never been higher. Contribute to the official Biden Victory Fund today.,political,Google
Elect Joe & Kamala | Donate to Biden/Harris 2020 | Official Democratic TicketAd secure.actblue.com Donate to push Joe Kamala and Democrats across the country to victory in these final days The stakes have never been higher. Contribute to the official Biden Victory Fund today.,political,Google
Kamala for Vice President | Donate to Biden/Harris 2020 | Official Democratic TicketAd secure.actblue.com Donate to push Joe Kamala & Democrats across the country to victory in these final days The stakes have never been higher. Contribute to the official Biden Victory Fund today.,political,Google
Joe Biden Wins Final Debate | Congratulate Joe On His Win | Official Biden Victory FundAd secure.actblue.com We're now in the final stretch of this race! It's going to be close. Rush a donation today to help Joe Biden and Democrats nationwide across the finish line.,political,Google
Joe Biden Wins Final Debate | Congratulate Joe On His Win | Official Biden/Harris CampaignAd secure.actblue.com We can beat Trump and the Republicans with your help. Donate to the Biden Victory Fund. Give now to support Joe Biden Kamala Harris and Democrats down the ballot.,political,Google
Joe Biden Wins Final Debate | Congratulate Joe On His Win | Official Biden/Harris CampaignAd secure.actblue.com Donate to push Joe Kamala and Democrats across the country to victory in these last weeks The stakes have never been higher. Contribute to the official Biden Victory Fund today.,political,Google
Official Biden Victory Fund | Elect Joe Biden Kamala Harris | And Democrats NationwideAd secure.actblue.com We're in the final stretch! This election is going to be closer than you think. Rush a donation today to help us reach undecided voters and win key battleground states.,political,Google
Official Biden/Harris Campaign | Elect Joe Biden Kamala Harris | And Democrats NationwideAd secure.actblue.com We're in the final stretch! This election is going to be closer than you think. Rush a donation today to help us reach undecided voters and win key battleground states.,political,Google
Joe & Kamala need your support | Official Biden/Harris 2020 | Official Team Biden 2020Ad secure.actblue.com Donate now so we can spread our message and defeat Trump & the GOP up and down the ballot. This is it folks. The election is almost here and it's all hands on deck. Chip in today!,political,Google
Elect Joe & Kamala | Donate to Biden/Harris 2020 | Official Democratic TicketAd secure.actblue.com Donate to push Joe Kamala and Democrats across the country to victory in these last weeks The stakes have never been higher. Contribute to the official Biden Victory Fund today.,political,Google
Make a Donation | Official Biden/Harris 2020 | Official Team Biden 2020Ad secure.actblue.com This is it folks. The election is almost here and it's all hands on deck. Chip in today! Donate now so we can spread our message and defeat Trump & the GOP up and down the ballot.,political,Google
Official Biden/Harris Campaign | Kamala for Vice President | Make A Contribution TodayAd secure.actblue.com Joe Biden & Kamala Harris: Support the campaign to send this team to Washington. Chip in! Contribute to the official ticket. Let's elect Joe Kamala and Democrats nationwide.,political,Google
Kamala for Vice President | Donate to Biden/Harris 2020 | Official Democratic TicketAd secure.actblue.com Donate to push Joe Kamala & Democrats across the country to victory in these last weeks The stakes have never been higher. Contribute to the official Biden Victory Fund today.,political,Google
Official Biden/Harris Campaign | Support Joe & Kamala | Make A Contribution TodayAd secure.actblue.com Joe Biden & Kamala Harris: Support the campaign to send this team to Washington. Chip in! Contribute to the official ticket. Let's elect Joe Kamala and Democrats nationwide.,political,Google
Kamala Harris Won the Debate | Congratulate Kamala on Her Win | Donate to Biden/Harris 2020Ad secure.actblue.com Donate to push Joe Kamala & Democrats across the country to victory in these last weeks The stakes have never been higher. Contribute to the official Biden Victory Fund today.,political,Google
Joe & Kamala need your support | Official Biden/Harris 2020 | Official Team Biden 2020Ad secure.actblue.com This is it folks. The election is almost here and it's all hands on deck. Chip in today! Donate now so we can spread our message and defeat Trump & the GOP up and down the ballot.,political,Google
Official Democratic Party | Protect Reproductive Freedom | Donate NowAd secure.actblue.com Rush a donation to the DNC to protect abortion access and elect Democrats nationwide. Abortion is a constitutional right and we wont stop fighting to keep it safe and legal.,political,Google
DNC | Support Democrats Nationwide | Donate to the Democratic PartyAd secure.actblue.com/democraticparty Make a donation today and launch Democrats to victory in 2021. Chip in now. Were building a grassroots movement to take on the GOP. Make your donation today.,political,Google
Stand with Joe Biden Today | Donate Now | Donate to Support DemocratsAd secure.actblue.com/democraticparty Winning the White House was just the first step. Now it's time to get to work. Act now. Donate now to elect Democrats everywhere and sustain our fight for the long haul.,political,Google
Abortion is Health Care | Protect Roe v. Wade | Chip in TodayAd secure.actblue.com Donate today to elect Democrats who will protect Roe v. Wade and the right to choose. We cannot let the GOP's attack on reproductive freedom go unanswered. Chip in today.,political,Google
DNC HQ | Donate to Support Democrats | Stand with Joe Biden TodayAd secure.actblue.com Chip in to support the Official Democratic Party. Donate today. Invest in the party infrastructure needed to elect Democrats who will pass Joes agenda.,political,Google
Protect Roe v. Wade | Abortion is Health Care | Donate NowAd secure.actblue.com Chip in today to help protect abortion access and elect pro-choice Democrats nationwide. We cannot let the GOP's attack on reproductive freedom go unanswered. Chip in today.,political,Google
Democratic National Committee | Stand with Joe & Kamala | Donate TodayAd secure.actblue.com Donate now to elect Democrats everywhere and sustain our fight for the long haul. Winning the White House was just the first step. Now it's time to get to work. Act now.,political,Google
Democratic National Committee | Official Website | Donate NowAd secure.actblue.com Donate to support Joe Biden Kamala Harris and Democrats in every corner of the country. Winning the White House was just the first step. Now it's time to get to work. Act now.,political,Google
Stand With Rick Scott | Donate NowAd secure.winred.com Senator Rick Scott Is 5X-Matching Gifts Until We Hit $1000000. Contribute Immediately! Save The Senate! Stand With Senator Rick Scott and President Trump. Donate Now.,political,Google
5X-Matching All Gifts | Donate NowAd secure.winred.com Senator Rick Scott Is 5X-Matching Gifts Until We Hit $1000000. Contribute Immediately! Save The Senate! Stand With Senator Rick Scott and President Trump. Donate Now.,political,Google
Elect Republican Senators. | Win Back The SenateAd secure.winred.com Official National Republican Senatorial Committee Site. Chip In Today. All Patriots Need To Step Up And Donate Immediately. Help Flip The Senate.,political,Google
Donate Today | Republicans For SenateAd secure.winred.com Support Senate Republicans In 2022. Donate Now. Support The NRSC. Donate Now!,political,Google
Official | Nrsc.org | Donate NowAd secure.winred.com Senator Rick Scott and President Trump Are Counting On You. Give $100 Today. Do Not Wait.,political,Google
Stand With Rick Scott | Save The SenateAd secure.winred.com Senator Rick Scott Is 5X-Matching Gifts Until We Hit $1000000. Contribute Immediately! Save The Senate! Stand With Senator Rick Scott and President Trump. Donate Now.,political,Google
Official Senate Victory | Chip In $10 NowAd secure.winred.com Official NRSC Site. Everything Is At Stake In The 2022 Election. It's America First vs. America Last And It's Time To Decide Where You Stand. Donate Now.,political,Google
Save The Senate | 5X-Matching All GiftsAd secure.winred.com Senator Rick Scott Is 5X-Matching Gifts Until We Hit $1000000. Contribute Immediately! Save The Senate! Stand With Senator Rick Scott and President Trump. Donate Now.,political,Google
Donate To NRSC | Donate To Senate RepublicansAd secure.winred.com Senate Republicans Need Your Help To Win Re-Election In 2022. Donate Today! Every Dollar Counts. Give Now To The National Republican Senatorial Committee.,political,Google
Stand With President Trump | Save The SenateAd secure.winred.com Senator Rick Scott Is 5X-Matching Gifts Until We Hit $1000000. Contribute Immediately! Save The Senate! Stand With Senator Rick Scott and President Trump. Donate Now.,political,Google
Critical Deadline | Stand With Rick ScottAd secure.winred.com Senator Rick Scott Is 5X-Matching Gifts Until We Hit $1000000. Contribute Immediately! Save The Senate! Stand With Senator Rick Scott and President Trump. Donate Now.,political,Google
End Of Month Deadline | Stand With Rick ScottAd secure.winred.com Senator Rick Scott Is 5X-Matching Gifts Until We Hit $1000000. Contribute Immediately! Save The Senate! Stand With Senator Rick Scott and President Trump. Donate Now.,political,Google
Support The NRSC | Flip The Senate RedAd secure.winred.com Donate Now. Every Dollar Counts. Official National Republican Senatorial Committee Site. Support America First Policies.,political,Google
NRSC Donate Now | Official NRSC WebsiteAd secure.winred.com Official National Republican Senatorial Committee Site. Republican Candidates Need Your Help To Win Re-Election In 2022. Donate Today.,political,Google
Attn: Idaho | Stop ChinaAd action.nrsc.org/jointheteam Tell Us Who Was Tougher on China: Biden Or Trump? Don't Wait! The Poll Expires In 30 Minutes! Respond Right Now.,political,Google
Attn: Hoeven | Stop Illegal ImmigationAd action.nrsc.org/jointheteam Sign The Petition to Stop Biden From Housing Illegal Immigrants In Your Neighborhood. Take Action Today To Protect Hoeven From Illegals.,political,Google
Attn: South Dakota | Stop ChinaAd action.nrsc.org/jointheteam Tell Us Who Was Tougher on China: Biden Or Trump? Don't Wait! The Poll Expires In 30 Minutes! Respond Right Now.,political,Google
Attn: Wyoming | Stop ChinaAd action.nrsc.org/jointheteam Tell Us Who Was Tougher on China: Biden Or Trump? Don't Wait! The Poll Expires In 30 Minutes! Respond Right Now.,political,Google
Attn: Nebraska | Stop Illegal ImmigationAd action.nrsc.org/jointheteam Sign The Petition to Stop Biden From Housing Illegal Immigrants In Your Neighborhood. Take Action Today To Protect Nebraska From Illegals.,political,Google
Attn: Nebraska | Stop ChinaAd action.nrsc.org/jointheteam Tell Us Who Was Tougher on China: Biden Or Trump? Don't Wait! The Poll Expires In 30 Minutes! Respond Right Now.,political,Google
Roger Wicker for Senate | Get Involved | Donate To Take Back The SenateAd action.nrsc.org Calling on Republicans: Senator Wicker needs your help. Add your name and act now. Join the team today and add your name to the list of supporters fighting to save America.,political,Google
Stand With Fischer And Trump. | Save The Senate. Sign Up Now.Ad action.nrsc.org/jointheteam President Trump And Deb Fischer Need Your Help To Save The Senate. Join The Team. Fight Back Against The Radical Left's Destructive Policies. Join Now.,political,Google
Attn: Idaho | Stop Illegal ImmigationAd action.nrsc.org/jointheteam Sign The Petition to Stop Biden From Housing Illegal Immigrants In Your Neighborhood. Take Action Today To Protect Idaho From Illegals.,political,Google
Attn: Kansas | Stop ChinaAd action.nrsc.org/jointheteam Tell Us Who Was Tougher on China: Biden Or Trump? Don't Wait! The Poll Expires In 30 Minutes! Respond Right Now.,political,Google
Attn: Alabama | Stop ChinaAd action.nrsc.org/jointheteam Tell Us Who Was Tougher on China: Biden Or Trump? Don't Wait! The Poll Expires In 30 Minutes! Respond Right Now.,political,Google
Stand With Wicker And Trump. | Save The Senate. Sign Up Now.Ad action.nrsc.org/jointheteam President Trump And Roger Wicker Need Your Help To Save The Senate. Join The Team. Fight Back Against The Radical Left's Destructive Policies. Join Now.,political,Google
Stand With Hoeven And Trump. | Save The Senate. Sign Up Now.Ad action.nrsc.org/jointheteam President Trump And John Hoeven Need Your Help To Save The Senate. Join The Team. Fight Back Against The Radical Left's Destructive Policies. Join Now.,political,Google
