AdText,Category,Platform
"High performing SMS Marketing campaigns that connect with voters. Easy to use list segmentation, workflows & video messaging make Tatango the clear choice.",non-political,Google
"Cars, Trucks, and SUVs. New & Used. Compare Prices. Read Reviews. Advanced Search. Over 4.9 Million Listings - Find the Perfect Car Near You at Cars.com. Shop Now! 4.9+ Million Cars. Car Buying Tools. Latest Car Reviews & News. 5 Star Salespeople.",non-political,Google
"Find The Right Used Car For You. Search Used Cars By Make, Model, Price, Mileage And More! Shop Thousands Of Carvana Certified Used Cars, Trucks, SUVs, and Minivans, Hassle-Free. Used Minivans. Used Hybrids. Used Trucks. Used Hatchbacks.",non-political,Google
Search Display Ads On Website. Look Up Results on Info.com,non-political,Google
Search Advertise Advertising. Look Up Results On Gopher.com. Explore Multiple Engines For Advertise Advertising. Search and Find. Trusted Source. Quick Answers. More Information. Find Relevant Results.,non-political,Google
"Search Ads Free on Nation. Visit & Lookup Immediate Results Now. Search ads free at Nation. Find Information. Find Job Info. Explore Resources. Search Online. Career Resources. Types: Information, Materials, Resources.",non-political,Google
"Search for Ads For Advertising. at QuicklySeek! Updated Info. Find it Now. Good Results. Look More Here. Fast Response. Attractive Results. Latest Today. Get More Results. Find it Here. Get Info Now. Services: Searches, News, WebPages.",non-political,Google
"Raise more donations with America's leading political SMS marketing software. Reach millions of potential donors quickly and reliably with SMS marketing. Bank-Grade Security. Expedited Setup Available. 24/7 Live Support. SMS, MMS, RCS Messaging.",non-political,Google
"High performing SMS Marketing campaigns that connect with voters. Easy to use list segmentation, workflows & video messaging make Tatango the clear choice. Bank-Grade Security. 24/7 Live Support. SMS, MMS, RCS Messaging. High Volume Pricing.",non-political,Google
"Target Your Voters Across All Four Screens: TV, Computer, Tablet And Mobile. Learn More. a4 Advertising Helps You Target Opinion Leaders Across The Us Without Waste. Learn More. Campaign Planning. Audience Segmentation. Fraud Prevention. IP Targeting. Geofencing.",non-political,Google
"Cars, Trucks, and SUVs. New & Used. Compare Prices. Read Reviews. Advanced Search. Over 4.9 Million Listings - Find the Perfect Car Near You at Cars.com. Shop Now! Car Match Quiz. Latest Car Reviews & News. 5 Star Salespeople. Car Buying Tools. 4.9+ Million Cars.",non-political,Google
"Carvana Used Cars - 10,000+ Cars Under $15,000
Ad
https://www.carvana.com/used-cars",non-political,Google
"High performing SMS Marketing campaigns that connect with voters. Easy to use list segmentation, workflows & video messaging make Tatango the clear choice. Bank-Grade Security. Expedited Setup Available. High Volume Pricing. 24/7 Live Support.",non-political,Google
"Target Your Voters Across All Four Screens: TV, Computer, Tablet And Mobile. Learn More. a4 Advertising Helps You Target Opinion Leaders Across The Us Without Waste. Learn More. OTT. Campaign Planning. IP Targeting. Geofencing. Audience Segmentation.",non-political,Google
Help Stacey Abrams fight against anti-voter bills across the country. Join our fair fight! Help protect our democracy and protect fair and free elections. Join the fight today!,non-political,Google
"Cars, Trucks, and SUVs. New & Used. Compare Prices. Read Reviews. Advanced Search. Over 4.9 Million Listings - Find the Perfect Car Near You at Cars.com. Shop Now! Car Buying Tools. Car Match Quiz. 5 Star Salespeople. Latest Car Reviews & News. 4.9+ Million Cars.",non-political,Google
Search Advertise Advertising. Look Up Results On Gopher.com. Explore Multiple Engines For Advertise Advertising. Find Relevant Results. Search and Find. Trusted Source. Quick Answers. More Information.,non-political,Google
Search Ads Free on Nation. Visit & Lookup Immediate Results Now.,non-political,Google
Find Ads Online Results Fast On Info.com. Discover Fast Info On Advertising. Find Ads Online Results Quickly On Info.com. Discover Info On Advertising.,non-political,Google
Effective B2B and B2C advertising to early adopters and tech-savvy fans. Secure your spot!,non-political,Google
"Raise more donations with America's leading political SMS marketing software. Reach millions of potential donors quickly and reliably with SMS marketing. Bank-Grade Security. SMS, MMS, RCS Messaging. 24/7 Live Support. Expedited Setup Available.",non-political,Google
"Morrow offers well-designed studio, 1, 2, & 3-bedroom apartments with modern features. Contact our team today for more info on current rates & availability.",non-political,Google
"Find the right apartment doesn't have to be hard. Make Sonder Point, A 50+ Community your new home. Salon. Senior Living. Fitness Center. Spacious Floor Plans. Rooftop Deck. Craft Room. Amenities: Off Street Parking, Free Weights, Bike Racks.",non-political,Google
"Gorgeous Rooftop Deck and Cinema, Finnish Sauna, Boutique Fitness Studio. Tour Today Onsite in the North Loop. Finnish Cedar Sauna. Community Chef's Kitchen. Wet Room. Highlights: Resident Portal Available, Tour Scheduling Option Available.",non-political,Google
Common makes it easy to meet people and discover the best the city has to offer.,non-political,Google
"Cars, Trucks, and SUVs. New & Used. Compare Prices. Read Reviews. Advanced Search. Over 4.9 Million Listings - Find the Perfect Car Near You at Cars.com. Shop Now! Car Match Quiz. 4.9+ Million Cars. 5 Star Salespeople. Car Buying Tools. Latest Car Reviews & News.",non-political,Google
"Find The Right Used Car For You. Search Used Cars By Make, Model, Price, Mileage And More! Shop Thousands Of Carvana Certified Used Cars, Trucks, SUVs, and Minivans...",non-political,Google
"Explore Trusted Advice From Around The Nation. Search Now. Nation.Com Makes Finding Ads On Internet Easy! Expert Advice and Content. Multiple Online Articles. Trusted Sources. Instant Search Results. Types: Trusted Sources, Immediate Search Results.",non-political,Google
Search Display Ads On Website. Visit & Lookup Immediate Results Now. Search multiple engines for Display Ads On Website.,non-political,Google
Search for Ad Advertising,non-political,Google
"MRI-Simmons Measures Consumer Psychographics, Preferences, Attitudes & Media Habits. 600+ Product Categories. 1,000+ Psychographics. 6,500+ Brands. 60k Consumer Elements. 800+ Lifestyle Variables. 50,000+ US Adults.",non-political,Google
"High performing SMS Marketing campaigns that connect with voters. Easy to use list segmentation, workflows & video messaging make Tatango the clear choice. Expedited Setup Available. Bank-Grade Security. High Volume Pricing. 24/7 Live Support.",non-political,Google
"Target Your Voters Across All Four Screens: TV, Computer, Tablet And Mobile. Learn More. a4 Advertising Helps You Target Opinion Leaders Across The Us Without Waste. Learn More. OTT. Fraud Prevention. IP Targeting. Audience Segmentation. Patented Process.",non-political,Google
"High performing SMS Marketing campaigns that connect with voters. Easy to use list segmentation, workflows & video messaging make Tatango the clear choice. Bank-Grade Security. 24/7 Live Support. High Volume Pricing. Expedited Setup Available.",non-political,Google
"Gorgeous Rooftop Deck and Cinema, Finnish Sauna, Boutique Fitness Studio. Tour Today Onsite in the North Loop. Finnish Cedar Sauna. Wet Room. Community Chef's Kitchen. Amenities: Unit Upgrades Galore, Comfy Heated Indoor Parking.",non-political,Google
Amenities designed for community and convenience. All your needs right outside your door,non-political,Google
We Make Renting Apts in Saint Paul as Easy as Booking a Hotel. Your New Home is Here!,non-political,Google
"Our Apts Reflect Your Contemporary Flair With A Unique Fusion Of Style And Sophistication. Studio, 1 & 2 Bedroom Apts That Offer Luxury Amenities For You To Relax & Entertain. Book A Tour. Browse Amenities. Check Floorplans. Amenities: Fitness Center, Movie Room.",non-political,Google
"Free Customized List Of Apts In Pittsburgh Based On Your Needs. It's Super Easy! Free customized list based on your needs. Amenities, pets, commute & more.",non-political,Google
Search for Available Pittsburgh Apartments by Location & Price. Compare Listings! Interactive Map Search. Real-time Intelligence. Ratings & Reviews. Commute Planner.,non-political,Google
"Charming, Completely Updated Buildings With Great Service & Amenities. Call Now!",non-political,Google
"Our Apts Reflect Your Contemporary Flair With A Unique Fusion Of Style And Sophistication. Studio, 1 & 2 Bedroom Apts That Offer Luxury Amenities For You To Relax & Entertain. Sweeping City Views. 24/7 Concierge. Pet-Friendly. Convenient to Heinz Field.",non-political,Google
Search for Available Pittsburgh Apartments by Location & Price. Compare Listings! Find Pittsburgh Rentals Fast & Stress-Free. Check Current Availability Today!,non-political,Google
"Pitt's Official Resource For Finding Housing, Roommates & Subleases Near Campus. Browse Tons Of Apartments In Pittsburgh Near The University Of Pittsburgh!",non-political,Google
Free Customized List Of Apts In Pittsburgh Based On Your Needs. It's Super Easy! Free...,non-political,Google
"Spacious, Clean, & Judgement-Free Gym. Join Now For $1 Down and $10 a Month! No Commitment. Get All the Perks With Our Special Pre-Grand Opening Sale. Only $1 Down, $22.99 a Month. Take A Virtual Tour. Find A Club. Download Our Mobile App.",non-political,Google
"Private care from home, Just The Pill is an online clinic. Birth Control and STI treatment. Online services available now. Aborto con pastillas.",non-political,Google
Free pregnancy testing and ultrasounds help determine viability and dates. Call today. An unexpected pregnancy can be difficult. Womens Care Center is here for you! Call Us Today.,non-political,Google
Abortion Clinic Minneapolis Minnesota Abortion Clinic St. Paul Minnesota. Payment options - self pay or insurance accepted if coverage applies. Birth Control.,non-political,Google
"Get Away to Your Island Home, Right Next Door. Find Great Last-Minute Deals. Take Advantage of Travel Deals & Enjoy Turquoise Waters. Paradise is a Short Flight Away. Travel Information. Official Site. Hotel & Resort Deals.",non-political,Google
"Perfect for Families - Enjoy Water Activities, Gorgeous Beach, Pools, Kid's Club and More! Explore World-class Dining, Baha Mar Casino, Golf, Kid's Club, Sparkling Pools and More!",non-political,Google
Enjoy All Inclusive Luxury Vacations At Sandals. Book Now & Hold Your Room For $49pp!,non-political,Google
Find Employees On The World's #1 Job Site. Post A Job Online In Minutes! Connecting...,non-political,Google
"Thousands of Jobs Now Hiring. Find Jobs Near You & Apply Now! Explore our new features that allow you to plan your commute, apply faster & search easier. Interview Tips. Apply to Jobs in 1 Click. Map-based Search Results. New Jobs Added Daily. Free to Join.",non-political,Google
"Spacious, Clean, & Judgement-Free Gym. Join Now For $1 Down and $10 a Month! No Commitment. Get All the Perks With Our Special Pre-Grand Opening Sale. Only $1 Down, $22.99 a Month. Take A Virtual Tour. Download Our Mobile App. Find A Club.",non-political,Google
"Abortion pills are just one option. Discover all your options, confidentially. Learn more. No matter your circumstance, we can help. Schedule your free appointment. Medical Staff.",non-political,Google
All-Inclusive Vacays From Over 400+ US Departure Airports - Best Internet Rate Guaranteed.,non-political,Google
Save up to $603 on Flight + Hotel. Book Your Bahamas Vacation Package Today!,non-political,Google
"Shop Furniture and Dcor You'll Love! Up To 80% Off Top Brands & Styles. Gift Cards Available. Track Order. View Locations. Styles: Modern, Traditional, Eclectic, Rustic, Glam, Farmhouse, Country, Industrial.",non-political,Google
"IIHS Tests Crashworthiness and Crash Avoidance and Mitigation. Free access! Award winners, model ratings, and buyers guide's to help you choose the safest car. Check Topics. Nonprofit Organization. View News. Highlights: Newsletter Available, Press Room Available.",non-political,Google
Limited Time Only! Order Now and Get 16 Free Meals Plus 3 Free Gifts from HelloFresh. Weekly Menus of Delicious Meals. No Planning Or Grocery Shopping. We Handle Everything. Calorie Smart Options. Skip or Cancel Anytime. Flexible Delivery.,non-political,Google
Every Completed Delivery Puts Money in Your Pockets. No Strings Attached.,non-political,Google
$25 off your first order with Uber Eats. Use code YUM. Terms and Fees apply. Your appetite stays up late. Your delivery should too. Get groceries delivered. Morning caffeine kicks. More food in less taps. More cuisines to taste. Online menus. Order to your door. Service you love.,non-political,Google
Order Food You Love for Less from Grubhub. Order Online Today. Easy Sushi Delivery for Less. Order Online or in the App. Express Reorder. Track Your Order. Contact-Free Delivery.,non-political,Google
"21 Convenient Locations. Dine In, Carry Out, Curbside Pickup or Delivery. Local & Family...",non-political,Google
"$25 off your first order with Uber Eats. Use code YUM. Terms and Fees apply. Crunchy, cheesy, sweet, and salty. Find it all in the Uber Eats Official Site. Morning caffeine kicks.",non-political,Google
"Get U GARDEN RESTAURANT Delivered to Your Home or Office. Download Our Mobile App. Become A Partner. Find A Restaurant. Highlights: Gift Cards Available, App Available.",non-political,Google
"Explore Our Insights on Sustainability Strategy, Decarbonization & Sustainable Investing. McKinsey Works with Clients on Innovation & Growth that Advances Sustainability.",non-political,Google
Greening companies aren't lower carbon today. But have credible plans to get there. The world needs as many greening companies as possible chasing down emissions.,non-political,Google
Eco-friendly technology on every locomotive. Good for our customers. Better for the planet,non-political,Google
All the most important market news. All in one place. Get it now for less thatn $2/month.,non-political,Google
Amazon warehouse jobs. Earn up to $23.10/hr. $5000 bonus in select locations. We have part-time and full-time opportunities with flexible schedules up to 40 hours/week.,non-political,Google
"Start as a package handler, stay for a career. Choose your shift at one of our warehouses. Join the essential team members our communities trust and appreciate. Apply Now! Up To $18.50/hr. Osseo, MN. Maple Grove, MN. Types: Warehouse Jobs, Distribution Jobs.",non-political,Google
"New Drivers, get $500 for only 5 deliveries within 10 days of hire date. Earn money by...",non-political,Google
Search For Jobs & Post Jobs. Try The World's #1 Job Site Now! Post a Job in Minutes. Hire Local Talent. Number 1 Job Site. Reach 250M Job Seekers.,non-political,Google
"Whether you are looking for full-time or part-time jobs, Amazon is hiring in your area.",non-political,Google
Thousands of Jobs Now Hiring. Find Jobs Near You & Apply Now! Explore our new...,non-political,Google
Discover full-time and part-time jobs near you at Amazon. No previous experience required. Learn and grow while you earn up to $22/hr. Get up to $3000 sign-on bonus. Apply now!,non-political,Google
"Easy Online Financing. Our 12+ Financing Partners Compete to Get You a Competitive Rate. Get Your Car or Truck Shipped to Your Home or a Convenient Nearby Location. No Accident Cars Only. 400+ Makes & Models. Trade-In, Finance or Buy.",non-political,Google
"100% Online Used Car Buying. Safe, Touchless Delivery. 10,000+ Cars Less Than $20,000. Find The Right Used Car For You. Search Used Cars By Make, Model, Price, Mileage And...",non-political,Google
Browse Our New and Used Inventory Now to Save Time and Money on Your Automotive Purchase,non-political,Google
Help register record numbers of American voters - share with your friends and family. Celebrate National Voter Registration Day By Making Sure You Are #VoteReady. Vote by mail. Absentee ballots. Check registration status. Early voting. Voter registration.,non-political,Google
"Confirm you are registered to vote in your state. Confirm your voter card and polling place. Find Voting Location. Update Your Address. 2021 Election Information. Types: Register to Vote, Find Your Voting Location, Election Guide, Ballot Lookup, Candidate Information.",non-political,Google
"From National Restaurants to Local Mom & Pops, DoorDash Delivers the Top Restaurants.",non-political,Google
Discover Delivery Restaurants Near You. Order Online Here.,non-political,Google
Order Food You Love for Less from Grubhub. Order Online Today. Easy Sushi Delivery for...,non-political,Google
$25 off your first order with Uber Eats. Use code YUM. Terms and Fees apply. Easy...,non-political,Google
"Food, drinks and groceries available for delivery or pickup. Postmates is the largest, most...",non-political,Google
Get U GARDEN RESTAURANT Delivered to Your Home or Office. Become A Partner.,non-political,Google
"New Drivers, get $500 for only 5 deliveries within 10 days of hire date. Earn money by helping others get the things they need. Simple. No shopping required. Earn up to $20/hr. 24/7 support. Drivers Needed. Get paid instantly.",non-political,Google
"Start as a package handler, stay for a career. Choose your shift at one of our warehouses. Join the essential team members our communities trust and appreciate. Osseo, MN.",non-political,Google
Job Listings From Thousands of Websites in One Simple Search.,non-political,Google
Search For Jobs & Post Jobs. Try The World's #1 Job Site Now! Number 1 Job Site. Reach 250M Job Seekers. Post a Job in Minutes. Hire Local Talent.,non-political,Google
New Jobs Open In Falcon Heights. No Experience Required. Hiring Now. Apply Today! Find...,non-political,Google
"New Drivers, get $500 for only 5 deliveries within 10 days of hire date. Earn money by helping others get the things they need. Simple. Drivers Needed. 24/7 support. Get paid instantly. Earn up to $20/hr. Highlights: Mobile App Available, Live Chat Option Available.",non-political,Google
Start your free culinary arts training at a Job Corps center near you. Ages 16-24. Job Corps gives you skills and experience employers are looking for. Careers begin here.,non-political,Google
Job Listings From Thousands of Websites in One Simple Search. World's Best Job Site.,non-political,Google
"Cars, Trucks, and SUVs. New & Used. Compare Prices. Read Reviews. Advanced Search. Over 4.9 Million Listings - Find the Perfect Car Near You at Cars.com. Shop Now! 5 Star Salespeople. Latest Car Reviews & News. Car Buying Tools. 4.9+ Million Cars.",non-political,Google
"Find The Right Used Car For You. Search Used Cars By Make, Model, Price, Mileage And More! Shop Thousands Of Carvana Certified Used Cars, Trucks, SUVs, and Minivans, Hassle-Free. Used Cars For Sale Online. Used Cars For Sale. Instant Trade-In Offers.",non-political,Google
"Build, Price & Locate a Dealer in Your Area. Find Your 2021 Nissan Now! Enjoy Technology That Makes You Feel More Connected, Confident, and Excited. Advanced Safety. Leading Technology. Exhilarating Power. Remote Start. Dynamic Design.",non-political,Google
Search Ads Site on Nation. Visit & Lookup Immediate Results Now. Search ads site at Nation. Find Information. Explore Resources. Career Resources. Find Job Info.,non-political,Google
Find Ad advertising at QuicklySeek. Find Ad advertising. Get Info Now. Latest Today. Good Results. Fast Response. Updated Info. Look More Here. Get More Results.,non-political,Google
Search For Advertising ads. Learn More With The Next Search,non-political,Google
Find Advertising Ads now. Check out essential info on Finecomb.com,non-political,Google
"Target Your Voters Across All Four Screens: TV, Computer, Tablet And Mobile. Learn More.",non-political,Google
Raise more donations with America's leading political SMS marketing software. Reach...,non-political,Google
"Learn where and when to vote. Early voting, ballot drop boxes, and Election Day locations. Learn where and when to vote. Early voting, drop boxes, and Election Day locations. Find Your Location. Search Now. Services: New Jersey Elections, Virginia Elections.",non-political,Google
"Find Your Local Polling Place. Get complete information for 2021. Find Voting Location. Compare Candidates. Voter ID Laws. Types: Register to Vote, Find Your Voting Location, Election Guide, Ballot Lookup, Candidate Information.",non-political,Google
Free tool to find your Elected Officials and their contact info. Join The Movement Over 1 Million Strong For Democracy. Contact Your Rep. Find your lawmakers. Your Voice Matters.,non-political,Google
"We are building the pipeline to run for office at the local, state and federal levels. AAPI...",non-political,Google
We Make Renting Apts in Saint Paul as Easy as Booking a Hotel. Your New Home is Here! Take the Hassle out of Your Apartment Hunt. Search for a New Apartments on Zumper Today. Apartment Amenities. Virtual Tours. #1 Rental Marketplace. Video Tours.,non-political,Google
"Use Zillow's advanced search filters to find your perfect rental in your price range. Plus, save a search to get notified about new listings that fit your criteria. Search now. 3D Tours Available. Tour Scheduling. Nearby Schools. Local Legal Protections. Pet-Friendly Filters.",non-political,Google
"Personal and Auto Loans from $1,500 to $20,000. One-on-One Support. In Business Since 1912. Clear Payoff Schedule. Fixed Rates and Payments. Types: Secured, Unsecured, Personal Loans.",non-political,Google
Get Preapproved & Compare Loans - Get Started Today! Great Incentives. Lock Your Rate.,non-political,Google
"Our Apts Reflect Your Contemporary Flair With A Unique Fusion Of Style And Sophistication. Studio, 1 & 2 Bedroom Apts That Offer Luxury Amenities For You To Relax & Entertain. Browse Amenities. Book A Tour. Check Floorplans. Amenities: Fitness Center, Movie Room.",non-political,Google
Search for Available Pittsburgh Apartments by Location & Price. Compare Listings! Find Pittsburgh Rentals Fast & Stress-Free. Check Current Availability Today! Real-time Intelligence. Unmatched Exposure. Ratings & Reviews. Community Information.,non-political,Google
"Pitt's Official Resource For Finding Housing, Roommates & Subleases Near Campus.",non-political,Google
"Spacious, Clean, & Judgement-Free Gym. Join Now For $1 Down and $10 a Month! No Commitment. Get All the Perks With Our Special Pre-Grand Opening Sale. Only $1 Down, $22.99 a Month. Download Our Mobile App. Take A Virtual Tour. Find A Club.",non-political,Google
"Beautiful, Well-Managed Apartments in the Trendy Highland Park Area. Call Today! Find the perfect place to come home. Pay Rent Online. Request Maintenance. Modern Properties.",non-political,Google
Looking for Homes for Sale? Connect with a local Realtor and find your next Property. Find...,non-political,Google
Let us Help You Find the House of Your Dreams. Start Working with an Agent Today,non-political,Google
Get all the new listings first. See more photos & other property details than other sites. Are...,non-political,Google
"Experience Amazing White Sand Beaches, Dolphin Swimming, Exhilarating Water Slides & More. Cyber Sale! Book Today & Receive 20% Off + $250 Resort Credits Or More At Atlantis Bahamas. Flexible Cancellations. Book Now & Pay Later. Get Exclusive Offers.",non-political,Google
Bundle Your Flight + Hotel & Save! Make Your Trip Memorable. 11+ Million Hotel Reviews.,non-political,Google
"Perfect for Families - Enjoy Water Activities, Gorgeous Beach, Pools, Kid's Club and More!",non-political,Google
"Free Shipping on All Orders Over $35. Shop Shelf, Home Dcor, Cookware & More! Free Shipping on All Orders Over $35. Shop Shelf, Furniture, Storage & More! Over 7 Million Items. Exclusive Daily Sales. 2-Day Shipping. Great Ways to Save. Home Decorating Ideas.",non-political,Google
Choose Yoga Tune Up Fitness To Penetrate Skin & Muscle To Relieve High Tension Areas. Our Best Sale Of The Year Starts Now! Stress Less & Save 25% Sitewide. Code...,non-political,Google
Best-Buy Award Winning Fitness Brands & Products. Professional Delivery & Installation.,non-political,Google
"2021 Top Personal Loans | Low Interest | Top Lenders | Comparison | Free Online Offers. Easy Online Form. Up to $100,000 in 24 hrs. Low Fixed Rates. Connect With Top Lenders!",non-political,Google
Loan sharks. Cash Online 24/7. All Credit Types OK. Low Rates. Cash Straight To Your Bank.,non-political,Google
High Approval Loans For All Credit Types. Get Cash Same Day. No Upfront or Hidden Fees.,non-political,Google
"100% Trusted Solution. Safe, Secure, Reliable. No Hidden Fees. Don't Wait Get Started Now!",non-political,Google
"At Affinity Plus, We Help You Through The Whole Car-Buying Process. Whether You're...",non-political,Google
See Your Real Monthly Payment On Millions Of Vehicles Before Visiting The Dealer.,non-political,Google
"Apply For A Quick & Easy Pre-Approval Online, Then Take Home Your New Car Today! Get...",non-political,Google
Flexible New or Used Auto Loan Plans That Will Help You Afford The Car Of Your Dreams,non-political,Google
Free For Simple Returns Only With TurboTax Free Edition. Get Your Max Refund Today. File Your Federal And State Tax Forms With TurboTax & Get Every Dollar That You Deserve. Maximum Refund Guaranteed. Easy and Accurate. File On Any Device.,non-political,Google
"Create your own modern, professional website with no technical knowledge required. Your search for ""build a website"" is a10/10match. Swipe-to-Style Interface.",non-political,Google
