AdText,Category,Platform
Empowering people with creative ideas to succeed. Start your free trial. With Squarespace...,non-political,Google
Build a Website That Looks Stunning. It's Easy & Free with Wix. Get Started Now. --,non-political,Google
Free & Top-Rated Website Builders 2021. Test For Free! Design Flexibility. Try It Free.,non-political,Google
"Sale ends in 1 day. Black Friday deals, golden opportunity. Shop now to save on thousands of online courses. Learn More For Less. Black Friday Savings. 30-day guarantee.",non-political,Google
"We Match You to Bootcamps with Flexible Options, Income Sharing, or Money-Back Guarantees. Career Karma Helps 1 Million+ People Each Month Find A Career in Tech. Meet Mentors. Everything in One Place. 18+ To Apply. Online Community. Free Events.",non-political,Google
Learn front end and back end web development technologies in a collaborative setting. A program that fits around your schedule with evening and weekend sessions. Apply now.,non-political,Google
Dev & IT Certification training online. Interactive courses & practice tests. Start now! Role IQ.,non-political,Google
Learn Angular online at your own pace. Start today and improve your skills. Join millions of...,non-political,Google
"Bring Hands-On Training to Your Home Computer with Live, Instructor-Led Courses. Develop...",non-political,Google
"Full-Stack Developer Bootcamp, HTML, CSS, Java Script, SQL, Data Modeling and more. Apply",non-political,Google
Learn front end and back end web development technologies in a collaborative setting. A program that fits around your schedule with evening and weekend sessions. Apply now. Certificate of Completion. Limited seats available. Enrolling now. Job planning support.,non-political,Google
"Sale ends in 1 day. Black Friday deals, golden opportunity. Shop now to save on thousands of online courses. Top Skills, Low Prices. Price Drop. Skill Boost. Black Friday Savings.",non-political,Google
"Rigorous Data Science Program for Professionals to build industry-valued skills. Learn Machine Learning, Deep Learning, NLP, Recommendation Systems, and more. Apply Now.",non-political,Google
"Learn the concepts of Artificial Intelligence with Python - Pandas, NumPy & Matplotlib. Learn...",non-political,Google
Allina Health primary care doctor Will be with you during life's biggest moments. Your perfect family doctor is right here at Allina Health. Easy and convenient. Find a location.,non-political,Google
Personalized Care - 7 Days Free Doctor Follow Ups - Prescriptions - And More - Try .,non-political,Google
"Board-certified doctors are ready to help with cough, cold, flu, rash, allergies & more. Get peace of mind. Have a visit in minutes to take care of your medical concerns. Avail Weekends & Holidays. Urgent Care Services. $55 or Less Per Visit. Child or Adult Visits.",non-political,Google
$23/visit or $12/month and Open 24/7. Affordable and Available Healthcare - K Health. The Closest Clinician's Office is in Your Pocket. Trusted by Over 5 Million Patients. No Copays.,non-political,Google
Kids Love Cooking! A Culinary Lesson and Mealtime Solution in One. Learn to Cook Today! Raddish is a Cooking Club for Kids. Discover Edible Education and Get Cooking!,non-political,Google
Save On Unlimited Access To Thousands Of Recipes. Now $2.50/month. Subscribe Today. Saut. Sear. Simmer. Savor. Save. The NYT Cooking Sale. Up To 50% Off. Subscribe...,non-political,Google
"Including vegetarian substitutions and are high in protein, fiber, and healthy fats. Easy...",non-political,Google
"Creative, cost-effective home cooking tips for less waste. Learn more. Safeguard the Earth.",non-political,Google
"100% Online Used Car Buying. Safe, Touchless Delivery. 10,000+ Cars Less Than $20,000. Find The Right Used Car For You. Search Used Cars By Make, Model, Price, Mileage And More! 7-Day Risk Free Returns. 20,000+ Cars For Sale. Delivery To Your Door.",non-political,Google
Expert Auto Repair & Service All Makes Welcome Low Cost Rental Cars. Call Now!,non-political,Google
Easy Online Financing. Our 12+ Financing Partners Compete to Get You a Competitive Rate.,non-political,Google
Help register record numbers of American voters - share with your friends and family. Celebrate National Voter Registration Day By Making Sure You Are #VoteReady. Vote by mail. Early voting. Voter registration. Check registration status. Absentee ballots.,non-political,Google
"Confirm you are registered to vote in your state. Confirm your voter card and polling place. Update Your Address. Find Voting Location. 2021 Election Information. Types: Register to Vote, Find Your Voting Location, Election Guide, Ballot Lookup, Candidate Information.",non-political,Google
"IIHS Tests Crashworthiness and Crash Avoidance and Mitigation. Free access! Award winners, model ratings, and buyers guide's to help you choose the safest car. View News. Nonprofit Organization. Check Topics.",non-political,Google
Use code FREEFOOD at checkout for a $0 delivery fee on your order. Customize Your...,non-political,Google
Find the Best Delivery Restaurants Near You. Order Online Today.,non-political,Google
"$25 off your first order with Uber Eats. Use code YUM. Terms and Fees apply. Choose a no-contact food delivery option. All taste, less touch. No-contact deliveries. Breakfast, Lunch, Dinner. Late night dessert. 100+ local foodie spots. More food in less taps.",non-political,Google
"$25 off your first order with Uber Eats. Use code YUM. Terms and Fees apply. Find what you're craving, place your order, and track your food in the app. More food in less taps.",non-political,Google
All the most important market news. All in one place. Get it now for less thatn $2/month. Subscribe for full digital access on The Bloomberg App or Bloomberg.com. Instant Access.,non-political,Google
Unlock the value of the sustainable digital technology to transform your business with us. Championing a net zero future with Capgemini will make your business more sustainable. Consumer products retail. Telecoms. Manufacturing. Automotive. High tech.,non-political,Google
"GS Partners With Global Businesses to Transition to an Inclusive, Low-Carbon Economy.",non-political,Google
"Start as a package handler, stay for a career. Choose your shift at one of our warehouses. Join the essential team members our communities trust and appreciate. Osseo, MN. Maple Grove, MN. Up To $18.50/hr. Types: Warehouse Jobs, Distribution Jobs.",non-political,Google
"Start as a package handler, stay for a career. Choose your shift at one of our warehouses. Join the essential team members our communities trust and appreciate. Up to $22.50/hr.",non-political,Google
Search For Jobs & Post Jobs. Try The World's #1 Job Site Now! Number 1 Job Site. Hire Local Talent. Post a Job in Minutes. Reach 250M Job Seekers.,non-political,Google
New Jobs Open In Maplewood. No Experience Required. Hiring Now. Apply Today! Find...,non-political,Google
"Highly Qualified Talent You Can't Reach Anywhere Else. Get Started Today! More Than A Job Board. Over 1 Million Candidates. Custom Hiring Solutions. US-Based Customer Service. Industry-Focused Platform. Types: Hiring Advice, Hiring Resources.",non-political,Google
"Maplewood, MN Jobs - $19-57/Hr: Hiring Immediately
Ad
https://www.jobs2careers.com/maplewood/hiring-now",non-political,Google
"Cars, Trucks, and SUVs. New & Used. Compare Prices. Read Reviews. Advanced Search. Over 4.9 Million Listings - Find the Perfect Car Near You at Cars.com. Shop Now! Car Buying Tools. Latest Car Reviews & News. Car Match Quiz. 4.9+ Million Cars. 5 Star Salespeople.",non-political,Google
"Explore Trusted Advice From Around The Nation. Search Now. Nation.Com Makes Finding Ads On Internet Easy! Trusted Sources. Multiple Online Articles. Expert Advice and Content. Instant Search Results. Types: Trusted Sources, Immediate Search Results.",non-political,Google
Find Ads Online Results Fast On Info.com. Discover Fast Info On Advertising. Find Ads...,non-political,Google
Find Ads for advertising at QuicklySeek,non-political,Google
Search Ads Site. Visit & Lookup Immediate Results Now. Search Ads Site. Look Up...,non-political,Google
"High performing SMS Marketing campaigns that connect with voters. Easy to use list segmentation, workflows & video messaging make Tatango the clear choice. High Volume Pricing. SMS, MMS, RCS Messaging. Expedited Setup Available. Bank-Grade Security.",non-political,Google
"Target Your Voters Across All Four Screens: TV, Computer, Tablet And Mobile. Learn More. a4 Advertising Helps You Target Opinion Leaders Across The Us Without Waste. Learn More. IP Targeting. Patented Process. Campaign Planning. Audience Segmentation. OTT.",non-political,Google
"High performing SMS Marketing campaigns that connect with voters. Easy to use list segmentation, workflows & video messaging make Tatango the clear choice. 24/7 Live Support. High Volume Pricing. SMS, MMS, RCS Messaging. Expedited Setup Available.",non-political,Google
"Find your polling place. Register to vote. Find out what's on your ballot. Get updated information including recent changes to polling locations. Compare Candidates. Find Voting Location. Voter ID Laws. Types: Register to Vote, Find Your Voting Location, Election Guide.",non-political,Google
"Beacon College Is Growing And So Are Our Needs For Housing, Classroom Space, And More. Donate Now To Support Beacon College Students & Help Them Continue Their Journey. Thanks! Founded in 1989. 70% Graduation Rate. Internships For All.",non-political,Google
"Learn where and when to vote. Early voting, ballot drop boxes, and Election Day locations.",non-political,Google
Morrow is conveniently located at the midway point between St. Paul and Minneapolis. Allowing you to get anywhere in the cities for work or play within minutes.,non-political,Google
We Make Renting Apts in Saint Paul as Easy as Booking a Hotel. Your New Home is Here! Take the Hassle out of Your Apartment Hunt. Search for a New Apartments on Zumper Today. 1 in 6 adults uses Zumper. Virtual Tours. Apartment Amenities.,non-political,Google
"Lifestyle amenities such as: pet grooming area, bike fix-it & fitness centers, maker space. Pet friendly, fire pit, yoga lawn, grilling stations, entertainment suite, bike friendly. Call Now.",non-political,Google
Multi-Platform Search Capability Allows You to Connect with Your Dream Home with Ease,non-political,Google
Low Interest. 2021 Top Lenders. Comparison. Reviews. Top Loan Companies.,non-political,Google
We'll Spot You on Debit Card Purchases w/o Overdraft Fees. Eligibility requirements apply*,non-political,Google
"Our Apts Reflect Your Contemporary Flair With A Unique Fusion Of Style And Sophistication. Studio, 1 & 2 Bedroom Apts That Offer Luxury Amenities For You To Relax & Entertain. Browse Amenities. Check Floorplans. Book A Tour. Amenities: Fitness Center, Movie Room.",non-political,Google
Search for Available Pittsburgh Apartments by Location & Price. Compare Listings! Find Pittsburgh Rentals Fast & Stress-Free. Check Current Availability Today! Real-time Intelligence. Interactive Map Search. Commute Planner. Unmatched Exposure.,non-political,Google
Search like a Realtor with your Custom MLS Search Features. Ad Free. Fastest Updates. More Home Listings. 1000s of Listings. Full Database Access. Daily Listing Updates. No Ads.,non-political,Google
"Filter Homes By Zip Code, Number Of Bedrooms, Baths And Much More. Tour Virtually...",non-political,Google
"Get Away to Your Island Home, Right Next Door. Find Great Last-Minute Deals. Take Advantage of Travel Deals & Enjoy Turquoise Waters. Paradise is a Short Flight Away.",non-political,Google
Bundle Your Flight + Hotel & Save! Make Your Trip Memorable. Exclusive Deals.,non-political,Google
"Free Shipping on All Orders Over $35. Shop Shelf, Home Dcor, Cookware & More! Free...",non-political,Google
"Wire, steel & plastic shelving. Pallet, reel & dunnage racking. Bins, totes & cabinets. Lockers...",non-political,Google
