AdText,Category,Platform
Vote for Claire McCaskill | Find Your Polling PlaceAd showmevotes.com Claire is fighting for Missourians. Vote for Claire on November 6!,political,Google
Vote for Claire McCaskill | Find Your Polling PlaceAd showmevotes.com On November 6 be sure to show up to the polls to vote for Claire!,political,Google
Vote for Claire McCaskill | Find Your Polling PlaceAd showmevotes.com Shes fighting to protect our health care. Vote for Claire on November 6!,political,Google
Vote for Claire McCaskill | Missouri Senate Election 2018Ad showmevotes.com Show up to the polls on Nov. 6 and vote for Claire! Confirm your polling place.,political,Google
Vote for Claire McCaskill | Find Your Polling PlaceAd showmevotes.com Claire cares about Missouri and shes fighting for our values. Vote on Nov. 6!,political,Google
Vote for Claire McCaskill | Find Your Polling PlaceAd showmevotes.com Shes fighting to defend workers rights. Vote for Claire on November 6!,political,Google
Vote for Claire McCaskill | Find Your Polling PlaceAd showmevotes.com Claire was named one of the hardest working senators. Vote for her on Nov. 6!,political,Google
Democrats Only | Free Campaign TrainingsAd traindemocrats.org Running for office but need help getting started? Sign up for our free course.,political,Google
"Running For Office? | Get Your Campaign Started NowAd traindemocrats.org Take our free ""Getting Your Campaign Off The Ground"" course & launch today!",political,Google
Running For Office? | Get Free Help From ExpertsAd traindemocrats.org Running for office but need help getting started? Sign up for our free course.,political,Google
Build Your Campaign Network | Sign Up For Our Free CourseAd traindemocrats.org Our course developed by experts will help you lay the groundwork and win.,political,Google
Launching A Campaign Is Hard | Our Free Course Can Help YouAd traindemocrats.org Launch an expert campaign with our free campaign training course.,political,Google
"Want To Run For Office? | Need Help Deciding?Ad traindemocrats.org Explore our free ""So You Think You Want to Run"" course & get tips from experts!",political,Google
Support Medicare for All? | You've been chosen for a poll | Support universal healthcare?Ad civiqs.com We're an online survey company that wants your opinion on the important issues of today. Click to take a Civiqs survey. Your opinion matters!,political,Google
Is President Trump corrupt? | Take a Civiqs survey | Take a quick surveyAd civiqs.com Thousands of people are making their voices heard every day. Join us! We're an online survey company that wants your opinion on the important issues of today.,political,Google
Profiting off presidency? | You've been chosen for a poll | Is President Trump corrupt?Ad civiqs.com Do you think Trump is profiting off of being in office? Take a Civiqs survey. Your opinion matters!,political,Google
Are you for Medicare for All? | You've been chosen for a poll | Should health care cost less?Ad civiqs.com You've been chosen. Click to take a Civiqs survey. Your opinion matters!,political,Google
Is President Trump corrupt? | Take a Civiqs survey | You've been chosen for a pollAd civiqs.com We're an online survey company that wants your opinion on the important issues of today. Thousands of people are making their voices heard every day. Join us!,political,Google
Is President Trump corrupt? | Profiting off presidency? | You've been chosen for a pollAd civiqs.com Do you think Trump is profiting off of being in office? Take a Civiqs survey. Your opinion matters!,political,Google
Profiting off presidency? | Profiting off presidency?Ad civiqs.com Do you think Trump is profiting off of being in office?,political,Google
Are you for Medicare for All? | Should health care cost less? | You've been chosen for a pollAd civiqs.com You've been chosen. Click to take a Civiqs survey. Your opinion matters!,political,Google
Profiting off presidency? | You've been chosen for a poll | Is President Trump corrupt?Ad civiqs.com Do you think Trump is profiting off of being in office? Your opinion matters!,political,Google
Poll- You've Been Chosen | Did you vote for Trump?Ad civiqs.com Take a 5-question political survey. How do you feel about the president?,political,Google
Did you vote for Trump? | Poll- You've Been ChosenAd civiqs.com Take a 5-question political survey. How do you feel about the president?,political,Google
Poll- You've Been Chosen | Did you vote for Clinton?Ad civiqs.com Take a 5-question political survey. How do you feel about the president?,political,Google
Did you vote for Clinton? | Poll- You've Been ChosenAd civiqs.com Take a 5-question political survey. How do you feel about the president?,political,Google
Money Metals Exchange | Enter Now for a Chance to Win | Win 50 Trump Silver CoinsAd moneymetals.com/Sweepstakes/Trump As an effort to promote the importance of honest money we're giving away 50 silver rounds Enter to win 50 uncirculated Donald Trump Silver Rounds honoring Americas 45th President.,political,Google
Guess This Best Selling Coin | For a Chance to Win 50 of Them | Win 50 Trump Silver CoinsAd moneymetals.com/Sweepstakes/Trump Enter to win 50 uncirculated Donald Trump Silver Rounds honoring Americas 45th President. As an effort to promote the importance of honest money we're giving away 50 silver rounds,political,Google
Gold Bullion For Sale Online | Low Prices & Fast Shipping | Diversify Your PortfolioAd moneymetals.com/gold/bullion An Investor Can Buy Bullion Bars Coins and Rounds in Almost Any Size and Quantity Gold Bullion Bars And Coins For Sale Here at Money Metals Exchange!,political,Google
Borrow Against Your Gold | Low Rates on $25000+ | Low Rates on $25K+ LoansAd moneymetals.com/loans/gold We can offer you a cash loan secured by your gold & silver bullion coins bars or rounds. Since you tender quality collateral to secure your loan we can offer low interest rates.,political,Google
"Honoring the 45th President | 1 oz of .999 Pure Silver | President Trump Silver RoundsAd moneymetals.com Inscriptions: ""Donald J Trump"" and ""45th President."" ""The White House"" & ""1 oz 999 AG."" 1 ounce of .999 pure silver bullion to commemorate the 45th President of the United States",political,Google
"Honoring the 45th President | 1 oz of .999 Pure Silver | President Trump Silver CoinsAd moneymetals.com Inscriptions: ""Donald J Trump"" and ""45th President."" ""The White House"" & ""1 oz 999 AG."" 1 ounce of .999 pure silver bullion to commemorate the 45th President of the United States",political,Google
"Honoring the 45th President | 1 oz of .999 Pure Silver | Make America Great AgainAd moneymetals.com 1 ounce of .999 pure silver bullion to commemorate the 45th President of the United States Inscriptions: ""Donald J Trump"" and ""45th President."" ""The White House"" & ""1 oz 999 AG.""",political,Google
Valued at More Than $1000 | Enter Now for a Chance to Win | Money Metals ExchangeAd moneymetals.com/Sweepstakes/Trump As an effort to promote the importance of honest money we're giving away 50 silver rounds Enter to win 50 uncirculated Donald Trump Silver Rounds honoring Americas 45th President.,political,Google
Guess This Best Selling Coin | Valued at More Than $1000 | Enter Now for a Chance to WinAd moneymetals.com/Sweepstakes/Trump Enter to win 50 uncirculated Donald Trump Silver Rounds honoring Americas 45th President. As an effort to promote the importance of honest money we're giving away 50 silver rounds,political,Google
Money Metals Exchange | Win 50 Trump Silver Rounds | Win 50 Trump Silver CoinsAd moneymetals.com/Sweepstakes/Trump As an effort to promote the importance of honest money we're giving away 50 silver rounds Enter to win 50 uncirculated Donald Trump Silver Rounds honoring Americas 45th President.,political,Google
Money Metals Exchange | Enter Now for a Chance to Win | Win 50 Trump Silver RoundsAd moneymetals.com/Sweepstakes/Trump Enter to win 50 uncirculated Donald Trump Silver Rounds honoring Americas 45th President. As an effort to promote the importance of honest money we're giving away 50 silver rounds,political,Google
Win 50 Trump Silver Rounds | Valued at More Than $1000 | Enter Now for a Chance to WinAd moneymetals.com/Sweepstakes/Trump As an effort to promote the importance of honest money we're giving away 50 silver rounds Enter to win 50 uncirculated Donald Trump Silver Rounds honoring Americas 45th President.,political,Google
Urgent Poll: Should Trump Join | Democrats to Ban Guns-Vote NowAd lg.libertyheadlines.com/Poll/VoteNow Should Trump & Republican majority Congress join Democrats on gun control?,political,Google
Governor Roy Cooper | Make a donation todayAd secure.actblue.com Together well keep NC moving forward. Chip in to power our grassroots campaign.,political,Google
Governor Roy Cooper | Make a donation today | actblue.comAd secure.actblue.com Together well keep NC moving forward. Chip in to power our grassroots campaign.,political,Google
Governor Roy Cooper | Make a donation today | Official 2020 Re-Election SiteAd secure.actblue.com Together well keep NC moving forward. Chip in to power our grassroots campaign.,political,Google
Governor Roy Cooper | Make a donation today | Fight right-wing attacksAd secure.actblue.com Together well keep NC moving forward. Chip in to power our grassroots campaign.,political,Google
Governor Roy Cooper | Make a donation today | North Carolina first alwaysAd secure.actblue.com Together well keep NC moving forward. Chip in to power our grassroots campaign.,political,Google
Dan Forest | Opposes Medicaid Expansion | Get the FactsAd danforestfacts.com Dan Forest opposes expanding health care to 500000 North Carolinians. Expanding Medicaid would boost the economy by $4 billion and could create 40000 jobs.,political,Google
Dan Forest | Denying NC health care | During a pandemicAd danforestfacts.com Dan Forest opposes Medicaid expansion denying 500000 North Carolinians health care. Forest would deny health care to veterans childcare workers and grocery store workers.,political,Google
Dan Forest | Wants to deny you health care | During a pandemicAd danforestfacts.com Dan Forest opposes Medicaid expansion denying 500000 North Carolinians health care. Get the facts about his failed leadership for North Carolina.,political,Google
Dan Forest: Wrong on COVID-19 | North Carolina Deserves Better | Get the FactsAd danforestfacts.com Dan Forest is dangerously wrong for North Carolina Get the facts about his failed leadership during a pandemic.,political,Google
Dan Forest | Playing Politics with COVID-19 | Get the FactsAd danforestfacts.com Dan Forest has put politics ahead of the advice of the medical community Get the facts about his failed leadership during a pandemic.,political,Google
Get the Facts on Dan Forest | Playing Politics With COVID-19 | North Carolina Deserves BetterAd danforestfacts.com Dan Forest is playing politics with this pandemic. He is dangerously wrong for NC. Get the facts about his failed leadership during a pandemic.,political,Google
Dan Forest is not who he seems | What is he hiding? | Find out nowAd whatsdanhiding.com Dan Forest's biggest donor was found guilty in a federal bribery trial. What else is he hiding? He can't be trusted with the future of North Carolina.,political,Google
What's Dan Forest Hiding? | North Carolina needs answersAd whatsdanhiding.com Dan Forest's biggest donor was found guilty of bribing a government official. Forest can't be trusted with the future of North Carolina. Say no to Dan Forest.,political,Google
Forest hiding a shady donation | What else is he hiding? | Find out nowAd whatsdanhiding.com Dan Forest's biggest donor was found guilty of bribing a government official. Forest can't be trusted with the future of North Carolina. Say no to Dan Forest.,political,Google
Roy Cooper for Governor | North Carolina 2020 | Stand up for progress.Ad secure.actblue.com Don't let GOP dark money sway this election. Chip in & help power our grassroots campaign. Donate before our first public fundraising deadline of the election year!,political,Google
Roy Cooper for Governor | BIG FEBRUARY 15th DEADLINE | Become a Founding Donor TodayAd secure.actblue.com Weve fought to expand Medicaid & enacted protections for our most vulnerable citizens. Together were helping folks rebuild from natural disasters. Help us keep moving forward.,political,Google
Stop GOP Attacks on Democracy | Donate to Governor Roy CooperAd secure.actblue.com Republicans have deceived all of North Carolina and these actions must have consequences. This disgrace to our democracy cannot stand.,political,Google
Donate to Governor Roy Cooper | Stop GOP deception and lies | Protect our DemocracyAd secure.actblue.com NC Republicans overrode Gov. Cooper's budget veto while he attended a 9-11 memorial. This disgrace to our democracy cannot stand.,political,Google
Donate to Governor Roy Cooper | Stop GOP deception and liesAd secure.actblue.com Republicans have deceived all of North Carolina and these actions must have consequences. This disgrace to our democracy cannot stand.,political,Google
Mike Bloomberg | Official Website | MikeBloomberg.comAd mikebloomberg.com Visit Mike Bloomberg's official website.,political,Google
Mike Bloomberg | Meet Mike | Learn About Mike's WorkAd mikebloomberg.com Entrepeneur philanthropist and three-term mayor of New York City.,political,Google
Mike Bloomberg | Former Mayor of New York City | See Mike's Record of ProgressAd mikebloomberg.com/progress Read Mike's record of progress on jobs the environment education public health & more.,political,Google
Mike Bloomberg | Global Impact | Stay Up To DateAd mikebloomberg.com Stay up to date on the latest global initiatives from Mike & Bloomberg Philanthrophies.,political,Google
Mike Bloomberg | A Record of Progress | In New YorkAd mikebloomberg.com/progress Learn about Mike Bloomberg's record of progress as Mayor of New York City.,political,Google
2019 Global Business Forum | Where Gov't & Business Meet | September 25 2019Ad gbf.bloomberg.org World leaders come together to discuss the climate crisis economic instability & more.,political,Google
Moving Beyond Carbon | Read Mike Bloomberg's PlanAd beyondcarbon.org There is no time to waste in combatting the climate crisis.,political,Google
Moving Beyond Carbon | Read Mike Bloomberg's PlanAd beyondcarbon.org We can't wait for Washington  we need climate action now.,political,Google
Moving Beyond Carbon | Read Mike Bloomberg's PlanAd beyondcarbon.org We must accelerate the transition to a 100% clean energy economy.,political,Google
Beyond Carbon | Read Mike Bloomberg's PlanAd beyondcarbon.org We can't wait for Washington  we need climate action now.,political,Google
Beyond Carbon | Read Mike Bloomberg's PlanAd beyondcarbon.org There is no time to waste in combatting the climate crisis.,political,Google
Beyond Carbon | Read Mike Bloomberg's PlanAd beyondcarbon.org We must accelerate the transition to a 100% clean energy economy.,political,Google
43% Increase In Murder | Vote To Save Virginia | McAuliffe Is Too DangerousAd restorationofamerica.com/savevirginia Kid's futures are at stake. McAuliffe thinks parents shouldn't have a say in education. Virginia cannot afford another 4 years of Terry McAuliffe. Go vote to save our state!,political,Google
Want To Serve In The Military? | Then You Cannot Serve God | Says Raphael WarnockAd churchofwarnock.com In Raphael Warnocks church he says you cannot serve in the military and serve God.,political,Google
Ossoff Sides With The Squad | Chooses Hollywood Over You | Unsuited For GeorgiaAd unsuitedforgeorgia.com Jon Ossoff sides with AOC and other members of the squad over the people of Georgia. He is promising a radical transformation of America with the policies he supports.,political,Google
Church Of Warnock | We Don't Say God Bless America | Meet Our LeaderAd churchofwarnock.com In Raphael Warnocks church he sees America for what it really is.,political,Google
Ossoff Is Unsuited For Georgia | He's A Hollywood Liberal | Taking Orders From The SquadAd unsuitedforgeorgia.com Jon Ossoff is promising a radical transformation of America with the policies he supports.,political,Google
Ossoff Is Unsuited For Georgia | He Takes Orders From The Squad | Wants Taxpayer-Funded AbortionAd unsuitedforgeorgia.com Jon Ossoff is promising a radical transformation of America with the policies he supports.,political,Google
Ossoff Is Unsuited For Georgia | He Takes Orders From The Squad | Wants To Defund PoliceAd unsuitedforgeorgia.com Jon Ossoff is promising a radical transformation of America with the policies he supports.,political,Google
Request Your Ballot Today | Unable To Go Vote | We Need Strong GOP TurnoutAd restorationofamerica.com/gotv Request your absentee ballot today! It's an easy process and your vote matters. The Republican Party needs a strong turnout in 2020.,political,Google
Restoration PAC | Leading Conservative Super PAC | Join Us In The 2020 FightAd restorationofamerica.com Joe Biden lied about having 3 degrees when he ran for president back in 1988. Then he dropped out of the race! Watch our video on lying Biden's past.,political,Google
Restoration PAC | Leading Conservative Super PAC | Join Us In The 2020 FightAd restorationofamerica.com Our goal is to keep America conservative in 2020. Join the fight to bring about the policy changes needed to restore America's prominence.,political,Google
Restoration PAC | Leading Conservative Super PAC | Join Us In The 2020 FightAd restorationofamerica.com Did you see our ad during the CNN town hall? Watch the full spot here and get to know the real Joe Biden.,political,Google
Every Vote Matters | Request Your Ballot Now | We Need Strong GOP TurnoutAd restorationofamerica.com/gotv Calling all conservatives! Start early and request your ballot now. We need strong turnout in 2020!,political,Google
Joe Biden Was Unsuited Then | And Joe Biden Is Unsuited Now | Think You Know Joe's Past?Ad unsuited.org Joe Biden was unsuited when he ran for president back in 1988 and h'es unsuited in 2020. See Joe's past here and make your own decision.,political,Google
Joe Biden Lied About College | Then He Dropped Out In 1988 | Think You Know Joe's Past?Ad unsuited.org Joe Biden lied about having 3 degrees when he ran for president back in 1988. Then he dropped out of the race! See Joe's past here and make your own decision.,political,Google
Joe Biden Lied About College | He Does Not Have Three Degrees | Think You Know Joe's Past?Ad unsuited.org Joe Biden lied about having 3 degrees when he ran for president back in 1988. Then he dropped out of the race! See Joe's past here and make your own decision.,political,Google
John James For U.S. Senate | Ready To Stop The Madness | Watch NowAd restorationofamerica.com John James will help stop the madness in America. With a lifetime of military service he is ready to confront this challenge head on.,political,Google
Senator Gary Peters | Won't Stop The Madness | Watch NowAd restorationofamerica.com Peters doesnt have the backbone to stand up to the madness unfolding across America. Michigan needs an outsider in the U.S. Senate who can to stand up to the radicals.,political,Google
Fight the Anti-Life Agenda | Learn Joe Bidens Truth | Protect the UnbornAd catholicvote.org Catholics must fight the legislative agenda that supports destroying life in the womb. Joe Biden would force American Catholics to pay for abortions to appease the leftist mob.,political,Google
A Pro-Abortion Ticket | Fight Bidens Radical Views | Learn the TruthAd catholicvote.org Joe Biden and Kamala Harris are the most anti-life presidential ticket weve ever seen. Learn how Joe Biden is sacrificing his Catholic values to kneel before the leftist mob.,political,Google
All Life is Sacred | Learn the Truth | Biden Sacrificed His ValuesAd catholicvote.org Catholics everywhere know the indispensable truth: human life is sacred at every stage. Joe Biden will sacrifice his values and force Catholics in the U.S. to pay for abortions.,political,Google
Fight the Anti-Life Agenda | Protect the Unborn | Learn Joe Bidens TruthAd catholicvote.org Catholics must fight the legislative agenda that supports destroying life in the womb. Joe Biden would force American Catholics to pay for abortions to appease the leftist mob.,political,Google
MJ Hegar For Texas Senate | Air Force Vet. Working Mom. | She's Taken On Tough FightsAd mjfortexas.com Texans need a senator who'll protect their health care. That's MJ Hegar. MJ was shot during a medevac mission. She knows how important quality health care is.,political,Google
MJ Hegar For Texas Senate | Air Force Vet. Working Mom. | She'll Protect Health CareAd mjfortexas.com MJ Hegar is a working mom. She knows how important quality health care is to families. Texans need a senator who'll protect health care for people with pre-existing conditions.,political,Google
MJ Hegar For TX Senate | Working Mom. Air Force Vet. | She'll Defend Health CareAd mjfortexas.com MJ was shot during a medevac mission. She knows how important quality health care is. Texans need a senator who'll protect health care for people with pre-existing conditions.,political,Google
MJ Hegar For TX Senate | She'll Protect Health Care | Lower Drug CostsAd mjfortexas.com MJ was shot during a medevac mission. She knows how important quality health care is. Texans need a senator who'll defend their health care. That's MJ Hegar.,political,Google
Cornyn: Out Of Touch | 30 Years In Washington | MJ Hegar Will Fight For TexansAd mjfortexas.com John Cornyn has spent 30 years in politics. He's taken $12 million from special interests. Texas deserves a senator like MJ Hegar. She'll stand up for Texas values.,political,Google
Cornyn: 30 Years In Politics | $12M From Special Interests | No Wonder He's Out Of TouchAd mjfortexas.com Sen. Cornyn has spent 30 years in politics. He's taken $12 million from special interests. He only looks out for the special interests. Texas deserves better.,political,Google
Cornyn: 30 Years In Washington | $12M From Special Interests | No Wonder He's Out Of TouchAd mjfortexas.com Unlike Sen. Cornyn MJ Hegar won't fight for special interests. She'll fight for Texas. Sen. Cornyn only looks out for the special interests. We deserve better.,political,Google
Sen. Cornyn's Ratings Are Low | The TX Senate Race Is Close | Donate to Team MJ TodayAd secure.actblue.com Sen. John Cornyn's approval ratings are underwater and polls show we can beat him. With 34% of voters undecided this is anyone's race. Chip in to help us reach voters!,political,Google
MJ Hegar Can Beat Sen. Cornyn | Donate to MJ's Campaign Today | Help MJ Flip Texas in NovemberAd secure.actblue.com Texas is the nation's biggest battleground state and Sen. Cornyn's ratings are underwater. MJ Hegar can win this race but we need you with us. Chip in to help us reach voters!,political,Google
Big News: MJ Won The Runoff | The TX Senate Race Is Close | Donate To Flip the SenateAd secure.actblue.com The path to flipping the Senate runs through Texas the country's biggest battleground. Polls show MJ can win but we need to be able to reach undecided voters. Chip in today!,political,Google
MJ Hegar Will Fight For Us | She'll Protect our Health Care | Donate to Team MJ TodayAd secure.actblue.com Health care is at risk: Sen. Cornyn voted 20 times to gut health care access for millions. Pitch in to help elect a senator who will fight to get every Texan the care they need.,political,Google
Texas Is A Battleground State | This Race Will Be Close | Donate to Team MJ TodayAd secure.actblue.com We can flip Texas this year. Polls show a single-digit race and Sen. Cornyn's approval ratings are underwater. Donate to ensure Team MJ has the resources needed to win!,political,Google
Big News: MJ Won The Runoff | It's Time To Beat Sen. Cornyn | Donate to Team MJ TodayAd secure.actblue.com MJ Hegar has won the runoff and is ready take on Sen. Cornyn! Polling shows MJ can win. Chip in to defeat the Senator who has voted 20 times to gut our access to health care.,political,Google
Sen. Cornyn Sold Texans Out | He Fights For DC Interests | Donate to Team MJ TodayAd secure.actblue.com Sen. John Cornyn has spent 18 years in Washington putting special interests first. 34% of the voters undecided: this is anyone's race. Chip in to help us reach voters!,political,Google
MJ Hegar Can Beat Sen. Cornyn | Join Team MJ Today | Help MJ Flip Texas in NovemberAd secure.mjfortexas.com Texas is the nation's biggest battleground state and Sen. Cornyn's ratings are underwater. MJ Hegar can win this race but we need you with us. Join Team MJ today!,political,Google
Big News: MJ Won The Runoff | The TX Senate Race Is Close | Join Us To Flip the SenateAd secure.mjfortexas.com The path to flipping the Senate runs through Texas the country's biggest battleground. Polls show MJ can win but we need to keep building our grassroots campaign. Join us today!,political,Google
MJ Hegar Will Fight For Us | She'll Protect our Health Care | Join Team MJ TodayAd secure.mjfortexas.com Health care is at risk: Sen. Cornyn voted 20 times to gut health care access for millions. Join Team MJ to elect a senator who will fight to get every American the care they need.,political,Google
Join Team MJ To Flip Texas | Polls Show a Close Race | Cornyn Ratings UnderwaterAd secure.mjfortexas.com We can flip Texas this year. Polls show a single-digit race and Sen. Cornyn's approval ratings are underwater. MJ Hegar can win this race but we need you with us. Sign up!,political,Google
Sen. Cornyn Sold Texans Out | He Fights For DC Interests | Join Team MJ To Beat CornynAd secure.mjfortexas.com Sen. John Cornyn has spent 18 years in Washington putting special interests first. It's time to elect a senator who puts us first. Join Team MJ Hegar and help us flip Texas.,political,Google
